id,pr_number,user,created_at,body
1959375642,242,RedDevel2,2024-02-22T12:39:34Z,throws an error when trying to open /ja gui snitch logs. :crying_face:
1960422311,242,RedDevel2,2024-02-22T22:21:41Z,works now :thumbs_up:
1962423985,329,okx-code,2024-02-24T17:04:32Z,can you explain what this does
1962425218,329,AngrySoundTech,2024-02-24T17:09:44Z,"this pr enables checks automatically to run on all prs, which will run `gradle check`, and `yamllint` (errors currently ignored until we fix them all). you can see the checks ran on this pr as a requirement before merging, taking 1 minute to ensure that the project builds, tests pass, and yaml files are formatted correctly (which will be more important especially when plugin config gets moved here). if we add code style checks and such to gradle, that will also be part of the check task it also adds a workflow that comments with an easy link to the built artifact on the pr for testing, the output of which can be seen here: [a link] once this is merged that will start working, since the workflow needs to be on `main`"
1974157824,345,okx-code,2024-03-02T01:16:25Z,yep you're right
2001785875,375,Protonull,2024-03-16T05:54:39Z,semi-duplicate of #339
2001798964,375,okx-code,2024-03-16T06:02:19Z,i missed that one
2008021978,374,okx-code,2024-03-19T20:03:47Z,"you're right, exploding anchors needs to be disabled, but it doesn't defeat the point of the hack as it would still work in the nether."
2415063940,580,okx-code,2024-10-15T20:47:17Z,what is this for?
2433051998,580,MrJeremyFisher,2024-10-23T18:13:39Z,the pearl error soundtech posted in dev-nook a while ago. [a link] was hoping to catch whatever pearl is causing the issue.
1975001634,354,MrJeremyFisher,2024-03-03T02:55:19Z,"guess so, not sure what happened. thanks."
2176901832,393,Protonull,2024-06-18T20:21:18Z,"this does make junit testing more [a link], but the item tests fail due to changes to all the server internals. will convert this to a draft until something better comes along."
2285382281,393,Protonull,2024-08-13T05:44:13Z,closing this in favour of this: [a link]
2305219708,604,okx-code,2024-08-22T16:53:05Z,what is the use case for adding copper
2305228686,604,kickylol,2024-08-22T16:57:58Z,personally i use copper ore as a compact way to store it since using fortune on it can give you up to 20 raw copper at a time.
2305222020,577,okx-code,2024-08-22T16:54:27Z,could you resolve the merge conflicts and i will merge
2306062611,577,Protonull,2024-08-23T02:20:40Z,done
2321320896,615,okx-code,2024-08-30T13:48:23Z,why do we have so many random utility classes wtf
2321361790,615,Protonull,2024-08-30T14:02:05Z,"these `more*` classes are entirely my fault :p it's a mixture of me being younger and dumber, minecraft/paper having fewer useful shaded dependencies, and java having fewer static utilities. for example, [a link] was only added in java 21. [a link] was added in java 9, but we only stopped compiling against java 8 in [a link]."
2532750867,671,okx-code,2024-12-10T20:03:18Z,"this would be much better served as a luckperms context, not a permission imo"
2564771465,671,AngrySoundTech,2024-12-29T16:16:21Z,"rejecting this. we review and accept changes from humans who have put in the effort, not ethically dubious untested and unreviewed changes generated with ai."
2195998757,392,Protonull,2024-06-28T02:35:02Z,"hmmm, starting to wonder whether this refactor is moot: the server is just the compiled output of this monorepo; there'll *never* be a question over whether namelayer, or citadel, or jukealert, is missing, unless we delete those plugins from the monorepo... which is unlikely. in addition, okx has said that we should stop pretending that we aren't the only ones who consume our apis ([a link], and soundtech has said that all changes must be tested with a local docker instance ([a link] because it replicates the server as closely as possible. with these things in mind, i'm wondering whether it'd be better to yeet this boilerplate altogether and convert all our soft-dependencies into hard-dependencies."
2331545819,392,Protonull,2024-09-05T12:46:26Z,closing due to a [a link] of [a link].
2103534933,497,AngrySoundTech,2024-05-09T22:26:19Z,"this should be good, but i didn't want to hijack the test server from 1.20 to test it too hard. we can merge it, merge it up to 1.20, and then test it and make any fixes as needed."
2109108206,535,Protonull,2024-05-14T01:32:06Z,"given how fraught with bugs combat loggers have been, it might be worth looking into custom paper patches. these issues all stem from combattagplus being a plugin, and so its approach can only be to duplicate the player entity upon logout. but this has led to many, *many* bugs, including dupes, because combat-loggers are consequential: they're meant to *be* the player. whereas, if combat loggers were implemented through patches (or mixins), you wouldn't need to create a duplicate entity. you could just prevent the server from deleting the player-entity when they logout. there'd likely still be issues to iron out, but having the same entity to work with would be a lot easier than playing whack-a-mole with these combat-logger bugs."
2425171355,645,RedDevel2,2024-10-20T18:33:43Z,this just updates the /chunklimits list. you'll have to change it in the insights config too.
2429403467,649,RedDevel2,2024-10-22T14:11:38Z,also change /g ! dogfact to more understandable /global command
2408029049,635,Protonull,2024-10-11T19:45:40Z,"this would force `gradlew.bat` to use lf endings, making it unusable on windows."
2408034488,635,Huskydog9988,2024-10-11T19:50:05Z,"forgot about that, will add an exemption"
2114321810,396,Protonull,2024-05-16T07:54:02Z,"this'll be resolved with 1.20.5 with the help of item components. it only currently means displaying an durability bar on the item stack, but hopefully mojang will expand support so that combat damages any item with a damageable component, rather than just predefined items. ![a link] ![a link]"
2306103036,396,Protonull,2024-08-23T03:15:01Z,"now that civmc is on >=1.21, i've switched this from using pdcs to using `damageable`, though this should be switched out for [a link] at the earliest opportunity."
2585389792,719,AngrySoundTech,2025-01-11T19:52:29Z,"outline of development process, need feedback before tidying the writing."
2632391657,752,okx-code,2025-02-03T23:15:34Z,"actually it should be more like 16 -> 20, this is still net negative with the charcoal cost"
2405279274,611,RedDevel2,2024-10-10T14:37:16Z,already done
2644129671,735,okx-code,2025-02-07T21:07:14Z,"i don't think this is the right direction to go for working around rules limitations, it's better to change the rules."
2644134081,735,Protonull,2025-02-07T21:10:09Z,"the problem is that, in my opinion, it's very difficult if not impossible to reword the rules to include these things but also don't accidentally include baritone."
2644126936,670,okx-code,2025-02-07T21:05:24Z,make this disabled by default and i'll merge it
2644304434,670,Protonull,2025-02-07T23:17:26Z,done
1957889522,272,okx-code,2024-02-21T20:51:46Z,good enough
1958451280,279,okx-code,2024-02-22T00:34:34Z,thanks!
1952545406,235,RedDevel2,2024-02-19T14:17:51Z,very nice :thumbs_up:
2016604915,388,okx-code,2024-03-23T21:15:48Z,i don't think either of your race conditions will happen because `getchunkcoord`also has a `synchronised (metas)` before interacting with the `metas` map.
2021216587,362,Huskydog9988,2024-03-26T18:44:35Z,superseded by #387
