repository,file_type,id,pr_number,body,distilbert_sentiment_label,codebert_sentiment_label,deberta_sentiment_label,distilbert_confidence,codebert_confidence,deberta_confidence,majority_label,final_decision,decision_reason,manual_label
elementary/terminal,reviews,180878121,330,some initial comments on the code.,0,0,0,0.9849751591682434,0.9800631999969482,0.9904136061668396,0.0,accept,unanimous_agreement,2
elementary/terminal,reviews,418595475,330,"i can't confirm that this ever shows ""open in web browser"", and it seems to also break opening in the file browser. i left some other inline comments",0,0,0,0.948481261730194,0.6206713318824768,0.9850918650627136,0.0,accept,unanimous_agreement,2
elementary/terminal,reviews,425649804,330,seems to work as expected now. nice job! left some comments/questions in line,1,1,1,0.9932780861854552,0.9955435395240784,0.9962406158447266,1.0,accept,unanimous_agreement,2
elementary/terminal,reviews,667969170,584,"the code looks good to me! it solves both linked issues. and even though the callback of the `contents_changed` signal is called multiple times per second when using the terminal, i can't measure any performance differences.",1,1,1,0.989629089832306,0.9942861199378968,0.9944275617599488,1.0,accept,unanimous_agreement,2
elementary/terminal,reviews,290621413,386,"i think you accidentally mixed up the values of the event macros. just out of curiosity, what is the advantage to use these macros over `true/false`?",0,0,0,0.8912913799285889,0.8869348764419556,0.967653214931488,0.0,accept,unanimous_agreement,2
elementary/terminal,reviews,414709881,505,"i'm :-1: to add a new ""sync"" setting here. i think the new behavior will work how most people expect. for those who want a larger default zoom for all tabs, they can set it once and forget it. for someone who wants to zoom in and out on a specific tab, this will work for them as well.",0,0,-1,0.9199957847595216,0.6127551198005676,0.9897425174713136,0.0,accept,majority_agreement,2
elementary/terminal,reviews,523695115,505,behavior-wise i think this makes sense. just a couple of code style/readability things.,0,0,0,0.9712387919425964,0.8641582727432251,0.795443594455719,0.0,accept,unanimous_agreement,2
elementary/terminal,reviews,524566641,505,"hm, installing this on elementary os 6, it defaulted to 25% zoom the next time i opened terminal. this is reproducible by setting `/io/elementary/terminal/saved-state/tab-zooms` to the default, then re-opening terminal. i _think_ my suggested change will resolve that by defaulting to 1.0.",0,0,0,0.986855149269104,0.9823718667030334,0.9755702018737792,0.0,accept,unanimous_agreement,2
elementary/terminal,reviews,526677246,505,i'm generally happy with this ux-wise. i would still like to get a code review from /desktop-developers though.,1,1,1,0.8719382286071777,0.9689114689826964,0.9572646617889404,1.0,accept,unanimous_agreement,2
elementary/terminal,reviews,1703785760,742,this is mostly working - thanks! a couple of issues: - changing the default font with ` scroll` does not change settings because at the moment the terminal widget changes the font directly. you need to change the scroll handler to activate the relevant window action instead. - i suggest you split the `save_opened_terminals` function up so that you can change the zooms and uris settings independently to save unnecessary work being done.,1,1,1,0.9826924800872804,0.9848297238349916,0.9799405932426452,1.0,accept,unanimous_agreement,2
elementary/terminal,reviews,1704740371,742,you seem to have repeated a lot of code in `save_open_terminals_with_zooms`? can you just call the split functions? adding another signal to the terminal widget is not the best solution - you can just activate the appropriate action in the scroll handler instead of calling `increment_size` and `decrement_size`. this can be done with code like `window.get_simple_action (mainwindow.action_zoom_font_in).activate (null);` (other examples of this pattern are already used in the code) i have made a couple of other comments inline.,0,0,0,0.9738070964813232,0.9922915101051332,0.9916724562644958,0.0,accept,unanimous_agreement,2
elementary/terminal,reviews,1708630934,742,i think this is good to go now - thanks for your contribution!,1,1,1,0.9821571111679076,0.9784956574440002,0.9855944514274596,1.0,accept,unanimous_agreement,2
elementary/terminal,reviews,1708658939,742,"sorry, missed the fact that one of the unit tests now fails (ci was failing anyway in other prs for an unrelated reason). the error given is [code block] not immediately obvious why this pr should affect the number of tabs - i'll investigate.",-1,-1,-1,0.9843346476554872,0.9702364206314088,0.9759746193885804,-1.0,accept,unanimous_agreement,2
elementary/terminal,reviews,487961116,542,"hey thanks for working on this! this is looking really good and it's definitely a highly requested feature so i appreciate you tackling it. i left some inline comments with some minor code cleanups and copy changes alignment etc. i agree that the long combobox here is pretty unweildy. perhaps instead of trying to include as many styles as we can find, it would be better to have some kind of import mechanism and stick with the same 3 default styles for now. perhaps in the interest of getting this feature merged more quickly, we should reduce the scope of this branch to only supporting a single custom style and we can expand in later follow-up branches i think a major interaction issue we have here is that if you ever switch away to another style, your custom style gets wiped. this seems like it would be pretty frustrating for someone who switches between styles. i imagine we should probably persist custom styles in gsettings. maybe with a ""styles"" child schema, even if we only support saving one custom style for now yes i think we want to maintain the behavior of a style also setting the window chrome to dark or light. the quick style switcher should make it really easy to alternate between styles without having to fiddle with individual settings every time",1,1,1,0.9867620468139648,0.995086133480072,0.9958641529083252,1.0,accept,unanimous_agreement,2
elementary/terminal,reviews,73584841,160,"some changes are needed to make this work see comments in line. at the moment, first change of zoom factor results in a microscopic font and changes are not reflected in settings.",0,0,0,0.9838729500770568,0.9816682934761048,0.988681435585022,0.0,accept,unanimous_agreement,2
elementary/terminal,reviews,73590468,160,a couple more suggestions but looking good :),1,1,1,0.9841986894607544,0.9958529472351074,0.9252657294273376,1.0,accept,unanimous_agreement,2
elementary/terminal,reviews,74283979,160,almost there ;-). just a couple of minor points.,1,1,1,0.5592333078384399,0.9880337119102478,0.9897922277450562,1.0,accept,unanimous_agreement,2
elementary/terminal,reviews,74288717,160,looks good and works as expected :-),1,1,1,0.9900259971618652,0.9956607222557068,0.9801400303840636,1.0,accept,unanimous_agreement,2
elementary/terminal,reviews,52167871,125,"thank you for submitting the branch! it would be ideal if you could split these 2 changes into 2 different pr's? the diff looks clean but i would still like those to be their own prs. i have commented on the diff, two small things. one is a question, you could answer in the diff itself.",1,1,1,0.9781021475791932,0.9881723523139954,0.9923431277275084,1.0,accept,unanimous_agreement,2
elementary/terminal,reviews,53084949,125,i think the contents of this signal should be in a separate function like `handle_paste_event ()` that should return a boolean value since this code is now duplicated in two different places. then you could just replace those duplicates with: `return handle_paste_event ()`.,0,0,0,0.989791214466095,0.9927260875701904,0.9881191849708556,0.0,accept,unanimous_agreement,2
elementary/terminal,reviews,56700609,125,3 things.,0,0,0,0.9641130566596984,0.9774726629257202,0.9528241157531738,0.0,accept,unanimous_agreement,2
elementary/terminal,reviews,65269786,125,"one minor code style comment, otherwise looks good.",1,1,1,0.84925776720047,0.7752756476402283,0.6693810224533081,1.0,accept,unanimous_agreement,2
elementary/terminal,reviews,65604612,125,looks good.,1,1,1,0.8799164891242981,0.9723142385482788,0.6773717999458313,1.0,accept,unanimous_agreement,2
elementary/terminal,reviews,2133409334,760,it looks like zoom controls are broken with this branch: ![a link],-1,0,1,0.9739984273910522,0.751010000705719,0.825160026550293,,review,no_majority_disagreement,0
elementary/terminal,reviews,2157583050,760,"the tests look alright, the last fail is not consistent, and i believe there's no way to get the ci's coredumps to understand what happened there, sadily.",-1,-1,-1,0.9785672426223756,0.9876108765602112,0.9951134324073792,-1.0,accept,unanimous_agreement,2
elementary/terminal,reviews,2186416884,760,lgtm :tada:,0,0,1,0.9406688213348388,0.7522225975990295,0.9431537985801696,0.0,accept,majority_agreement,2
elementary/terminal,reviews,1119398946,687,i have suggested some corrections to remaining lint.,0,0,0,0.9817302227020264,0.9839866161346436,0.9924433827400208,0.0,accept,unanimous_agreement,2
elementary/terminal,reviews,1119432156,687,another small bug is that if cyclic search is off and you navigate to the last found term so that the `next` button becomes insensitive and then toggle cyclic search on then the sensitivity of the `next` button does not change - it should become sensitive. a fix for this would be to emit a `search-changed` signal whenever the cyclic search is toggled.,0,0,0,0.9246788620948792,0.96653014421463,0.983405351638794,0.0,accept,unanimous_agreement,2
elementary/terminal,reviews,200872214,265,"one comment, otherwise it's fine.",0,0,0,0.9502583742141724,0.9620017409324646,0.9843040108680724,0.0,accept,unanimous_agreement,2
elementary/terminal,reviews,257194642,265,contains conflicts.,0,0,0,0.877623975276947,0.8256924748420715,0.906405508518219,0.0,accept,unanimous_agreement,2
elementary/terminal,reviews,267432068,265,one more comment.,0,0,0,0.9650285243988036,0.9514726400375366,0.9891902208328248,0.0,accept,unanimous_agreement,2
elementary/terminal,reviews,338922307,265,can you please add changes to appdata :),1,1,0,0.9425731897354126,0.9606457948684692,0.9937459230422974,1.0,accept,majority_agreement,2
elementary/terminal,reviews,338929633,265,one change.,0,0,0,0.9782569408416748,0.9737234711647034,0.9712346196174622,0.0,accept,unanimous_agreement,2
elementary/terminal,reviews,1029031083,662,"two small questions, but other than that totally happy with this as an initial implementation. let's get this in and then smooth out the flow a little bit/do other features in future branches",0,1,1,0.495785653591156,0.5909509658813477,0.9684486389160156,1.0,accept,majority_agreement,2
elementary/terminal,reviews,1029169096,662,one suggestion and a comment,0,0,0,0.9822695851325988,0.965970516204834,0.9876299500465392,0.0,accept,unanimous_agreement,2
elementary/terminal,reviews,1030479374,662,yeah it's just a little bit less destructive. this looks good!,1,1,1,0.9881145358085632,0.994489312171936,0.9904234409332277,1.0,accept,unanimous_agreement,2
elementary/terminal,reviews,372070632,486,"hey thanks for looking into this issue! i've left a couple of inline comments. one other thing that i noticed is that the button is always sensitive regardless of whether a process is running or not. we probably want to make sure to set the button as insensitive unless there is a running process to terminate also, this seems like a place where we should use [a link] and provide the keyboard shorcut",1,1,1,0.9441730976104736,0.9807079434394836,0.9906414151191713,1.0,accept,unanimous_agreement,2
elementary/terminal,reviews,36649023,87,awaiting those changes :smile:,1,1,1,0.7569507360458374,0.9909566044807434,0.9942697286605836,1.0,accept,unanimous_agreement,2
elementary/terminal,reviews,36649429,87,ux approval. should probably have someone more experienced in vala take a second look at the code.,0,0,0,0.966693878173828,0.943699061870575,0.9711631536483764,0.0,accept,unanimous_agreement,2
elementary/terminal,reviews,36650363,87,"i'm not super excited about these variable names. i think stuff like ""sb"" and ""t"" becomes very very unclear the further away you get from where they are defined",-1,-1,-1,0.9663083553314208,0.9860791563987732,0.9104907512664796,-1.0,accept,unanimous_agreement,2
elementary/terminal,reviews,2412625317,798,lets go!,1,1,0,0.6811153292655945,0.5206211805343628,0.5124242305755615,1.0,accept,majority_agreement,2
elementary/terminal,reviews,1821696546,743,lgtm.,0,0,0,0.9832575917243958,0.968936800956726,0.9637624621391296,0.0,accept,unanimous_agreement,2
elementary/terminal,reviews,683185846,595,one small string change :),1,1,0,0.8954355120658875,0.9930578470230104,0.9922935962677002,1.0,accept,majority_agreement,2
elementary/terminal,reviews,683632295,595,"the code is looking much better, good job! if everybody else is happy, i think we can merge it.",1,1,1,0.9926669001579284,0.9950461387634276,0.9969807267189026,1.0,accept,unanimous_agreement,2
elementary/terminal,reviews,279277044,397,works on my system!,0,1,0,0.5404961109161377,0.8620592355728149,0.9373030066490172,0.0,accept,majority_agreement,2
elementary/terminal,reviews,280929192,397,"code wise it looks good to me, but i haven't had a chance to compile and test it (and won't be able to this week) if you can get someone else to test it as well that would be great :) but i'm removing my ""needs changes"" to not be a blocker. if no one else checks it by next week, i'll give it a look once i'm back home :)",1,1,1,0.9890081882476808,0.9954492449760436,0.99612158536911,1.0,accept,unanimous_agreement,2
elementary/terminal,reviews,279288230,397,a few bits to change,0,0,0,0.9858700037002563,0.9447381496429444,0.9874339699745178,0.0,accept,unanimous_agreement,2
elementary/terminal,reviews,692993658,602,this pr causes a regression in showing the path as the window title under normal conditions. i've added suggestions as to how to fix this. i am not sure whether you need to check whether current_working_directory is something valid but it is probably safer to test this and use terminalwidget.default_label as an ultimate fallback.,0,0,0,0.94114488363266,0.8593056797981262,0.989349603652954,0.0,accept,unanimous_agreement,2
elementary/terminal,reviews,748279666,602,allows setting window title from commandline without affecting tab labelling. thanks!,1,1,1,0.9785295724868774,0.9824746251106262,0.9621328115463256,1.0,accept,unanimous_agreement,2
elementary/terminal,reviews,393976345,504,"as you say, it is still a bit hacky but better than the alternative ;-) thanks. i made a couple of comments on the code.",1,1,1,0.988591730594635,0.995017945766449,0.9943630695343018,1.0,accept,unanimous_agreement,2
elementary/terminal,reviews,560534993,556,"left one copy change, but it makes me wonder: should this just be part of the unsafepastedialog? much of the copy and ui would be the same; the only difference would be the title and possibly the setting we bind to, if we want it to be a separate setting.",0,0,0,0.8425203561782837,0.854769229888916,0.9483627676963806,0.0,accept,unanimous_agreement,2
elementary/terminal,reviews,676800855,556,made a few suggestions but it would be good to progress this if possible - thanks.,1,1,1,0.9041435122489928,0.9795158505439758,0.9163719415664672,1.0,accept,unanimous_agreement,2
elementary/terminal,reviews,1773781882,753,"a litte suggestion with gtk4 in mind. also, a pior art in this case is epiphany, that `pack_end()` a gtk.button that trigger the fullscreen action and is only visible when fullscreened. something like this should be simple to do here too.",0,0,0,0.9782111644744872,0.8092033267021179,0.9898501634597778,0.0,accept,unanimous_agreement,2
elementary/terminal,reviews,1833797236,753,"works as expected, nice job!",1,1,1,0.9911263585090636,0.9960357546806335,0.9961552023887634,1.0,accept,unanimous_agreement,2
elementary/terminal,reviews,672748002,590,good cleanup. just a couple of very minor comments.,1,1,1,0.9174463152885436,0.980286180973053,0.9691518545150756,1.0,accept,unanimous_agreement,2
elementary/terminal,reviews,675362566,590,removing the gtk_menu_bar_accel override should be safe enough i guess - it isn't used elsewhere in elementary or within terminal. i guess it is to be sure that terminal programs like `htop` can be exited with it.,0,0,0,0.9865002036094666,0.9871928691864014,0.9898804426193236,0.0,accept,unanimous_agreement,2
elementary/terminal,reviews,2411206425,794,"the clipboard or dragged text are no longer pasted if we once uncheck ""show paste protection warnings"" in the unsafepastedialog.",0,0,0,0.9740784764289856,0.9858753085136414,0.9937534928321838,0.0,accept,unanimous_agreement,2
elementary/terminal,reviews,2415840615,794,"confirmed this is fixed, thank you! leaving another two tiny comments.",1,1,1,0.9688549637794496,0.9898058772087096,0.9931071400642396,1.0,accept,unanimous_agreement,2
elementary/terminal,reviews,2421105723,794,code looks good and fixes the linked issue. thank you!,1,1,1,0.9869288206100464,0.995595395565033,0.994795262813568,1.0,accept,unanimous_agreement,2
elementary/terminal,reviews,267238797,390,don't forget to update the color buttons. at the moment this gets reverted if you change the color scheme,0,0,0,0.9774032235145568,0.9823997020721436,0.9909902811050416,0.0,accept,unanimous_agreement,2
elementary/terminal,reviews,297405365,390,"works fine, but i think at least the color radio button should be updated to match.",0,0,0,0.903544545173645,0.9729202389717102,0.976477324962616,0.0,accept,unanimous_agreement,2
elementary/terminal,reviews,297725426,390,"lgtm, does this need more ux discussion?",0,0,0,0.9869974851608276,0.9736918210983276,0.9930128455162048,0.0,accept,unanimous_agreement,2
elementary/terminal,reviews,195298189,349,"we are actually deprecating the use of granite.settings, and specially since it's just one setting you should just use glib.settings instead. also make sure you check if the schema exists to prevent crashes if things change in the future or if it's used in a different os",0,0,0,0.9746408462524414,0.9690996408462524,0.9922122955322266,0.0,accept,unanimous_agreement,2
elementary/terminal,reviews,266290658,349,works as described. :+1:,0,0,1,0.571122407913208,0.5607906579971313,0.9952436089515686,0.0,accept,majority_agreement,2
elementary/terminal,reviews,162646033,299,"code looks good, thanks for the contribution! i think lastly we should drop the translation changes from this pr to prevent merge conflicts with master. it also makes this diff much easier for other contributors to review. once this is merged, we can push the updated translations.",1,1,1,0.9900533556938172,0.9924913048744202,0.9946770668029784,1.0,accept,unanimous_agreement,2
elementary/terminal,reviews,162938730,299,looks good! thanks for the contribution. is this safe to merge with a string change since there was a recent release?,1,1,1,0.9915679097175598,0.9930278658866882,0.995171844959259,1.0,accept,unanimous_agreement,2
elementary/terminal,reviews,254210876,382,"there is a problem if the window scaling is > 1. the menu is truncated. this affects both menu.popup_at_widget () and menu.popup_at_rect () - but does not affect menu.popup_at_pointer (). not sure why. maybe an upstream bug? if so, we will have to use popup_at_pointer for now.",0,0,0,0.926625907421112,0.8616417646408081,0.9537333250045776,0.0,accept,unanimous_agreement,2
elementary/terminal,reviews,1498974460,699,found a regression: changes in font size are not restored after closing and reopening the app.,0,0,0,0.9712097644805908,0.9479463696479796,0.981462836265564,0.0,accept,unanimous_agreement,2
elementary/terminal,reviews,1545018942,699,"code looks good, no regressions or new terminal warnings seen.",1,0,0,0.6103160381317139,0.6358684301376343,0.54645174741745,0.0,accept,majority_agreement,2
elementary/terminal,reviews,48514733,119,"yay! this seems to work well. tested across lodpi, hidpi, and multiple displays. i am going to request someone else spot-checks the code, but ux-wise i'm :+1:",1,1,1,0.9868266582489014,0.9851679801940918,0.9959165453910828,1.0,accept,unanimous_agreement,2
elementary/terminal,reviews,90065827,196,couple of formatting issues and some suggested simplifications.,0,0,0,0.9752207398414612,0.970781683921814,0.9815465807914734,0.0,accept,unanimous_agreement,2
elementary/terminal,reviews,90301616,196,works ok - just one question (see inline),0,0,0,0.9779462814331056,0.9026347398757936,0.9300816059112548,0.0,accept,unanimous_agreement,2
elementary/terminal,reviews,334886778,423,"this seems to ""do the thing"". i think we can continue discussion about the custom font setting and whether to expose it or remove it in another issue :)",1,1,1,0.800700843334198,0.9774636626243592,0.6117540597915649,1.0,accept,unanimous_agreement,2
elementary/terminal,reviews,538051716,477,left a question inline :) what's the best way to test this?,1,1,1,0.9662495851516724,0.9860005974769592,0.9933086633682252,1.0,accept,unanimous_agreement,2
elementary/terminal,reviews,790761404,633,this only works as expected after changing the settings. this is because the settings still contain the alpha value until they are changed and these do not match the strings in code when constructing the color buttons - so the wrong color button appears active. one way round this is to test for the foreground color instead as that has not changed. also to move the test *after* you have connected the color-button clicked handlers so that the new background colors get written to settings. in the longer term it would be better to move to methodology like code where a named style-scheme is saved in settings rather than the actual colors.,0,0,0,0.98319673538208,0.9907842874526978,0.9895312786102296,0.0,accept,unanimous_agreement,2
elementary/terminal,reviews,959437136,658,"the code in `action_close_terminal` results in the window closing regardless of the response to the dialog. however, there is a simpler solution. just call `close ()` on the window which will result in the `delete_event` handler running which will correctly save the state and check for foreground processes.",0,0,0,0.9883171916007996,0.9944831728935242,0.9936020970344543,0.0,accept,unanimous_agreement,2
elementary/terminal,reviews,959456673,658,make sense,0,0,0,0.9631345272064208,0.9401010274887084,0.9741621613502502,0.0,accept,unanimous_agreement,2
elementary/terminal,reviews,2528882757,836,"if we remove the unnecessary cast against `n_pages` here, we can remove the following places too ~~, excepting the cast against the result of `focus.clamp ()`~~ : [code block]",0,0,0,0.9886190891265868,0.9913280606269836,0.9950056672096252,0.0,accept,unanimous_agreement,2
elementary/terminal,reviews,2530838448,836,lgtm and works as expected. thank you for your fix!,1,1,1,0.9894279837608336,0.9952110648155212,0.9891843795776368,1.0,accept,unanimous_agreement,2
elementary/terminal,reviews,86155965,185,see inline comments. some maybe without the scope of this pr.,0,0,0,0.982864260673523,0.9875170588493348,0.993639886379242,0.0,accept,unanimous_agreement,2
elementary/terminal,reviews,168667921,262,ux approval from me. this is a nice feature!,1,1,1,0.9911653399467468,0.9962557554244996,0.9944543242454528,1.0,accept,unanimous_agreement,2
elementary/terminal,reviews,168711960,262,a few things to do then it should be alright,0,0,0,0.9361762404441832,0.9162726402282716,0.8004663586616516,0.0,accept,unanimous_agreement,2
elementary/terminal,reviews,175950678,262,"looks clean and works nicely, an approve from me.",0,1,1,0.558174192905426,0.6614617705345154,0.9685273170471193,1.0,accept,majority_agreement,2
elementary/terminal,reviews,256038266,375,i have a couple of comments.,0,0,0,0.9814463257789612,0.8905622959136963,0.984853744506836,0.0,accept,unanimous_agreement,2
elementary/terminal,reviews,256552678,375,one more comment.,0,0,0,0.9650285243988036,0.9514726400375366,0.9891902208328248,0.0,accept,unanimous_agreement,2
elementary/terminal,reviews,1749225842,749,i have left some inline comments. everything else seems ok but i'll test a but more later.,0,0,0,0.9711303114891052,0.9465988874435424,0.904208779335022,0.0,accept,unanimous_agreement,2
elementary/terminal,reviews,1750234802,749,"the ""copy last output"" and ""scroll to last command"" actions are not triggered by the keyboard (but the former is triggered by the context menu option). something to do with the ""key pressed"" handler i think.",0,0,0,0.988446831703186,0.9935560822486876,0.9913029670715332,0.0,accept,unanimous_agreement,2
elementary/terminal,reviews,1753382925,749,its a pity this change turned out to be less straightforward than anticipated and a somewhat non-obvious workround is required to avoid breaking some actions. however this all seems to work now. so i guess it can be merged. maybe possible to refactor simplify later?,-1,1,-1,0.9772802591323853,0.4860330522060394,0.9664509892463684,-1.0,accept,majority_agreement,2
elementary/terminal,reviews,1347545613,710,there seems to be a regression in that quitting with the quit action now does not save tabs. reopening just restores the home tab.,0,0,0,0.8961789011955261,0.9754972457885742,0.9655297994613647,0.0,accept,unanimous_agreement,2
elementary/terminal,reviews,1368062255,710,"no regressions found, but the ci is currently failing on tests",0,0,0,0.9739207029342652,0.8920566439628601,0.9632954597473145,0.0,accept,unanimous_agreement,2
elementary/terminal,reviews,2298037519,786,"for some reason accelerators aren't working correctly here. keypad accels work, but ctrl + and ctrl - do not",0,0,-1,0.8238903880119324,0.9354236721992492,0.6600812077522278,0.0,accept,majority_agreement,2
