repository,file_type,id,pr_number,body,distilbert_sentiment_label,codebert_sentiment_label,deberta_sentiment_label,distilbert_confidence,codebert_confidence,deberta_confidence,majority_label,final_decision,decision_reason,manual_label
elementary/terminal,reviews,2479266580,813,i am going to approve this as within session functionality is still an improvement,0,0,0,0.960623264312744,0.9366042613983154,0.9589462876319884,0.0,accept,unanimous_agreement,2
elementary/terminal,reviews,86627367,190,works as expected but possibly excessive calls to save tabs when nothing has changed.,0,0,0,0.9641664624214172,0.985145092010498,0.9460289478302002,0.0,accept,unanimous_agreement,2
elementary/terminal,reviews,95244368,180,"one tiny comment. can you elaborate what this change does? i mean, what internal or external effects does this have on the execution?",0,0,0,0.9762219786643982,0.9240041971206664,0.9760765433311462,0.0,accept,unanimous_agreement,2
elementary/terminal,reviews,75877992,165,gogo.,0,0,0,0.9363754987716676,0.9668399691581726,0.7790073156356812,0.0,accept,unanimous_agreement,2
elementary/terminal,reviews,76242676,165,one thing that could be fixed i think. the rest is fine.,0,0,0,0.9195516109466552,0.9494346380233764,0.8958730101585388,0.0,accept,unanimous_agreement,2
elementary/terminal,reviews,126140719,253,nice work! this mostly works but there are some warnings in terminal about: [code block] and it looks like sensitivity of these actions isn't always set correct (for example for copy),1,1,1,0.9899954795837402,0.9873273968696594,0.9960380792617798,1.0,accept,unanimous_agreement,2
elementary/terminal,reviews,126434967,253,works for me!,1,1,0,0.8834253549575806,0.9085758924484252,0.5590394735336304,1.0,accept,majority_agreement,2
elementary/terminal,reviews,478824005,533,works for me! i have not found any documented use of ` ` in bash or vte so :shrug: i am going to approve.,1,1,1,0.6365957260131836,0.9739357829093932,0.9840758442878724,1.0,accept,unanimous_agreement,2
elementary/terminal,reviews,488927525,527,let's try `0 9px` for now?,0,0,0,0.9858641028404236,0.9937851428985596,0.992586076259613,0.0,accept,unanimous_agreement,2
elementary/terminal,reviews,748206398,557,needs input from the design team as to whether the option is needed and what shortcut is appropriate,0,0,0,0.982311487197876,0.9892047047615052,0.9927694797515868,0.0,accept,unanimous_agreement,2
elementary/terminal,reviews,1292016946,701,"this mostly looks good, just a few inline comments. i think generally some of these lines are a bit harder to read compared to how they were before. having arguments separated onto different lines for some of these methods that take a bunch of arguments makes it just easier to read at a glance what's happening",0,0,1,0.74757981300354,0.5206695795059204,0.7341039180755615,0.0,accept,majority_agreement,2
elementary/terminal,reviews,1292130179,701,looks solid. nice work!,1,1,1,0.9908610582351683,0.9954130053520204,0.9959014058113098,1.0,accept,unanimous_agreement,2
elementary/terminal,reviews,2248975805,772,clean!,0,0,1,0.5087336301803589,0.4478644132614136,0.5598208904266357,0.0,accept,majority_agreement,2
elementary/terminal,reviews,49356087,95,"i have one comment about connecting to the `button_press_signal`, nothing too serious. the change actually works well and fixes mentioned issues. i'm not sure if manually connecting / disconnecting is the right way to resolve this issue though.",0,0,0,0.6276625394821167,0.902961790561676,0.6094738841056824,0.0,accept,unanimous_agreement,2
elementary/terminal,reviews,481001256,537,"this works, but i think we should really fix `start_terminal_with_terminal_directory (string? directory)` and/or the functions it calls so that they behave correctly with a `null` working directory. otherwise the parameter should be changed to `string directory` so that this function requires a non-null working directory.",0,0,0,0.9854486584663392,0.9942500591278076,0.9867557287216188,0.0,accept,unanimous_agreement,2
elementary/terminal,reviews,584501262,537,"the problem with this is that if you combine the `-w` flag with the `-n` flag, the new window reloads all the tabs from settings. this is not the desired behaviour - the new window should only have a single tab.",0,0,0,0.9468979835510254,0.9602640271186828,0.8416715860366821,0.0,accept,unanimous_agreement,2
elementary/terminal,reviews,1092167761,680,"hm, i'm not sure about the changes to the searchbar here, especially since if you've opened the searchbar it's now stuck open until the foreground process ends. it also seems like we'll get issue reports about not being able to create or switch tabs while a command is running. i wonder if we should expand the behavior of the current ""natural copy/paste"" toggle to have more of a ""cli app mode"" or have a per-tab option to disable all app shortcuts while the current tab is focused. or just generally something that feels more deliberate.",-1,-1,0,0.5459116697311401,0.6464941501617432,0.7760335206985474,-1.0,accept,majority_agreement,2
elementary/terminal,reviews,87801675,189,lgtm,0,0,0,0.9795994758605956,0.7242414951324463,0.9618706703186036,0.0,accept,unanimous_agreement,2
elementary/terminal,reviews,55039162,129,your screenshot looks more nicely than on my system. in my case it looks like checkbox has a margin. ![a link],1,0,1,0.7769985198974609,0.8622360229492188,0.994317591190338,1.0,accept,majority_agreement,2
elementary/terminal,reviews,55058959,129,looks good!,1,1,1,0.9856627583503724,0.9947203397750854,0.983550190925598,1.0,accept,unanimous_agreement,2
elementary/terminal,reviews,71605571,157,"works expected, although the app accelerators only need to be set once. files does it in the first window; however, if there are no adverse effects in repeated setting, perhaps this is unnecessary.",0,0,0,0.9871008396148682,0.988947868347168,0.9855062961578368,0.0,accept,unanimous_agreement,2
elementary/terminal,reviews,73542709,157,"the function action_about () is no longer used. if it is not intended to reimplement this action then this function should be removed. otherwise, no regressions found.",0,0,0,0.9827494621276855,0.9931667447090148,0.9935429096221924,0.0,accept,unanimous_agreement,2
elementary/terminal,reviews,73737053,157,"looks good, no regressions found.",1,0,1,0.6156044602394104,0.8021346926689148,0.5101688504219055,1.0,accept,majority_agreement,2
elementary/terminal,reviews,131355711,275,wfm,0,0,0,0.9574257135391236,0.9373071193695068,0.9788549542427064,0.0,accept,unanimous_agreement,2
elementary/terminal,reviews,339989052,447,lgtm. thanks!,1,1,1,0.9743313193321228,0.9928908348083496,0.9850850701332092,1.0,accept,unanimous_agreement,2
elementary/terminal,reviews,332224107,435,works great and nice improvement to the zoom level label syncing!,1,1,1,0.991294801235199,0.99573814868927,0.995429277420044,1.0,accept,unanimous_agreement,2
elementary/terminal,reviews,530591564,547,this seems to break natural copy - ` c` results in `^c` appearing in the terminal. not immediately obvious why as you have implemented similar code.,0,-1,0,0.9763467311859132,0.664649248123169,0.9864422082901,0.0,accept,majority_agreement,2
elementary/terminal,reviews,707678717,580,nice fix :+1:,1,1,1,0.9821589589118958,0.9923737645149232,0.9970380067825316,1.0,accept,unanimous_agreement,2
elementary/terminal,reviews,672424038,589,"i can confirm it fixes the issue, thanks!",1,1,1,0.9736979007720948,0.9886526465415956,0.972695767879486,1.0,accept,unanimous_agreement,2
elementary/terminal,reviews,1695668432,740,looks good just some minor copy adjustments,0,1,1,0.547089159488678,0.9058317542076112,0.7629469633102417,1.0,accept,majority_agreement,2
elementary/terminal,reviews,1700268206,740,looks good :rocket:,1,1,1,0.985044240951538,0.9953239560127258,0.9947543144226074,1.0,accept,unanimous_agreement,2
elementary/terminal,reviews,88054099,193,"disapprove. these variables don't make porting to meson more difficult, all this is just as easily accomplishable with meson using `configuration_data` and `configuration_file`.",0,0,0,0.7830138206481934,0.97974294424057,0.9841429591178894,0.0,accept,unanimous_agreement,2
elementary/terminal,reviews,90305484,200,"since, at the moment, `application::new_window_with_coords ()` is only called with both the optional parameters ""false"", it would make sense for them to default to false. there is no need to make them optional in the window constructor since only application should create windows and take responsibility for their parameters.",0,0,0,0.986071765422821,0.9953115582466124,0.9918609857559204,0.0,accept,unanimous_agreement,2
elementary/terminal,reviews,90306530,200,thanks.,0,1,0,0.5150366425514221,0.5804154276847839,0.5270382761955261,0.0,accept,majority_agreement,2
elementary/terminal,reviews,90758190,204,"this fixes the issue. you might as well fix the related issue in on_switch_page () function - again, the terminal widget should grab focus, not the tab.",0,0,0,0.9881630539894104,0.9927871823310852,0.9944934844970704,0.0,accept,unanimous_agreement,2
elementary/terminal,reviews,91606437,204,"looks good now, thanks!",1,1,1,0.9842239618301392,0.995187282562256,0.9921514987945556,1.0,accept,unanimous_agreement,2
elementary/terminal,reviews,55969387,136,approved after dan's response.,0,0,0,0.9791513681411744,0.9908218383789062,0.9880712032318116,0.0,accept,unanimous_agreement,2
elementary/terminal,reviews,65919451,146,look at diff comments. please make me happy.,1,1,1,0.7262291312217712,0.7375779151916504,0.968525230884552,1.0,accept,unanimous_agreement,2
elementary/terminal,reviews,299099220,404,"i'm not able to get this to behave as described; when terminal is unfocused, i can still click on a link and it immediately opens.",0,-1,0,0.5682981014251709,0.5769442319869995,0.8859960436820984,0.0,accept,majority_agreement,2
elementary/terminal,reviews,299580832,404,ux-wise this seems to work for me. would like input from /desktop-developers though.,0,0,0,0.6440296173095703,0.9526163339614868,0.8687740564346313,0.0,accept,unanimous_agreement,2
elementary/terminal,reviews,302251432,404,i've taken another look at the code and it seems sane to me. :+1:,1,1,1,0.913028359413147,0.9856045842170716,0.9956716299057008,1.0,accept,unanimous_agreement,2
elementary/terminal,reviews,318033518,416,no regressions found when dragging tab out of window.,0,0,0,0.983160436153412,0.9744574427604676,0.987111270427704,0.0,accept,unanimous_agreement,2
elementary/terminal,reviews,338573835,446,"thanks for the contribution! this does the immediate job, but i have a couple of comments: * you should update the .desktop file ""new window"" action command line to use the new flag * the `get_last_window ()` function's name no longer reflects its actual action - it does not always return the last window, even if there is one. as it is a private function i think it would be safe enough to rename it and maybe pass the option as a parameter in case the function needs to be used to get the last window anyway. you could then create the new window in this function and return it instead of the callers having to test the result and then create a new window.",1,1,1,0.9851330518722534,0.9829133152961732,0.9874327778816224,1.0,accept,unanimous_agreement,2
