id,pr_number,body,distilbert_sentiment_label,codebert_sentiment_label,deberta_sentiment_label,distilbert_confidence,codebert_confidence,deberta_confidence,majority_label,final_decision,decision_reason
301195878,2964,merged to trunk.,0,0,0,0.9853448271751404,0.991689682006836,0.9864094257354736,0.0,accept,unanimous_agreement
301222344,2964,"thanks for the comments, i will try to incorporate them in a follow-up pr.",1,1,1,0.7200688719749451,0.6612666249275208,0.9164412021636964,1.0,accept,unanimous_agreement
248246823,1884,"one general comment. `internaltopicmanager` isn't really doing anything anymore. i left this comment on the previous pr: it seems to me that they should be merged into a single class? , thoughts?",0,0,0,0.6872100234031677,0.959325075149536,0.9174911975860596,0.0,accept,unanimous_agreement
248379483,1884,made changes according to your feedback.,0,0,0,0.9790167212486268,0.984565794467926,0.9862051606178284,0.0,accept,unanimous_agreement
248967534,1884,made changes according to your feedback and pushed the changes.,0,0,0,0.9789167642593384,0.9852360486984252,0.9918994903564452,0.0,accept,unanimous_agreement
249255156,1884,applied the feedback and pushed the changes.,0,0,0,0.9826194047927856,0.9835379719734192,0.9936460256576538,0.0,accept,unanimous_agreement
249611052,1884,"oic - the problem with making it public on kafkastreams is that it would then be part of the public api. we probably should move the field from kafkastreams to an internal class and have kafkastreams and this class reference that. problem is i'm not entirely sure where to put it right now. [a link] might have an idea. otherwise, just leave it here and we can fix it later on mon, 26 sep 2016 at 16:42 hjafarpour notifications.com wrote:",-1,0,0,0.5893672704696655,0.9581953287124634,0.9256038665771484,0.0,accept,majority_agreement
249612400,1884,"alright, leaving it as it until we decide where we can move the field.",0,0,0,0.9754379391670228,0.986006498336792,0.9902634620666504,0.0,accept,unanimous_agreement
250317873,1884,pushed new changes.,0,0,0,0.9443108439445496,0.9818312525749208,0.9884201288223268,0.0,accept,unanimous_agreement
250342391,1884,"i ran the unit test locally and the jenkins failures seems to be pretty consistent, were your local unit test run passed? [code block]",0,0,0,0.980781078338623,0.983669638633728,0.9911386370658876,0.0,accept,unanimous_agreement
250561766,1884,do you have a timeline for this fix? we need this fix as part of one of our client apps that we are building that uses spring cloud stream. anything my team or i can do to help?,0,0,0,0.9695459008216858,0.9846936464309692,0.9739964604377748,0.0,accept,unanimous_agreement
255222098,1884,"sorry for the late reply, we are currently merging this pr as a post-0.10.1.0 pr, which means that it will likely to be included in the next minor release or in a bug-fix release (0.10.1.1).",-1,-1,-1,0.9880450367927552,0.9876384735107422,0.9757694602012634,-1.0,accept,unanimous_agreement
256424024,1884,could you file a kip for this api change as well?,0,0,0,0.9894428253173828,0.994325578212738,0.995051920413971,0.0,accept,unanimous_agreement
270991824,1884,test this please,0,0,0,0.9859992861747742,0.9801037311553956,0.9870431423187256,0.0,accept,unanimous_agreement
271060729,1884,test this please,0,0,0,0.9859992861747742,0.9801037311553956,0.9870431423187256,0.0,accept,unanimous_agreement
271096444,1884,jenkins failure seems related: [code block] [code block],0,0,0,0.9132050275802612,0.986396551132202,0.9897010326385498,0.0,accept,unanimous_agreement
271452298,1884,test this please,0,0,0,0.9859992861747742,0.9801037311553956,0.9870431423187256,0.0,accept,unanimous_agreement
271714172,1884,test this please,0,0,0,0.9859992861747742,0.9801037311553956,0.9870431423187256,0.0,accept,unanimous_agreement
271930762,1884,"lgtm. merged to trunk, thanks !",1,1,1,0.985774040222168,0.9919650554656982,0.9885109663009644,1.0,accept,unanimous_agreement
406449812,5379,could you give this another look?,0,0,0,0.9832844138145448,0.97771954536438,0.9840785264968872,0.0,accept,unanimous_agreement
406665448,5379,i think the final commit addresses all of the comments. can you confirm?,0,0,0,0.9879205226898192,0.9873199462890624,0.9913039207458496,0.0,accept,unanimous_agreement
406723141,5379,made `saslextensionscallback` return `saslextensions`. please take a look,0,0,0,0.9835264086723328,0.9918143153190612,0.9940153956413268,0.0,accept,unanimous_agreement
406733607,5379,seems like some related tests are failing. currently investigating them but it's not obvious what caused them to fail at all,-1,-1,0,0.747390627861023,0.5282135009765625,0.7453646063804626,-1.0,accept,majority_agreement
406750227,5379,"i had some issues with failing tests due to inappropriate handling of `scramextensionscallback`. i've now separated it from `saslextensionscallback` entirely - it doesn't return `saslextensions` but a `map<string, string`. hopefully this shouldn't matter too much as we deprecated it. should be all clear now. can you review?",0,0,0,0.7195962071418762,0.9592564105987548,0.7354593276977539,0.0,accept,unanimous_agreement
407474576,5379,"this should address all comments , . thanks for being patient with me",1,1,1,0.9708808064460754,0.9496566653251648,0.9845788478851318,1.0,accept,unanimous_agreement
407884676,5379,lgtm,0,0,0,0.9795994758605956,0.7242414951324463,0.9618706703186036,0.0,accept,unanimous_agreement
410763090,5379,merging to trunk. thanks for the reviews.,1,1,1,0.9154109358787536,0.819878876209259,0.9693832993507384,1.0,accept,unanimous_agreement
137326320,191,"anyone interested running this on vagrant , build kafka with this patch in and checkout [a link] . drop the .tgz under kafka-vagrant. vagrant up.",0,0,0,0.984148383140564,0.9931952953338624,0.994122326374054,0.0,accept,unanimous_agreement
137876636,191,"thanks harsha, good to see this. in order to review this, it would be good to have a summary of the status of the pr, what areas (if any) you are still working on?",1,1,1,0.979957640171051,0.987187385559082,0.990365207195282,1.0,accept,unanimous_agreement
137877918,191,"cleaning up the code and adding sasl configs part, more unit tests.",0,0,0,0.9749725461006165,0.98921799659729,0.9931341409683228,0.0,accept,unanimous_agreement
137878143,191,thanks.,0,1,0,0.5150366425514221,0.5804154276847839,0.5270382761955261,0.0,accept,majority_agreement
146770873,191,please review the updated patch. thanks.,1,1,0,0.875430703163147,0.8707457780838013,0.633817732334137,1.0,accept,majority_agreement
146864969,191,thanks . i submitted a pr with your branch as the target: [a link] it merges trunks (and resolves the conflicts) and it includes some fixes and improvements. please review and integrate if you agree with the changes. i am still going through the code and i will submit another pr later that will include a saslconsumertest.,1,1,1,0.9682344198226928,0.9750061631202698,0.9735930562019348,1.0,accept,unanimous_agreement
146999246,191,updated the pr with consumer test . i'll be updating with docs and other fixes mentioned in the above comments tonight.,0,0,0,0.9784730672836304,0.9801443815231324,0.9805617928504944,0.0,accept,unanimous_agreement
147425105,191,here's another pr [a link] which: - merges and resolves conflicts from trunk - address some of jun's and parth's comments - make fields final - reduce scope of variables where possible - remove unused fields and methods - fix javadoc - fix formatting and naming issues - return non-anonymous `kafkaprincipal` in `saslclientauthenticator.principal` please review and integrate as appropriate . there is still feedback to be addressed as well as more tests (particularly for inter-broker communication and sasl_ssl). i will continue working on these.,0,0,0,0.9142449498176576,0.9822610020637512,0.9552488923072816,0.0,accept,unanimous_agreement
147777026,191,thanks for regularly merging my prs harsha. here's another one: [a link],1,1,1,0.8506794571876526,0.9778027534484864,0.9815628528594972,1.0,accept,unanimous_agreement
147903851,191,"also, a general question, if the tgt ticket can't be renewed, do we get exceptions when reading/writing through the sasl port?",0,0,0,0.98661869764328,0.9912304878234864,0.9918882250785828,0.0,accept,unanimous_agreement
148224075,191,yes. it will throw a kafkaexception,0,0,0,0.9861466288566588,0.979816734790802,0.9854483008384703,0.0,accept,unanimous_agreement
148396199,191,"pr 4 is ready: [a link] it: - fixes issues with the loginmanager singleton (we need two instances, one for mode.server and one for mode.client and closing it is not as simple as how it's done in the existing code) - a number of logging clean-ups (avoid string concat so that we don't pay the cost if that particular level is disabled) - remove setconfiguration call as suggested by next on my list: - [x] removeinterestops issues on server and client authenticator mentioned by jun - [x] refactor tests to reduce duplication, test sasl_ssl, test sasl for inter-broker communication and - fix test failure when all the tests are run via gradle (i know what the issue is) - [x] replace kerberosname system property with config - [x] investigate if there's a way to avoid using proprietary classes in `jaasutils.defaultrealm` i think we're getting closer.",0,0,0,0.921710729598999,0.9825224876403807,0.957286536693573,0.0,accept,unanimous_agreement
148564929,191,i see you changed loginmanager to do client and server. but in sasl case we use kafkaserver section for both kafkaserver and any inter broker calls. the reason for this is we want keep kafkaclient section for only the clients and use the keytab in kafkaserver section. hence the reason we want to initialize the loginmanager eitehr with server or client but not with both. so in broker side we do loginmanager(server) and inside the controller or replica we use inter.broker.security.protocol and use client as mode initiate salsclientauthenticator with loginmanager.subject.,0,0,0,0.9689999222755432,0.9913115501403807,0.9783813953399658,0.0,accept,unanimous_agreement
148567215,191,"regarding `loginmanager`, thanks for the explanation, good to know that we want to use `kafkaserver` section for the broker, whether it's a client or a server. however, if `loginmanager` doesn't support client and server simultaneously, how will it work in situations where you have a client and a server in the same jvm (like in tests, for example)? i think `loginmanager` should support both modes, but we should change how we call it from `saslchannelbuilder` perhaps. what do you think?",1,0,1,0.723091721534729,0.6905930042266846,0.9783263206481934,1.0,accept,majority_agreement
148568777,191,yes makes sense.,0,0,0,0.9715992212295532,0.9843671917915344,0.980026364326477,0.0,accept,unanimous_agreement
148571060,191,"is that right? in controllerchannelmanager, replicafetcherthread, and kafkaserver (for controlled shutdown), we create the channel in client mode (instead of server). this seems correct since they initiate client connections. the socketserver is always created in server mode. so, it seems that the broker will always need to support two modes for loginmanager.",0,0,0,0.985096037387848,0.9937008619308472,0.987826645374298,0.0,accept,unanimous_agreement
148572207,191,"i think the confusion is due to the fact that `mode` is being misused in `loginmanager`. it actually means `logincontexttype` in that context and it is only used to derive the logincontextname. i intend to change it along these lines so that it's clearer. , please correct me if i misunderstood.",0,0,0,0.808661162853241,0.7577835917472839,0.9218617081642152,0.0,accept,unanimous_agreement
148574665,191,"hmm, so all channels in controllerchannelmanager, replicafetcherthread, and kafkaserver should be created in server mode to pick up the kafkaserver section?",0,0,0,0.9876327514648438,0.9924829602241516,0.9847829937934875,0.0,accept,unanimous_agreement
148575986,191,"not exactly, i think it's something like this: [a link] (i just did it quickly to show it in code, still need to double-check it)",0,0,0,0.9083099961280824,0.9797132015228271,0.9860209822654724,0.0,accept,unanimous_agreement
148593273,191,your code looks good to me. if you open a pr i can run some tests. thanks.,1,1,1,0.9758121371269226,0.9919997453689576,0.9953396320343018,1.0,accept,unanimous_agreement
148683145,191,"i am not sure _""servicename has always been used in jaas config""_. i can run zookeeper 3.4.6 with sasl either with the default name `zookeeper` or by specifying the system property `zookeeper.sasl.client.username` to override the name. at the moment, using `servicename` in jaas.conf as the only way to configure the name prevents sasl from being used with ibm jdk. at the very least, we need to set a default. the exceptions with ibm jdk when `servicename` is set as well as the exception when `servicename` is not set are below. if `servicename` is specified, the exception is: [code block] if `servicename` is not specified, the exception is: [code block]",0,0,0,0.9679763317108154,0.9890294075012208,0.9491899013519288,0.0,accept,unanimous_agreement
148689700,191,i agree that we should do something about this. my preference is to move it to the kafka config.,0,0,0,0.9294214844703674,0.9578868746757508,0.9711860418319702,0.0,accept,unanimous_agreement
148702719,191,"pr 5: [a link] - introduces `logintype` and simplifies caching code in `loginmanager` - make `auth_to_local` configurable via kafkaconfig instead of a system property. i went with the same name as the one hadoop uses, but it's not the most intuitive so we may want to revise that (it should be a simple change though).",0,0,0,0.979206085205078,0.9919906258583068,0.9903755784034728,0.0,accept,unanimous_agreement
148716439,191,i started on the inter-broker tests and things are looking good. sasl_plaintext and sasl_ssl work fine (the latter required a small fix).,1,1,1,0.5014671683311462,0.5851429104804993,0.8577885031700134,1.0,accept,unanimous_agreement
148738345,191,ok for servicename i want to pick default via jaas config and if its not set we will look for it in the sasl configs. will that work for you?,0,0,0,0.986820638179779,0.9922834038734436,0.9941728711128236,0.0,accept,unanimous_agreement
148739210,191,"yes, thank you. that will work for us,",1,1,1,0.932026982307434,0.9862158298492432,0.9728626012802124,1.0,accept,unanimous_agreement
148740906,191,i pushed the inter-broker tests for sasl_plaintext and sasl_ssl to [a link] working on sasl_ssl tests for producer and consumer now.,0,0,0,0.9871525168418884,0.9937773942947388,0.99416983127594,0.0,accept,unanimous_agreement
149203336,191,", pr 6 is ready [a link] - merged trunk and fixed conflicts - refactored producer and consumer tests to reduce duplication and to also test sasl_ssl (fixed an important, but small bug with sasl_ssl in the process) - fixed issue where interestops was not being turned off when it should be - document `authenticate` in `saslclientauthenticator` and `saslserverauthenticator` - make it possible to configure servicename via kafkaconfg `./gradlew test` passed on my laptop. we need to move fast in order to get this into 0.9.0.0, so i'd appreciate it if you could merge this into your branch so that jun can review it.",0,0,0,0.9669674634933472,0.9757477641105652,0.5801668167114258,0.0,accept,unanimous_agreement
149315813,191,": pr #6 from looks good to me. do you want to merge that into your branch? once you do that, i think we can probably just commit the patch as it is and address other issues, if any, in followup jiras.",1,1,1,0.9787952303886414,0.9063902497291564,0.7125228047370911,1.0,accept,unanimous_agreement
149746290,191,can you open a pr against this branch so that i can merge it in,0,0,0,0.9888691902160645,0.9914141297340392,0.9943174719810486,0.0,accept,unanimous_agreement
149750466,191,"thanks for merging the pr to your branch harsha. since jun merged the sasl pr via #334 (which is exactly the same as this one now), would you mind closing this one please? thanks for your work on this. we'll probably need a follow-up to tweak some things and some more tests (particularly ducktape ones) but we're most of the way there.",1,1,1,0.9164965748786926,0.9755945801734924,0.9867231249809264,1.0,accept,unanimous_agreement
781745956,10070,"hmm, wouldn't we want to switch the leader to 2 in that case, since 2 is more preferred?",0,0,0,0.9730047583580016,0.9675247669219972,0.96719890832901,0.0,accept,unanimous_agreement
782521288,10070,"thanks, ! :)",1,1,1,0.9914987683296204,0.995605170726776,0.9964231848716736,1.0,accept,unanimous_agreement
326210780,3765,note that this pr is wip and only replicastatemachinev2 currently attempts to do retries and error handling. retries and error handling will be added to the rest of the controller in later rounds of review.,0,0,0,0.9882735013961792,0.9923539161682128,0.992423415184021,0.0,accept,unanimous_agreement
326461993,3765,can you take a look?,0,0,0,0.9862033128738404,0.9826734662055968,0.992240309715271,0.0,accept,unanimous_agreement
332270742,3765,"i rebased, resolved merge conflicts, and force pushed the change.",0,0,0,0.9814618229866028,0.9829484820365906,0.9819074273109436,0.0,accept,unanimous_agreement
335763940,3765,"i just ran an experiment that measures controller failover time before and after this pr. the environment: * 5 broker kafka cluster with brokers on different racks * 5 node zookeeper ensemble with nodes on different racks * 100,000 single-partition single-replica topics trunk (91517e8fbd7767ba6d7f43b517f5a26b6f870585): [code block] kafka-5642: [code block] trunk average controller failover time: ~60 seconds kafka-5642 average controller failover time: ~24 seconds",0,0,0,0.932375967502594,0.9918076395988464,0.9830641150474548,0.0,accept,unanimous_agreement
336032158,3765,"i compared the breakdowns of where time was getting spent in both the trunk and kafka-5642 runs of the experiment. i don't see any performance regressions in the parts that don't interact with zookeeper. so the zookeeper parts got better with kafka-5642 and the rest stayed the same, which is what we expect.",0,0,0,0.9666824340820312,0.989108681678772,0.9792137742042542,0.0,accept,unanimous_agreement
336194567,3765,"i just realized that controlled shutdowns will not improve at all with the current pr because controlled shutdown still calls the state machines one partition at a time, so there won't be any zk pipelining. we can just do a bunch of filters upfront in controlledshutdown.docontrolledshutdown that categorize partitions into the actions to take and then take the actions on the collections we've gathered. i'll try to update the pr within the next few hours.",0,0,0,0.9658695459365844,0.977477490901947,0.9717742800712584,0.0,accept,unanimous_agreement
336318966,3765,"i just ran an experiment measuring controlled shutdown time before and after this pr. the environment: * 5 broker kafka cluster with brokers on different racks * 5 node zookeeper ensemble with nodes on different racks * 25,000 single-partition topics with rf = 2 the replicas were made with the following python script: [code block] special configs: [code block] trunk (91517e8fbd7767ba6d7f43b517f5a26b6f870585) run 1: [code block] trunk (91517e8fbd7767ba6d7f43b517f5a26b6f870585) run 2: [code block] kafka-5642 run 1: [code block] kafka-5642 run 2: [code block] trunk average controlled shutdown time: ~6.5 minutes kafka-5642 average controlled shutdown time: ~3 seconds",0,0,0,0.9539167881011964,0.991016149520874,0.9831175804138184,0.0,accept,unanimous_agreement
336486274,3765,can we update the pr description to include a summary of the changes done in this pr?,0,0,0,0.9877368211746216,0.9924916625022888,0.995636522769928,0.0,accept,unanimous_agreement
336520938,3765,"today, zookeeperclient and zkclient couples the data/child change handlers with the actual watcher registration, which means handler registrations actually send out a request to the zookeeper ensemble to do the actual watcher registration. in `kafkacontroller.oncontrollerfailover`, we register partition modification handlers (thereby registering watchers) and additionally lookup the partition assignments for every topic in the cluster. in an offline discussion, and i realized that we can shave a bit of time off failover if we merge these two operations. there are two ways we can do this: 1. change zookeeperclient to register data change watchers with getdatarequests instead of existrequests. this means the handler and watcher registration will also return the znode data. 2. decouple handler registration from watcher registration in zookeeperclient. handler registrations and unregistrations would be a purely local operation. watcher registrations would be delegated to the user in a following lookup. option 1 made us realize a bug in the existing pr: we don't check the return codes of watcher registrations and attempt retries on connectionloss. option 2 would just reuse the retry logic already in kafkacontrollerzkutils. i prefer option 2, especially since it makes the zookeeperclient registration/unregistration apis more consistent in that they would both now be purely in-memory operations.",0,0,0,0.9591171145439148,0.9814605116844176,0.9674969911575316,0.0,accept,unanimous_agreement
336531088,3765,": yes, i agree that option 2 would be better. it would be useful to add a comment to describe the semantic of zookeeperclient.registerznodechangehandler(). if we do this, we will want to do this consistently with registerznodechangehandler(). also, could you remove wip from the title of the pr?",0,0,0,0.9421789050102234,0.9780091047286988,0.9692524671554564,0.0,accept,unanimous_agreement
336737463,3765,"something that was not factored into the above two experiments was logging inefficiencies. one major issue with kafka today is its use of log4j synchronous logging instead of log4j2's asynchronous logging. this heavily distorts the experiment results. if we want to more purely measure the performance change from this patch, i think it'll make sense to rerun the experiments with controller logs set to something like error and above or just disable it entirely.",0,0,0,0.6455255150794983,0.912320077419281,0.9702954888343812,0.0,accept,unanimous_agreement
336750646,3765,"in an offline discussion, suggested i look into determining whether the long controlled shutdown time was actually from the logger writing to disk or simply from creating the log message itself, in which case async logging wouldn't have helped. to test this, i ran the same controlled shutdown experiment as above for trunk but with: `log4j.appender.statechangeappender=org.apache.log4j.varia.nullappender` `log4j.appender.controllerappender=org.apache.log4j.varia.nullappender` nullappender simply doesn't output the message to a device. controlled shutdown still took 6+ minutes. i later reverted the two appenders back to `org.apache.log4j.dailyrollingfileappender` but this time set the controller and state change log levels to fatal so that they effectively never log. controlled shutdown finished in 11 seconds. this proves that the vast majority of time was getting spent in log message creation.",0,0,0,0.979066014289856,0.9889238476753236,0.9887682795524596,0.0,accept,unanimous_agreement
336792142,3765,"alright i reran the controller failover and controlled shutdown experiments but with some logging tweaks to more purely compare trunk's controller using zkclient with kafka-5642's controller using zookeeperclient. the logging tweaks are the following: - the state machine loggers set to error - the state change logger set to debug - the rest of the controller logger set to info the full log4j.properties is here: [code block] **controller failover** the environment: - 5 broker kafka cluster with brokers on different racks - 5 node zookeeper ensemble with nodes on different racks - 100,000 single-partition single-replica topics trunk (91517e8fbd7767ba6d7f43b517f5a26b6f870585) run 1: [code block] trunk (91517e8fbd7767ba6d7f43b517f5a26b6f870585) run 2: [code block] kafka-5642 run 1: [code block] kafka-5642 run 2: [code block] trunk average controller failover time: ~63 seconds kafka-5642 average controller failover time: ~17 seconds **controlled shutdown** the environment: - 5 broker kafka cluster with brokers on different racks - 5 node zookeeper ensemble with nodes on different racks - 25,000 single-partition topics with rf = 2 the replicas were made with the following python script: [code block] special configs: [code block] trunk (91517e8fbd7767ba6d7f43b517f5a26b6f870585) run 1: [code block] trunk (91517e8fbd7767ba6d7f43b517f5a26b6f870585) run 2: [code block] kafka-5642 run 1: [code block] kafka-5642 run 2: [code block] trunk average controlled shutdown time: ~22 seconds kafka-5642 average controlled shutdown time: ~3 seconds",0,0,0,0.9734974503517152,0.9918659329414368,0.9899773597717284,0.0,accept,unanimous_agreement
336801412,3765,"i went back and looked into why logging resulted in distorted results in the controlled shutdown experiment for trunk: 6.5 minutes with logging vs 22 seconds without logging. it's due to this line in partitionstatemachine.electleaderforpartition: [code block] i reran the experiment with the original log levels (controller and state change loggers at trace, no special state machine loggers) but removed the above debug log statement. this brings the controlled shutdown times back down to below 20 seconds: [code block] the reason why this one log line is so problematic is because for each partition undergoing election, it logs every partition state in the cluster. so you end up getting o(n^2) log behavior where n is the total number of partitions in the cluster. rather than log every partition's state per partition undergoing election, it would be sufficient to just log that single partition's state: [code block]",0,0,0,0.8799333572387695,0.8935049772262573,0.9817349314689636,0.0,accept,unanimous_agreement
