id,pr_number,body,distilbert_sentiment_label,codebert_sentiment_label,deberta_sentiment_label,distilbert_confidence,codebert_confidence,deberta_confidence,majority_label,final_decision,decision_reason
519303125,7170,"ah. i guess, i skipped the pr description... sorry for that. i discussed the proposal with in person, and thinking about the semantics once more, i am actually wondering if it is wise to change `groupby` at all (this thought also affects my previous comment to include `join()` -- i would like to retract this idea :) ) we have basically two dimensions which 2 cases each to consider for `groupby` (and also `join()`: 1) repartition not required -- no `repartitioned` object provided 2) repartition not required -- `repartitioned` object is provided 3) repartition required -- no `repartitioned` object provided 4) repartition required --`repartitioned` object is provided case (1), (2), and (4) are straight forward. however, case (2) is somewhat awkward because we actually want to treat `repartitioned` as a configuration object but specifying it in `groupby` should not enforce a repartitioning (if one want to enforce a repartitioning, they should use the new `repartition()` operator). hence, for case (2) the `repartitioned` configuration would be ignored. therefore, only case (4) is left in which passing in `repartitioned` would have an effect. for this case, it would be possible to change the number of partitions or to specify a different partitioner. (i ignore the serde and naming because this can be achieved via `grouped` anyway). however, if one wants to change the number of partitions or wants to set a specific partitioner, it seems they want to to apply (ie enforce) this configuration independent of the upstream topic configuration; ie, it is actually a case for which the user wants to _enforce_ a repartitioning. hence, it seems perfectly fine (and actually better, because it's semantically more explicit) that a user should call `repartition()` instead. therefore, i don't see a good use case for which it make sense to pass in `repartitioned` into `groupby`. would be great if you could share your thoughts about it? a second point i discussed with is about the optimization. we both have the impression that `repartition()` should not be subject to the repartition topic optimization. instead, an enforced repartitioning step, should be added to the topology in a hard coded way similar to a call to `through()`. maybe we can be some advanced optimization rules later, but it seems difficult (and potentially unsafe/incorrect) to apply the repartition topic optimization for this case. hence, we would suggest to skip this optimization in this pr.",-1,-1,1,0.986333191394806,0.9298449158668518,0.583954930305481,-1.0,accept,majority_agreement
519307224,7170,"not sure i agree -- maybe you just want to control the parallelism *in case* a repartition is required? you could enforce users to step through their whole topology, figure out when/where repartitioning is needed, and use `repartition` to set the parallelism. or, you could let streams do this for you -- as it currently does, way more conveniently and probably less error-prone -- and supply a configuration to be used if streams figures out you need to repartition.",0,0,0,0.980063796043396,0.9892200827598572,0.8355790376663208,0.0,accept,unanimous_agreement
519309839,7170,"i don't see this as a use case in practice. why would one want to change the parallelism? because, the aggregation operation is over or under provisions and thus one wants to decrease or increase the parallelism. if i am ok with the ""default"" parallelism in case there is no repartitioning, why would i not be ok with it if data is repartitioned? this is less an issue imho, because if i want to scale up for example, it's sufficient to insert `repartition()` once upstream and all downstream auto-created topics would inherit the parallelism implicitly (as they inherit it now from source topics). hence, i don't need to insert `repartition` all over the place.",0,0,0,0.8752354979515076,0.972380757331848,0.9034265279769896,0.0,accept,unanimous_agreement
519315591,7170,"maybe you're processing data from a topic on your company's cluster, which has a huge number of partitions to begin with. maybe your workload needs nowhere near this many partitions (you're filtering out most records, it's overpartitioned to begin, your just testing). you run your streams app which creates some n topics all of which have this huge number of partitions. your brokers struggle and your boss gets mad? why does anyone want to change this ever? (ie with `repartition`) that's a good point though. so the `repartition` operator is really a ""auto-create topic"" + ""set parallelism"" operator -- should be sure to document this well. now, what if someone wants to configure the parallelism of a certain repartition topic(s) but would like to continue using the source topic's parallelism as the default? not saying we should necessarily support that, but we should at least make it very clear to users how using this will affect downstream topics.",-1,-1,1,0.7029004693031311,0.9342556595802308,0.5829803347587585,-1.0,accept,majority_agreement
519319181,7170,"my question is, why do you need `groupbykey(repartitioned.with())`? if you want to scale down, it seems better to explicitly call `repartition(repartitioned.with()).groupbykey()` -- otherwise, you might not scale down if not auto-repartition topic is created and it seems rather error prone that we allow to specify the number of partitions and than ignore the config entirely. similar to your second comment, if you want to ""scale up"" again later, you call `repartition()` again. i agree that we need to document this explicitly if we follow this route. however, it's similar behavior as we have as-of now. if you insert a `through()` all downstream operators inherit the parallelism from it.",0,0,0,0.96790611743927,0.962237536907196,0.9694854021072388,0.0,accept,unanimous_agreement
519328010,7170,"ok, well i am fine with this framing it as a ""set parallelism"" operation...i don't want to stall this kip/pr further, but what if this was split into a new set of `setparallelism` and `repartition` operators, where the `repartition` just auto-creates the topic while upstream `setparallelism` is responsible for setting the number of partitions? just wondering if it's worth making this more explicit, since there's really two new functionalities being introduced here. doesn't hurt to bundle them into one operator, as long as users know what two things it actually does...",0,0,0,0.7196427583694458,0.5580400824546814,0.9145365953445436,0.0,accept,unanimous_agreement
519385569,7170,"hello thanks a lot for valuable insights and interesting discussion. - your arguments make sense, but i'm leaning more towards points. in addition, in my mind, one other important point that we need to take into account is not only parallelism but general configuration of repartition topics. in my mind, this kip can be the foundation of actually giving users control over each individual repartition topic configuration. to be honest, i was tempted to propose deprecating `kstream#groupby(grouped)` operation altogether. let me explain my reasoning a bit. after this kip, i don't see any actual benefit nor need of actually using `kstream#groupby(grouped)`. with `kstream#groupby(repartitioned)` user can do exact same things, plus more. right now, in kstream there're `grouped` and `joined` configuration classes (and maybe some others that i'm missing) that are used for specifying a) topology name (which translates to repartition topic naming) b) producer serdes c) partitioner all those configurations can be encapsulated under `repartitioned`, in addition with all other topic level configurations that user may want to pass to internal topic creation. maybe this was discussed before, and there's a good reason why there're separate configuration classes for each operation (besides giving api the nice look, of course :) ). one argument that comes to mind why we may actually want to have `repartitioned` for `groupby` is simple syntax sugar. for example, there isn't fundamental different between this two topologies: 1) [code block] 2) [code block] while, for me, as a user, 2nd option looks much more appealing, similarly how key selector for `kstream#groupby` merges together two operations (`selectkey().groupby()`). again, your arguments are totally valid, and all can be achieved just by having `repartition(repartitioned)` operation. but on the other hand, i don't see anything bad with adding `repartitioned` option to groupby. it won't break api semantics (at least i think it won't) and will give the user extra flexibility around controlling repartition topics.",1,1,1,0.9588487148284912,0.9893725514411926,0.989418089389801,1.0,accept,unanimous_agreement
519387441,7170,"it's harder to comment on this. first, i would like to see how optimization logic behaves with this changes. based on the first glance, it should be fine, but would need to verify this by adding more tests. if necessary, optimization can be easily removed i guess. would love to hear your thoughts/suggestions as well on this.",0,1,1,0.529538094997406,0.8865290284156799,0.9630510210990906,1.0,accept,majority_agreement
520079726,7170,"hey, all, just to wade in (hopefully not stalling this pr too long): we should exclude this change from optimizations. the optimization logic around repartitions is already quite complex. it pushes repartition nodes around the processor graph and merges them together when possible (and the merge results in picking some repartition topic names over others). adding a new class of repartition nodes (manually specified ones via this new operator) would only complicate the algorithm further. it's always safe to skip an optimization, so we can just skip it for now and consider it in a separate scope of follow-on work. further arguments against optimization: it's not clear that, if i put a `repartition()` node at a specific point in my topology, i would _want_ streams to move it somewhere else. also, if i have two different `repartition()` calls with _different_ parallelisms, and the optimizer wants to merge them, what can it do? what about if it wants to merge a groupby repartition (which implicitly has a parallelism already) and an explicit `repartition()` with a different parallelism? we can reason through all these cases, but it will still: * drag out the kip discussion (since we have to revisit all these cases) * increase code complexity in the optimizer * increase system complexity for the people using streams (who will have a hard time understanding the results of the optimization) we can avoid all this by just excluding the manual repartitions from optimization for now. regarding the other question about overlap with grouped (and joined): we should keep all these config objects separate. we have had a lot of trouble in the past trying to use one operation's configuration objects on other operations. it may seem like a good match, but it inevitably puts us in an awkward bind later on. when we have two different operations, we should have two different config classes as well. `grouped` is for configuring `groupby`, `joined` is for configuring `join`, and `repartitioned` is for configuring `repartition`. this may result in code duplication, but it also results in an api that is very consistent, clear, easy to learn, and easy to use. likewise, nesting one operation's configuration inside another operation's configuration is again sacrificing a clean api in favor of code de-duplication. it's not a good tradeoff. far better to configure `groupby` with `grouped` using setters for the direct properties we want to set, and likewise configure `repartition` with `repartitioned` using setters for the direct properties we want to set. then, we don't have to worry about the implications for `groupby` every time we consider changes for `repartition`. as long as they are separate operations, they should have separate configuration classes. if we want to give people control over the parallelism in `groupby`, we should just add `grouped#numberofpartitions(final int numberofpartitions)`. anyway, that's my 2 cents ;)",0,0,0,0.7556269764900208,0.8037670254707336,0.9016559720039368,0.0,accept,unanimous_agreement
520097324,7170,"this does not resolve my main concern, that one passed in `numberofpartitions` and we just ignore the configuration...",-1,0,0,0.7322512865066528,0.9223774671554564,0.94795560836792,0.0,accept,majority_agreement
520181014,7170,"thanks, , i'm not saying that we should (you have a good point). i was just saying that we can add/deprecate methods in different config objects independently, but if we switch to use the same config object in two operations, it ties our hands. on the optimization front, what we could do is make a small change to the optimization algorithm that, when searching upstream to find out if a repartition is necessary, if it finds a repartition operation, it can decide that one is not necessary. then, if you do `ktable...map(...).repartition(repartitioned.numberofpartitions(1234)).groupby(...)`, we won't get a double-repartition, just the one we specifically requested to scale out parallelism. thanks, -john",1,1,1,0.8966513276100159,0.6785424947738647,0.9609622955322266,1.0,accept,unanimous_agreement
520222537,7170,"thank you for the thorough review, much appreciated! i think i've addressed all of the comments mentioned in this pr. to summarize: - repartitioning is now always performed when calling `kstream#repartition` operations. - i've added separate, `unoptimizablerepartitionnode` which is **not** subject of optimization algorithm. `kstream#repartition` operations create `unoptimizablerepartitionnode` when they're called. we can create followup ticket to investigate optimization possibilities for `kstream#repartition`. thank you for the clarification. motivation behind having separate configuration classes per operation does make a lot of sense after your explanation. actually, it won't do double re-partitioning even now (there's even test for this `kstreamrepartitionintegrationtest#shouldcreateonlyonerepartitiontopicwhenrepartitionisfollowedbygroupbykey`). thing is, `kstream#repartition` creates `kstreamimpl` with `repartitionrequred` as `false`. regarding changes for `groupby` operations - those changes are not part of this pr either way, so i think we can leave that discussion for now. i propose to resurrect discussion in mailing list when this pr is merged and have followup discussion on that, wdyt? . even if we go through with `groupby` changes, after reading arguments on why it's not good idea to have same configuration class for multiple operations, it makes more sense to have `numberofpartitions` in `grouped` class for `groupby` operations. personally, i still feel that control over repartition topic configurations is necessary in the long run (sometimes i really want to configure retention per specific repartition topics), and if we gonna have configurations duplicated in each operation class, it may create a lot of pain as well. anyway, since there isn't other use-case yet besides specifying number of partitions per repartition topic, we can cross that bridge when we get there.",1,1,1,0.9891312122344972,0.9950824975967408,0.9930242300033568,1.0,accept,unanimous_agreement
520973806,7170,would appreciate second review.,0,1,0,0.5914449691772461,0.9063072800636292,0.7746174335479736,0.0,accept,majority_agreement
522163447,7170,"hey, not sure if you looked into this or not but there may be some changes needed in streamspartitionassignor. it tries to validate that repartition topics have been created with the correct number of partitions (defined as the max number of partitions of any source topics) this might not affect this pr so much as the `groupby(repartitioned)` one, but it might be good to verify with an integration test that goes through a rebalance",0,0,0,0.9744575619697572,0.9829586148262024,0.988382875919342,0.0,accept,unanimous_agreement
522426073,7170,"hi , thanks for the info. i've added integration test where rebalancing is triggered.",1,1,1,0.8772960305213928,0.8954984545707703,0.9710260033607484,1.0,accept,unanimous_agreement
522645678,7170,"hey , thanks for the update! i'll take a look as soon as i can. -john",1,1,1,0.9823708534240724,0.9932438731193542,0.9941262006759644,1.0,accept,unanimous_agreement
523701860,7170,sgtm. why would you need that? repartition topics are configured with infinite retention anyway and kafka streams does explicit purge data calls after records are fully processed.,0,0,0,0.9889504313468932,0.9706413745880128,0.9823070168495178,0.0,accept,unanimous_agreement
523808665,7170,"fair, i was thinking more about older version when retention wasn't set as -1. missed the part that it's long-time fixed now :) anyway, internal topic configuration options is subject for whole new discussion (if there will be ever need for that).",1,1,1,0.7101649045944214,0.990814745426178,0.9884139895439148,1.0,accept,unanimous_agreement
524659120,7170,"hi , thank you for thorough review, much appreciated. i've addressed all of your comments, please have a look when you got time. i've run `./gradlew streams:reportcoverage` and can verify that main code that i've changed has over ~97% test coverage. i've also added more tests related to `repartitioned#streampartitioner` (both integration and unit tests)",1,1,1,0.9701802134513856,0.9932445883750916,0.9888550639152528,1.0,accept,unanimous_agreement
526316345,7170,"hello , can you please have a look at this pr one more time :) (pinging you just in case so that it won't get lost) regards, levani",1,1,1,0.9739556312561036,0.9955701231956482,0.996618390083313,1.0,accept,unanimous_agreement
527985897,7170,"thanks, , fwiw, i've left a few replies on threads that are marked as ""outdated"" or ""resolved"". i think the only one that's really important is: [a link]",1,1,1,0.8079103827476501,0.8993659019470215,0.9738851189613342,1.0,accept,unanimous_agreement
527991663,7170,"hi thanks for the review. i've left reply as well. btw, i tried my best to make tests pass on `jdk 11 and scala 2.13` but they seem to fail, right now because of `kafka.api.plaintextconsumertest.testlowmaxfetchsizeforrequestandpartition` is there anything i can do about it?",1,1,1,0.9119980335235596,0.9497694373130798,0.9634015560150146,1.0,accept,unanimous_agreement
528126203,7170,there is [a link] -- feel free to comment on the ticket.,0,0,0,0.9348244667053224,0.9658668637275696,0.9751819968223572,0.0,accept,unanimous_agreement
528230308,7170,"thanks , left the comment. please let me know if you have any more concerns/comments about this pr. thanks, levani",1,1,1,0.9606980681419371,0.9747095704078674,0.9861337542533876,1.0,accept,unanimous_agreement
529540016,7170,"hello just small update - there were conflicts with trunk around `internaltopicconfig` class. i've synced the feature branch with trunk and resolved the conflicts. regards, levani",0,1,1,0.9574154615402222,0.7462866306304932,0.7735110521316528,1.0,accept,majority_agreement
534176196,7170,"hi , bumping this thread so it won't get lost. any updates around this pr? would love to finalize this pr and move on to other kips :) regards, levani",1,1,1,0.9849649667739868,0.9954468607902528,0.997041642665863,1.0,accept,unanimous_agreement
536229726,7170,"hello , thanks for the review and thanks for pointing out challenges around `join`. i've added two integration test to address your concerns. basically, in both cases `copartitionedtopicsenforcer` now chooses max partition number from the repartition topics and updates the number of partitions config accordingly. initially, there was a bug in my implementation, basically co-partitioning wasn't working properly when using `repartition` operation. it's fixed by this commit: [a link] problem was that in the `repartition` implementation, when creating new `kstreamimpl` i wasn't passing new set of source nodes, therefore `abstractstream#ensurejoinablewith` was choosing wrong `sourcenodes` for ensuring co-partitioning. i guess this wasn't problem with other internal topics, since they were inheriting number of partitions from the source topic. but since `repartition` operation may change number of partition, it was necessary to set new `sourcenodes` when creating `kstreamimpl`. new integration tests verify that max number of partitions is chosen when doing join operation. as you pointed out, it may be different what user specified, but not sure if it's a bad thing... in my mind it kinda makes sense if internal implementation of kstream chooses proper number of partitions based on the operations. not sure what's the other way around it... also, tested it when topology optimization is specified and added integration test for it: `shouldchoosemaxpartitionnumberfromsourcetopicsforjoinoperationwhentopologyoptimizationisspecified`. seems like optimization algorithm is removing/updating graph nodes without modifying `internaltopologybuilder#copartitionsourcegroups`. this was breaking `copartitionedtopicsenforcer` because nodes that are added in `copartitionsourcegroups` maybe completely removed by the optimizer. therefore, when calling `internaltopologybuilder#copartitiongroups`, it would try to get topic with old node name which results in null. i added `internaltopologybuilder#maybeupdatecopartitionsourcegroups` and it's called during optimization when node is replaced. this was quite fun debugging :) now i know much more how all co-partitioning works around repartition topics. regards, levani",1,1,1,0.9042125940322876,0.9445473551750184,0.9688828587532043,1.0,accept,unanimous_agreement
538802836,7170,"hey levani, just a heads up in case you're struggling to get a 3/3 green build with all tests passing: given the number of flaky tests it can be difficult to get a clean pass, so it's useful to record which tests failed on a given run before retesting. that way we can tell if it's the same tests failing every time, or any potentially related streams test, vs flaky tests in connect or core (ideally also create a ticket for each flaky test or if a ticket already exists, comment with the failed link, to draw attention to the flakiest and hopefully get them addressed/fixed)",0,0,1,0.5560409426689148,0.6606033444404602,0.630705714225769,0.0,accept,majority_agreement
538903669,7170,"hey , thanks for the suggestion. i've added comments on relevant jira tickets.",1,1,1,0.6998576521873474,0.943504512310028,0.967063009738922,1.0,accept,unanimous_agreement
554428862,7170,latest commit has the code that verifies number of partitions when `repartiton()` operation is used next to `join()` notable changes are: 1) introduced new `immutablerepartitiontopicconfig extends repartitiontopicconfig` which has `setnumberofpartitions` as no-op in order to make sure that number of partitions specified by the user won't be altered. 2) `copartitionedtopicsenforcer` has updated logic which throws exception whenever number of partitions do not pass the validation all is covered with unit/integration tests.,0,0,0,0.9273385405540466,0.9954074025154114,0.9604477286338806,0.0,accept,unanimous_agreement
573815440,7170,"hello , sorry for pinging, but would love to get some estimate when this pr will be reviewed. it's getting harder and harder to keep this branch in sync with the trunk. would like to finalize this while i'm able to actively support this kip. also, seems like branch builds aren't triggered, any ideas how to trigger the build?",-1,-1,-1,0.98667174577713,0.9908573031425476,0.9888665080070496,-1.0,accept,unanimous_agreement
574055141,7170,"retest this, please",0,0,0,0.9849490523338318,0.958921492099762,0.9489298462867736,0.0,accept,unanimous_agreement
576140932,7170,"totally understandable and sorry for pushing, i'm just myself excited to move this kip forward. thanks for the review, i'll address your comments shortly.",-1,1,-1,0.9868599772453308,0.5483585596084595,0.836976170539856,-1.0,accept,majority_agreement
581141756,7170,ran `streams` test suite locally. the only test that failed was `kstreamimpltest#shouldsupporttriggermaterializedwithktablefromkstream` [code block] seems like it's not connected to this pr. haven't created jira ticket / pr to fix it because as per [a link] seems like people are on it.,0,0,0,0.953980267047882,0.9901542067527772,0.992131531238556,0.0,accept,unanimous_agreement
585833956,7170,ran `streams` module tests locally. all the tests passed. can we somehow trigger the jenkins build? cc,0,0,0,0.9860244393348694,0.9575134515762328,0.9936769604682922,0.0,accept,unanimous_agreement
593048414,7170,test this please,0,0,0,0.9859992861747742,0.9801037311553956,0.9870431423187256,0.0,accept,unanimous_agreement
596474986,7170,"hi any chance we could push this changes by 2.6 release? it's been a while :) regards, levani",1,1,1,0.9848441481590272,0.9944243431091307,0.9928820133209229,1.0,accept,unanimous_agreement
598798702,7170,ran `streams` module tests locally. all the tests passed.,0,0,0,0.9875954389572144,0.9887561202049256,0.9907034635543824,0.0,accept,unanimous_agreement
599112529,7170,"hey , yes! i'm reviewing it _now_ :) thanks so much for your patience. if it makes you feel better, i've been walking around with this sense of guilt over this pr hanging around.",1,1,1,0.9931796789169312,0.9943782687187196,0.997064173221588,1.0,accept,unanimous_agreement
599235445,7170,thanks for the update and no worries :),1,1,1,0.988965392112732,0.9926537275314332,0.951590895652771,1.0,accept,unanimous_agreement
605279103,7170,test this please,0,0,0,0.9859992861747742,0.9801037311553956,0.9870431423187256,0.0,accept,unanimous_agreement
