id,pr_number,body,distilbert_sentiment_label,codebert_sentiment_label,deberta_sentiment_label,distilbert_confidence,codebert_confidence,deberta_confidence,majority_label,final_decision,decision_reason
683602732,8657,"the result of [code block] is attached (see description) the main regression ({""records_per_sec"": 3653635.3672, ""mb_per_sec"": 348.4378} -> {""records_per_sec"": 2992220.2274, ""mb_per_sec"": 285.3604}) happens in case [code block]. i re-run the case 5 times and it seems the throughput of that case is not stable. **before** 1. {""records_per_sec"": 3653635.3672, ""mb_per_sec"": 348.4378} 1. {""records_per_sec"": 3812428.517, ""mb_per_sec"": 363.5815} 1. {""records_per_sec"": 3012048.1928, ""mb_per_sec"": 287.2513} 1. {""records_per_sec"": 3182686.1871, ""mb_per_sec"": 303.5246} 1. {""records_per_sec"": 2997601.9185, ""mb_per_sec"": 285.8736} **after** 1. {""records_per_sec"": 2992220.2274, ""mb_per_sec"": 285.3604} 1. {""records_per_sec"": 3698224.8521, ""mb_per_sec"": 352.6902} 1. {""records_per_sec"": 2977076.5109, ""mb_per_sec"": 283.9161} 1. {""records_per_sec"": 3676470.5882, ""mb_per_sec"": 350.6156} 1. {""records_per_sec"": 3681885.1252, ""mb_per_sec"": 351.1319}",0,0,0,0.9803891777992249,0.993206262588501,0.9891403913497924,0.0,accept,unanimous_agreement
683859366,8657,": thanks for the performance results. it seems that the average across multiple runs doesn't change much? also, 1 failure in the latest system test run. [a link]",1,1,1,0.958642601966858,0.9455966353416444,0.977794110774994,1.0,accept,unanimous_agreement
683863356,8657,yep. i didn't observe obvious regression caused by this patch. [code block] was flaky (see [a link],-1,-1,0,0.670883297920227,0.5415236949920654,0.9404476881027222,-1.0,accept,majority_agreement
685831526,8657,it seems there are some compilation errors in jenkins? [a link] ` 00:31:51 [error] /home/jenkins/jenkins-agent/workspace/kafka_kafka-pr_pr-8657/streams/streams-scala/src/test/scala/org/apache/kafka/streams/scala/streamtotablejoinscalaintegrationtestimplicitserdes.scala:136: value stringserde is not a member of object org.apache.kafka.streams.scala.serdes `,0,0,0,0.9860047698020936,0.994207501411438,0.9935306906700134,0.0,accept,unanimous_agreement
685833800,8657,this error is caused by #8955 and #9245 is going to fix it,0,0,0,0.964788258075714,0.8902119398117065,0.9822537302970886,0.0,accept,unanimous_agreement
685837334,8657,[code block] pass on my local. retest this please,0,0,0,0.9876112341880798,0.9858471751213074,0.9951626062393188,0.0,accept,unanimous_agreement
688481474,8657,"thanks for all reviews again :thumbs_up: my bad. i forgot this request :( expect for [code block], the other unused methods (in production scope) are removed by this pr. it seems we can remove [code block] from[code block]. that is similar to this pr and [code block] should not complete delayed request anymore. i can take over this in separate pr :)",-1,-1,1,0.776296854019165,0.715516209602356,0.99522203207016,-1.0,accept,majority_agreement
689241869,8657,: i think this pr is ready to be merged. any further comments from you?,0,0,0,0.8666406273841858,0.8538037538528442,0.945490062236786,0.0,accept,unanimous_agreement
689256048,8657,"[code block] [code block] on my local, they are flaky on trunk branch.",-1,0,-1,0.7708389163017273,0.6807913184165955,0.9371920228004456,-1.0,accept,majority_agreement
689838971,8657,: thanks a lot for staying on this tricky issue and finding a simpler solution!,1,1,1,0.9866334199905396,0.9742582440376282,0.9881393909454346,1.0,accept,unanimous_agreement
689921735,8657,thanks for all suggestions. i benefit a lot from it.,1,1,1,0.954576015472412,0.9681453704833984,0.9895251989364624,1.0,accept,unanimous_agreement
267731925,2264,"previously, there were many places in the code that were creating abstractrequest objects directly and passing them to the networkclient. unfortunately, abstractrequest objects are version-specific. for example, a listoffsetrequest object of version 0 will have different fields inside its struct than a listoffsetrequest object of version 1. as soon as the message constructor is invoked, the contained structs are formatted in the version-specific format. this change adds the abstractrequest#builder types. client code in the fetcher and producer, and other places, can create these objects and pass them to the networkclient. the networkclient can then decide what version of each request to use based on the apiversionsrequest data. when the version that needs to be used is too old to support a necessary feature, an error is returned to the upper layer, which can then decide what to do.",0,0,0,0.9745432138442992,0.9932821989059448,0.977389633655548,0.0,accept,unanimous_agreement
270150362,2264,", can you please rebase this branch? thanks!",1,1,1,0.9632184505462646,0.987430453300476,0.9786832332611084,1.0,accept,unanimous_agreement
270250551,2264,rebased on trunk and fixed some unit tests,0,0,0,0.9877474308013916,0.9931817650794984,0.9860310554504396,0.0,accept,unanimous_agreement
270380394,2264,"sorry, can you please rebase again?",-1,-1,-1,0.9864730834960938,0.9907634854316713,0.9932543635368348,-1.0,accept,unanimous_agreement
270446437,2264,rebased,0,0,0,0.9831162095069884,0.9435001611709596,0.9767982959747314,0.0,accept,unanimous_agreement
270447481,2264,"also removed a few places where this change duplicated kafka-4548, and reverted a change to the test log4j.properties file",0,0,0,0.9884068369865416,0.9944773316383362,0.994160294532776,0.0,accept,unanimous_agreement
270510560,2264,"fix authorizerintegrationtest, fetchrequesttest, saslapiversionsrequesttest, plaintextconsumertest. fixed a bug where fetcher#beginningoffsets and fetcher#endoffsets incorrectly required a broker with the new listoffsetsrequest rpc. will add this to compatibilitytest.",0,0,0,0.9886460304260254,0.9939783811569214,0.9584379196166992,0.0,accept,unanimous_agreement
271399925,2264,"good point about kip-74 compatibility handling. it sounds like we will have to reproduce the pre-kip-74 behavior of ""getting stuck"" when messages are too big rather than the new behavior of returning at least one message. i'll add back in that code shortly and work on a compatibility test for it. the other comments should be addressed now in the latest patch.",1,1,1,0.8485838174819946,0.797542154788971,0.8813934922218323,1.0,accept,unanimous_agreement
271674875,2264,i posted an update with a lot of fixes. i still need to address: * brokers should not send apiversionsrequest * implement pre-kip-74 message-too-big behavior * more centralized handling of versionmismatch exception * some other stuff,0,0,0,0.8905021548271179,0.647578239440918,0.52281254529953,0.0,accept,unanimous_agreement
271680561,2264,"i think your builder suggestion seems worth investigating.. if we continue with the model of delayed version determination, i was considering whether we could decouple the `struct` representation from the request objects. haven't really thought this through, but i was thinking something like this: [code block] that way the request objects remain immutable. i think you also had a suggestion which allowed us to construct the right version up-front.",0,0,0,0.7838124632835388,0.9620166420936584,0.5613734126091003,0.0,accept,unanimous_agreement
271720119,2264,"* brokers no longer send apiversionsrequest, to allow inter-broker communication with versions before 0.10 * addressed some style comments",0,0,0,0.9829401969909668,0.9911509156227112,0.9802339673042296,0.0,accept,unanimous_agreement
271724878,2264,", : unfortunately github doesn't let me post comments on the thread you have going about refactoring abstractrequest. so i'll comment here. there are really two questions here: 1. should the abstractrequest objects represent serialized data or unserialized data? 2. can we know the version of the request that we need before we send it to networkclient for #1, currently, abstractrequest objects represent serialized data, so they inherently have a version and a binary format. a lot of the methods in abstractrequest focus on serialization.. for example, abstractrequest#getrequest deserializes, abstractrequestresponse#sizeof gets the size of the serialized data, etc. you have to change the whole class hierarchy to modify this assumption. probably if you do that you would want to use a different name, such as message, to represent the fact that the new class hierarchy you are creating has nothing to do with serialized data. this might be worth doing. it would be a very big change. for #2, there are methods in networkclient such as leastloadednode that send the request to a node of the networkclient's own choosing. this doesn't really work unless the networkclient is in charge of picking a version. there also seems to be a bit of a layering violation here if the users of nc need to start concerning themselves with questions like has the peer they're talking to restarted or dropped its tcp session since we last learned about its version? #1 might make sense as part of a general refactor of the rpc class hierarchies. getting rid of the request class altogether might be a good idea since it invites confusion with clientrequest. i'm not sure i see a big win from #2 or a way to do it (but perhaps i am missing something).",-1,-1,-1,0.9599094986915588,0.8078056573867798,0.9308547377586364,-1.0,accept,unanimous_agreement
271765728,2264,i submitted a pr with some clean-ups: [a link],0,0,0,0.9773085713386536,0.9749882817268372,0.9938919544219972,0.0,accept,unanimous_agreement
271775275,2264,: thanks for the cleanup pull request. looks good... i merged it into this branch.,1,1,1,0.9831493496894836,0.9909935593605042,0.990856409072876,1.0,accept,unanimous_agreement
271867738,2264,"there are a number of failures in the system tests run. i started another one to double-check that it's not an environmental issue. in the meantime, i submitted another pr with clean-ups: [a link] i think we can merge after that (assuming the system tests pass) and do additional work in follow-up prs.",0,0,0,0.9688020348548888,0.984205424785614,0.9897095561027528,0.0,accept,unanimous_agreement
1728555687,14182,created new pr [a link],0,0,0,0.9856529235839844,0.985213339328766,0.9958928823471068,0.0,accept,unanimous_agreement
173692160,764,would you add the remaining kip-31 and kip-32 work to this patch (client side work and timestamp in produce response)? or that would be a different patch?,0,0,0,0.9889070987701416,0.9932754039764404,0.9946382641792296,0.0,accept,unanimous_agreement
173710219,764,this patch contains all the features in kip-31 and kip-32. the rest of the work is probably adding integration test. i have already added some unit tests but we can also add more if needed.,0,0,0,0.9833549857139589,0.9892317652702332,0.9820079207420348,0.0,accept,unanimous_agreement
173749672,764,"my question about remaining kip-31 and kip-32 work was based on outdated info -- i did not refresh my window and did not see that you added client-side implementation + returning timestamp in produce response. i see now that you also updated the pr description, thanks!",1,1,1,0.9576513171195984,0.9826722145080566,0.9759012460708618,1.0,accept,unanimous_agreement
174748282,764,"here are some high-level thoughts about the protocol: - basically we want the consumer to return the timestamp of the type specified by that topic even for compressed message set, but without the additional information the consumer would not know if logappendtime or logcreationtime is used. and as mentioned by just setting the wrapper message as the max value of all inner message timestamps and letting consumer check if wrapper timestamp is the max value does not perfectly work since 1) it requires the consumers to always decompress the whole message before returning any to the user, hence restricting buffer memory management we wanted to add in the future, 2) there is a corner case that if logappendtime is used and broker overrides the wrapper timestamp, it happens to be the same as the max of inner timestamps. i think we can add this information into the attribute field of the message, which currently only used 2 bits for four different compression types; instead we can make it a mask manner where the first 3 (or if we want to be safer, use 4) bits are preserved for indicating compression codec, leaves us a total of 8 (or 16) supported compression types, and use the forth (fifth) bit for indicating if the wrapper timestamp (for logappendtime, hence it is overridden) or the inner timestamp (for logcreationtime) should be used to set the consumer record's timestamp. and with this neither producer nor consumer needs to learn about this per-topic config from metadata responses, which makes the client change simpler, and other languages' adoption easier. - i am curious if the ducktape integration tests will be added in another pr?",0,0,0,0.8803070783615112,0.9864155650138856,0.975982666015625,0.0,accept,unanimous_agreement
174759962,764,"using attribute field is a good approach. it also lets consumers know the timestamp type. to make sure i understand your suggestion correctly: 1. the producer simply send message assuming the broker is using createtime. i.e. both attributes and timestamp will be using createtime. 2. if log append time is used, the broker only overrides the outer message's attribute field and timestmap field to use logappendtime 3. when consumer sees the message, it checks both magic as well as attribute field to see which timestamp is used (if magic > 0), and then decide whether it will override the inner message's timestamp or not. another thing is that we still need to decompress the entire compressed message, because of the reason i mentioned in one of the comments. given the stream compression used by producer, we will not have a actual ""relative offset compared with last message"" until we close the batch. instead, we only have the ""relative offset compared with the first message"" when we write a message into a batch. because the outer message only has the absolute offset of the last message, in order to have the absolute offset of an inner message, we have to decompress the entire compressed message to find out the ""relative offset compared with the last message"", then compute the absolute offset. i feel this is fine for new consumer because we are delivering messages in batch to use anyways.",1,0,1,0.6585328578948975,0.9518064260482788,0.6228975057601929,1.0,accept,majority_agreement
174762898,764,"btw, currently the compressioncodecmask is set to 0x7, so it is 3 bits. changing that to 4 bits is backward compatible so that should be fine.",0,0,0,0.9857670068740844,0.9912880063056946,0.9871783256530762,0.0,accept,unanimous_agreement
174773567,764,"yes your understanding is correct. i was initially thinking about possibilities of not decompressing the whole message when we add the memory management feature in the future so that we can choose to buffer less decompressed messages. but it seems not possible now, which maybe still fine for us so let's forget about it.",0,0,0,0.9362871050834656,0.9592393040657043,0.9373942613601683,0.0,accept,unanimous_agreement
175792263,764,i updated the patch with guozhang's proposal. i will add integration test in a separate pr. the intended tests are: 1. change timestamp type on the fly. 2. test message format version upgrade i actually want to do end to end test using different version of producers and consumers. but not sure if it is possible the current integration test because that requires different clients jars.,0,0,0,0.9634760022163392,0.9879327416419984,0.976334810256958,0.0,accept,unanimous_agreement
175972676,764,you can do end-to-end compatibility testing with system tests. take a look at compatibility_test.py. it currently tests 0.9.x java producer against 0.8.x brokers and 0.8.x consumer against an 0.9.x brokers. they both succeed on expected failure. you can add couple of more system tests to that to test newer brokers with older producers and/or consumers. note that you would need to update vagrant/base.sh to get kafka release 0.9.0.0.,0,0,0,0.972971498966217,0.9919087290763856,0.9699802994728088,0.0,accept,unanimous_agreement
175982253,764,"maybe i missed it, but i don't see where producer assigns timestamps if the user does not specify the timestamp in producerrecord. the code was there before, but maybe it got accidentally removed with recent changes?",0,0,0,0.9072781801223756,0.9701462388038636,0.960070788860321,0.0,accept,unanimous_agreement
175992639,764,"thanks for the direction on compatibility test. extracting timestamp type out makes sense, given we already did that for compressiontype. i will change server side as well.",1,1,1,0.905959129333496,0.922261655330658,0.9443004727363586,1.0,accept,unanimous_agreement
176356903,764,i reviewed the kip-32 part of the patch (did not go in detail about kip-31 related changes). using timestamp type in attributes made producer/consumer code much cleaner! i made minor comments. otherwise looks good to me.,1,1,1,0.9579424262046814,0.9903905391693116,0.9887391328811646,1.0,accept,unanimous_agreement
176481781,764,thanks for the review. will you help take a look at the patch? thanks.,1,1,1,0.8987830281257629,0.8425929546356201,0.9628108739852904,1.0,accept,unanimous_agreement
176513163,764,the test failure is intermittent and is not related to this change.,0,0,0,0.9591606259346008,0.9476086497306824,0.9852110147476196,0.0,accept,unanimous_agreement
176885686,764,. thanks for the review. i addressed your previous comments. would you take another look? thanks.,1,1,1,0.9434329867362976,0.9894898533821106,0.9908349514007568,1.0,accept,unanimous_agreement
178268615,764,"correct me if i am wrong, but it looks like we don't have integration test for the case when the broker rejects messages because the timestamp is outside of configured time difference. i think it would be easier to track the additional tests we need to do (beyond this pr) if we created separate kafka jiras for them. could you please create jiras?",0,0,0,0.9765241146087646,0.9263582229614258,0.9200668931007384,0.0,accept,unanimous_agreement
178321814,764,good catch. i am going to add the rejected message unit integration test. this actually exposed a separate bug on the server side that causing it not returning the correct error code. i create kafka-3189 for that bug. will update unit integration test after that bug is fixed.,1,1,1,0.9710066318511964,0.9311030507087708,0.9835026860237122,1.0,accept,unanimous_agreement
178911759,764,thanks a lot for the review .i updated the patch to address your comments. some explanation on the changes: 1. the broker now return invalidmessageexception when producer does not set the timestamp type to createtime. previously it just overrides it. 2. it seems difficult to completely avoid unnecessary message magic value check when send fetch response back. i chose the way which i think has the least impact. but it might still break if people roll back message.format.version. 3. i haven't add the configuration sanity check for message.format.version yet. i will do that after we decide on whether it should be a topic level configuration and whether we want to use magic value or apiversions.,1,1,1,0.9754888415336608,0.96125727891922,0.985576331615448,1.0,accept,unanimous_agreement
178974585,764,: thanks for the patch. do you plan add some integration tests to cover backward compatibility? we can do that in a separate jira.,1,1,1,0.9503635168075562,0.6580177545547485,0.9704362154006958,1.0,accept,unanimous_agreement
179291438,764,"also, could you update the doc on upgrade?",0,0,0,0.987767457962036,0.9888333082199096,0.9954195022583008,0.0,accept,unanimous_agreement
180561754,764,thanks for the review. your comments are addressed. i have created separate tickets for integration test. i am working on the upgrade doc now and will update it later.,1,1,1,0.9207152128219604,0.966253697872162,0.9680095314979552,1.0,accept,unanimous_agreement
181683922,764,i will start a poll on the mailing list as jun suggested. i updated the patch with upgrade doc. would you take a look? thanks. the test failure is irrelevant. i will open a ticket for that as it fails from time to time.,0,1,1,0.858666181564331,0.7471269965171814,0.9148574471473694,1.0,accept,majority_agreement
183538336,764,"hi, jiangjie, thanks for addressing the review comments. do you expect to submit a new patch soon? thanks,",1,1,1,0.9507823586463928,0.8376008868217468,0.9807784557342528,1.0,accept,unanimous_agreement
183561045,764,hi thanks a lot for the review. i just submitted a new patch. thanks!,1,1,1,0.9833162426948548,0.9944958090782166,0.9949592351913452,1.0,accept,unanimous_agreement
185176868,764,", thanks for the pr and for the quick response in addressing review comments. i filed a pr with your branch as the target with some additional minor improvements: [a link] please integrate into your pr (merge, cherry-pick or any other way you prefer) if you agree with the proposed changes. i expect to finish reviewing tomorrow. if jun merges in the meantime, we can use follow-up prs (if needed).",1,1,1,0.9581316113471984,0.8979222774505615,0.9709619283676147,1.0,accept,unanimous_agreement
185363481,764,thanks for the review. i just merged your pr.,1,1,1,0.8743969798088074,0.9338158369064332,0.9349986910820008,1.0,accept,unanimous_agreement
185510642,764,"thanks for the patch. looks good overall. just left a few minor comments. also, in topiccommand, when listing the available config options, could we add a description that messageformat will be ignored if it's not consistent with the inter broker protocol setting?",1,1,1,0.9862127304077148,0.9941707253456116,0.9931025505065918,1.0,accept,unanimous_agreement
185992097,764,thanks for the patient review. i think i have addressed previous comments. could you take another look?,1,1,1,0.8871671557426453,0.9219608306884766,0.961575448513031,1.0,accept,unanimous_agreement
186009747,764,": thanks for the latest patch. it looks good to me. once you address the last few minor comments, i can merge this in.",1,1,1,0.9810266494750975,0.9900804162025452,0.988359808921814,1.0,accept,unanimous_agreement
186274027,764,: thanks a lot for working on the patch! lgtm,1,1,1,0.9904416799545288,0.9916644096374512,0.9955869913101196,1.0,accept,unanimous_agreement
186277555,764,nice work . and the reviewers too. :),1,1,1,0.9911764860153198,0.995715081691742,0.9968433380126952,1.0,accept,unanimous_agreement
186463160,764,thank and so much for the great help on review!,1,1,1,0.9901143312454224,0.995402216911316,0.9943318367004396,1.0,accept,unanimous_agreement
189037289,764,"some of the streams tests were incorrect when adding the timestamp. for example in processorstatemanagertest: `new consumerrecord<>(persistentstoretopicname, 2, 0l, offset, timestamptype.create_time, key, 0)` should be `new consumerrecord<>(persistentstoretopicname, 2, offset, 0l, timestamptype.create_time, key, 0)` actually i'm thinking if it harms to keep the old constructor for consumerrecord and make default values of 0l and timestamptype.create_time, and revert all the changes in stream tests? that way we can be free of incorporating the metadata timestamp until it is supported.",0,0,0,0.9716639518737792,0.9750686287879944,0.9802842736244202,0.0,accept,unanimous_agreement
189040692,764,"well-spotted. i actually wanted to suggest moving `timestamptype` before the timestamp to make this kind of error harder, but i only noticed this potential problem late in the process and then wasn't sure if it was worth the effort. having real bugs instead of theoretical ones adds motivation. i would prefer if we don't add the old `consumerrecord` constructor personally as `consumerrecord` is used outside of streams too. maybe we could add a utility method in streams in the meantime?",0,0,0,0.8518962860107422,0.8997411727905273,0.9337953925132751,0.0,accept,unanimous_agreement
189047528,764,"makes sense. the only place streams use `consumerrecord` directly is in `timestampextractor`, what kind of utility method do you have in mind?",0,0,0,0.9871886372566224,0.992133617401123,0.9911581873893738,0.0,accept,unanimous_agreement
189048926,764,i just mean a method like `newconsumerrecord` that behaves exactly like the old constructor. then you could revert the changes in the streams tests and then do a search and replace in the streams folder.,0,0,0,0.988575279712677,0.9922956228256226,0.993520200252533,0.0,accept,unanimous_agreement
189049558,764,sounds good.,1,1,1,0.920201539993286,0.9417163729667664,0.857205867767334,1.0,accept,unanimous_agreement
1625488949,13870,there are issues with the build as well. could you look into this?,0,0,0,0.9809727668762208,0.95804625749588,0.9693862199783324,0.0,accept,unanimous_agreement
1625762579,13870,"thanks for the review, i have addressed your comments.",1,1,1,0.7525657415390015,0.8175089955329895,0.8530596494674683,1.0,accept,unanimous_agreement
1631769383,13870,thanks for the review. i have addressed your comments.,1,1,1,0.7795889377593994,0.8453478217124939,0.903476357460022,1.0,accept,unanimous_agreement
1632143234,13870,"now that [a link] is merged, could you update your pr?",0,0,0,0.9860150814056396,0.9857520461082458,0.9961806535720824,0.0,accept,unanimous_agreement
1633127990,13870,i have updated with latest and unified the mockcoordinatortimer.,0,0,0,0.9855959415435792,0.9846618175506592,0.995233952999115,0.0,accept,unanimous_agreement
1641304041,13870,the test failures are unrelated,0,0,0,0.948349118232727,0.7692809700965881,0.98296457529068,0.0,accept,unanimous_agreement
767804738,9944,"added fetch session components. will add some versioning tests and final cleanups, then open for review",0,0,0,0.982992708683014,0.9901962280273438,0.9920756816864014,0.0,accept,unanimous_agreement
