id,pr_number,body,distilbert_sentiment_label,codebert_sentiment_label,deberta_sentiment_label,distilbert_confidence,codebert_confidence,deberta_confidence,majority_label,final_decision,decision_reason
297865351,2929,can you review this patch? the patch has been rebased onto trunk. both integration test and the newly-added system test has passed. thanks.,1,1,1,0.9651951789855956,0.880834698677063,0.9610828757286072,1.0,accept,unanimous_agreement
298077449,2929,i have gone through the code again after rebasing the patch and it should be ready for review.,0,0,0,0.9834294319152832,0.969407320022583,0.9924506545066832,0.0,accept,unanimous_agreement
306559832,2929,": thanks for the patch. haven't looked at it in details. just a couple of quick comments. (1) once a disk is marked offline, it might be useful for the admin to be able to fix the bad disk (e.g., remounting) while the broker is online. this reduces the time that a broker has to be down while waiting for a disk to be fixed. if we do support this, it would be useful to test this out a bit. (2) according to [a link] it seems that an i/o exception in mmap buffer crashes the jvm. this will affect the failure detection in jbod. not sure how much we can do to improve it in the short term. at the minimum, it would be useful to do some testing to see how much this impacts us and document the impact.",1,1,1,0.9581487774848938,0.8895887732505798,0.96886146068573,1.0,accept,unanimous_agreement
306989136,2929,"thanks for helping with the review! i wanted to rebase earlier but got delayed due to the busy oncall week. i should be able to rebase/test the patch and review it myself again by this friday. hope we can get this reviewed and committed soon instead of another major rebase :) thanks for the suggestion. it is definitely useful for the admin to be able to fix the bad disk while the broker is running. i think it requires a new kip in addition to kip-112 and kip-113 because it takes new tool script and notification event which is not currently included in those two kips. is it ok for me work on this as a new kip after kip-112 and kip-113 is completed? the handling of i/o exception in mmap seems similar to the sixth future work mentioned in kip-112 wiki, i.e. handling various failure scenario case-by-case. kip-112 currently only handles disk failure that can be caught in the form of ioexception instead of jvm crash. i will think about how to handle this i/o exception and let you know my answer.",1,1,1,0.9931106567382812,0.9952215552330016,0.9964962601661682,1.0,accept,unanimous_agreement
307003408,2929,"the patch is ready for review. i have rebased it onto the latest trunk, addressed comments, passed integration tests and gone over the patch myself. thanks!",1,1,1,0.9814428687095642,0.9892861247062684,0.986565887928009,1.0,accept,unanimous_agreement
309918401,2929,"""t is definitely useful for the admin to be able to fix the bad disk while the broker is running. i think it requires a new kip in addition to kip-112 and kip-113 because it takes new tool script and notification event which is not currently included in those two kips. is it ok for me work on this as a new kip after kip-112 and kip-113 is completed?"" : for the above, i wasn't referring to the case when the admin fixes the disk and then notifies the broker about the fix online. the case that i was referring to is that when a disk is marked offline, if the admin can fix the disk while the broker is still online, then the admin can just restart the broker quickly after the disk is fixed. the downtime window for that broker is just the restart time. if the admin has to first shut down the broker and then fix the disk, the time for fixing the disk is part of the downtime window. so, my question is that is there any issue that prevents the admin from fixing the offline disk while the broker is up (e.g., the mmap-ed files on the bad disk).",0,0,0,0.6597643494606018,0.8144981265068054,0.9180817008018494,0.0,accept,unanimous_agreement
309958368,2929,"thanks for the explanation. i think i understand your point now. my understanding is that you are concerned with the possibility of broker crash with single disk failure due to mapped files issue. because i don't have multiple disk devices on my desktop to test mount/unmount of log directories while broker is running, i will test it in dev test cluster and i am waiting for sre to mount/unmount log directory for me since they have the sudo access. i will let you know the result tomorrow. i have also gone through the blog of mapped files you provided. most of the issue (e.g. limited number of mmap handlers) are the same between raid-10 broker and jbod broker. since we are not having them now, i assume we won't have them with jbod in the near future. the only issue that is more likely to happen with jbod is that jvm may crash when disk gets full. it is more likely to happen with jbod because the single jbod log directory will have smaller size than the raid-10 log directory. we currently use mmap files for reading/writing to index files. the solution suggested by the blog is to write to index files using `filechannel` instead of mmap files. it is mentioned that performance is minimal if large blocks are used. however, it is not clear whether there will be significant performance hit for index file write operation since the block size for index file write is small. suppose we can not use `filechannel` to write to index files due to performance reason, then i think the solution is for kafka administrator to properly monitor the usage of log directories on brokers and rebalance usage across log directories before any log directory gets full. for example rebalance can be triggered if usage exceeds 60%. in the rare case that there is extreme traffic spike that exhausts the space of a log directory, it seems ok to just let this broker fail. it will reduce availability of the broker in any unnecessary manner but it seems ok if this happens rarely. to summarize, i will test how broker handles umount of log directory while it is running. and kip-113 provides a reasonable solution to deal with vm crash due to full disk. does this sound reasonable?",1,1,1,0.8262093663215637,0.9615357518196106,0.9672363996505736,1.0,accept,unanimous_agreement
310195927,2929,i have updated the code (see [a link] and verified that the all files handlers in the offline log directory will be removed and we can unmount the disk while the broker is still running after the corresponding log directory goes offline.,0,0,0,0.9871270656585692,0.9926179051399232,0.9945582151412964,0.0,accept,unanimous_agreement
310785873,2929,"talked to offline. i think there might be a cleaner way to handle the disk exceptions. it looks that what we want to do when disk exception happens is the following: 1. notify controller there is a disk failure and mark the disk as failed. 2. return an error to whoever sent the request if the failure was triggered by a request. i think we can have a util method to do (1) immediately when the disk io occurs, and bubble up a kafkastorageexception which is a retriable exception. when the clients received this exception, it will act accordingly. the benefit of doing this is that we don't need to care about the what exact operation was in progress when the disk io exception occurs. the leader will always be moved to somewhere else and the related operation will be retried if needed.",0,0,0,0.8979358077049255,0.9816833734512328,0.9661317467689514,0.0,accept,unanimous_agreement
310809552,2929,"after further discussion with , we agree not to handle ioexception in asyc read for fetchrequest. i will add `logmanager` to the constructor of `logcleaner` and `logcleanermanager` so that they can call `logmanager.handlelogdirectoryfailure(...)` when there is `ioexception`. in addition, `partition.getorcreatereplica(...)` will check whether the log of an existing local replica is actually offline and throw `kafkastorageexception` if it is offline. we need this extra check because with the change in logcleaner, it is possible for replicas to be offline in `logmanager` while they are still in the cache `replicamanager.allpartitions`. this guarantees that if `logcleaner` encounters `ioexception`, controller will be notified via zookeeper path and `leaderandisrresponse` will tell controller the offline replicas.",0,0,0,0.9825248122215272,0.9938212633132936,0.9889425039291382,0.0,accept,unanimous_agreement
310817415,2929,"regarding your suggestion to go through usages of all methods in `filerecords`. there are currently many io related operations in kafka whose ioexception is either explicitly swallowed or not explicitly handled. i am not sure we should find out all of them and mark the corresponding log directory and replicas as offline in this patch. one reason is that this maybe over engineering and even reduce the availability of kafka in an unnecessary manner. given that we are not explicitly shutting down broker after catching those ioexception, either most log directory failure will already be caught and trigger `exit.halt(1)`, or kafka broker may be working just fine with its current way of handling those ioexception. thus it may not do us much benefit to handle them in a different way. it is also about the efficiency and the priority of work. i agree with you that there exists ioexception that we can handle in a better way to improve the quality of jbod support. but this task seems independent to the features added in this patch. the main goal of this patch is to change the way we handle log directory failure (i.e. those that currently trigger `halt()`) and it has covered most log directory failure (i.e. those that trigger ioexception during producerequest, fetchrequest, checkpoint read/write and logcleaner read/write). on the other hand, what you asked for is what other ioexception should be treated as log directory failure. i am wondering if we can do that separately in a follow-up patch after kip-112 and kip-113 are implemented. this may help speedup the overall implementation efficiency and reduce the need for rebase by splitting a large patch into smaller ones. also, by finishing kip-112 and kip-113 first, we can deploy the jbod feature sooner and the experience from its deployment can help us determine whether we need to handle some exception differently.",0,0,0,0.921944797039032,0.9703881740570068,0.9051088094711304,0.0,accept,unanimous_agreement
311121325,2929,": i will try to make a pass of the patch later this week as well. about the disk failure detection, we can probably start with something simple. currently, we only fail a broker on ioexception during writes. we can probably just treat that as disk failure to start with. it would be useful to make the failure detection part a bit more general so that we can incorporate more sophisticated failure detection in the future (e.g., consistent long i/os, on-disk crc failure, etc).",0,0,0,0.9405105113983154,0.9924875497817992,0.9376205801963806,0.0,accept,unanimous_agreement
311122631,2929,"it would be great to have your review! thanks! yeah i also would like to start with something simple. becket and i have agreed to limit the scope of disk failure in this patch to mainly those that currently cause `exit.halt(1)` as of the current kafka implementation. and yes, we need to expand it later to make the failure detection more general. for example, detection of long i/os is included as the sixth future work in the kip-112.",1,1,1,0.9878860712051392,0.9929147958755492,0.9963911175727844,1.0,accept,unanimous_agreement
311594553,2929,"thanks much for your review! i have updated the patch to address all the comments. i have added one integration test to simulate the log directory failure and verify that producer will receive notleaderforpartitionexception. note that producer request does not necessarily trigger ioexception immediately after log directory failure because log append operation uses mmap and its write operation to disk is delayed. on the other hand, our write operation to checkpoint file can see ioexception immediately because it uses filechannel. and if the ioexception is triggered when broker writes to checkpoint file, produceresponse will show notleaderforpartitionexception instead of kafkastorageexception. i will try to add another test to verify that producer can send message after retry.",1,1,1,0.9865745902061462,0.97945374250412,0.9919021725654602,1.0,accept,unanimous_agreement
311597230,2929,"it seems that has finished reviewing the patch and i think the kip-112 implementation is in good shape. on the other hand, i am in the process of writing kip-113 and it should be ready for review this week. i am not sure if you have time to review both kip-112 and kip-113. kip-113 is like going to be more complicated than kip-112 and needs closer look by senior committers. i am wondering if you can help review kip-113 if you have time for only one kip. thanks!",1,1,1,0.9315871596336364,0.9889490604400636,0.9912461638450624,1.0,accept,unanimous_agreement
311820470,2929,"i have updated the newly-added test and it verifies that the producer will see notleaderforpartitionexception when there is log directory failure and succeed after it retries. i have also rebased the patch onto trunk. all tests have passed except for the one test in kafka connector, which i don't think is caused by this patch.",0,0,0,0.9831757545471193,0.9799780249595642,0.9402201175689696,0.0,accept,unanimous_agreement
311823840,2929,: i am taking a look a the patch now. should be done by tomorrow.,0,0,0,0.9570634961128236,0.9712604880332948,0.9298561215400696,0.0,accept,unanimous_agreement
311824795,2929,thanks much!,1,1,1,0.9719381928443908,0.9401196837425232,0.9186553955078124,1.0,accept,unanimous_agreement
312411970,2929,"thanks so much for detailed review. i have addressed most of the comments in the updated patch. the main remaining issues are 1) whether we should invoke `replicamanager.handlelogdirfailure()` in `logmanager.handlelogdirfailure()` and 2) whether/how we can handle `ioexception` in the methods of `transactionstatemanager`. i have provided explanation under the corresponding comments. btw, there is one comment regarding a line in `partition.scala` that can only be replied in [a link] but not in this page.",1,1,1,0.9811896085739136,0.9550435543060304,0.9784339070320128,1.0,accept,unanimous_agreement
313317734,2929,thanks much for the comment .,1,1,1,0.7687335014343262,0.544926643371582,0.5755707025527954,1.0,accept,unanimous_agreement
313796522,2929,"finally i was able to fix the test failure by closing the newly added logdirfailurehandler thread, removing newly-added when the replicamanager shutdown, and optimizing the `logmanager.livelogdirs` not to instantiate new array when there is no offline log dir. these are only causing test failure in github (not on my machines) probably because the virtual machine used in github is slower with less memory. the patch is fully ready for review again :)",1,1,1,0.8726813793182373,0.9955081939697266,0.9911670088768004,1.0,accept,unanimous_agreement
314612960,2929,"excuse me.. i am wondering if there is any further issue to be addressed with the patch. or if there is no major issue and if you are busy, is it ok for becket to give it a final pass and merge it?",-1,-1,0,0.7676095962524414,0.8809893727302551,0.8365232348442078,-1.0,accept,majority_agreement
314808010,2929,: i started looking at your latest patch. i will finish my review today.,0,0,0,0.8756312727928162,0.6513437628746033,0.9797266721725464,0.0,accept,unanimous_agreement
314838404,2929,: thanks much for your time! i also reviewed the entire patch again and found 3 minor issues. i will address all of them after your review.,1,1,1,0.9907726049423218,0.987619161605835,0.9931339025497437,1.0,accept,unanimous_agreement
315308226,2929,"thanks so much for taking so much time to review this patch! i thought the patch is ready but clearly there was space for improvement. i have updated the patch to address all comments. i have gone over the patch carefully with the hope that i don't miss anything this time. besides minor changes such as the method comment and removal of unused import, here are the bigger changes that were made: - simplified the way we handle kafkastorageexception such that we no longer need to invoke `maybeaddlogfailureevent()` if `kafkastorageexception` is caught. - added a final static variable `replicamanager.offlinepartition` and use it to make sure that kafkastorageexception is consistently returned when client attempts to access an offline replica. this is verified with the updated test code. - replaced all usage of `kafka.common.kafkastorageexception` with `org.apache.kafka.common.errors.kafkastorageexception` so that we can remove `kafka.common.kafkastorageexception` going forward. - added metric `offlinereplicacount` which counts the number of offline local replicas on a broker. - added logdirfailurechannel to log and logsegment and invoke `maybeaddlogfailureevent()` right after the ioexception is caught. - renamed the new exception to unknownerrorcodeexception",1,1,1,0.9886959791183472,0.9748873114585876,0.992957353591919,1.0,accept,unanimous_agreement
315517505,2929,"this afternoon i reviewed the patch myself by going over the entire patch line by line. i improved the comments in a few places, removed unnecessary imports and reverted a few changes that have become unnecessary now. i sincerely think that i should have fixed these before your previous review.. for ease of review, i have squashed the commits before your previous review into one commit ([a link]. the second commit ([a link] includes the change that were made to address your previous comments from the previous review. the summary of this change can be found in the earlier comment i posted yesterday. the 3rd commit ([a link] ) improved comment and reverted unnecessary changes. some major changes where made based on that previous two rounds of review from you, e.g. introduction of the logdirfailurechannel and the consistency of kafkastorageexception in response. i am 95% confident now that the patch won't need similar major change anymore in its current state. i will give this patch another two rounds of end-to-end review, make sure that there is indeed no further improvement i can figure out by myself, before giving it to you for further review. thanks again for your time!",1,0,1,0.7108097076416016,0.5997154116630554,0.721525251865387,1.0,accept,majority_agreement
315590692,2929,"i gave the patch another round of review, made some minor improvements (e.g. comment) and fixed system test failure. the only notable change is that `kafkastorageexception` and `unknowncodeexception` now extends `invalidmetadataexception`. this is needed so that producer can update metadata if the leader replica is now offline. these changes are in [a link] commit. i will give the patch the third review tomorrow.",0,0,0,0.971595048904419,0.9901519417762756,0.7333003282546997,0.0,accept,unanimous_agreement
315707331,2929,i have carefully reviewed the patch three times and made all the improvements i can think of. all system tests and integration tests have passed. would you have time to review the patch sometime this week? thank you! there is only one improvement that i haven't made in this patch. currently the producer will still send producerequest with version 3 if the message magic version is 2. this is because the newly-added produce version 4 is incompatible with 0.11 broker. the downside of this is that server will translate kafkastorageexception to notleaderforpartitionexception. but this should not cause any problem to the functionality of the producer. we can fix this in a followup patch if needed.,0,1,1,0.5153802037239075,0.9813135862350464,0.9904698133468628,1.0,accept,majority_agreement
315982647,2929,thanks so much for the quick and detailed review! i have addressed most of the comments. please see my reply above.,1,1,1,0.9901201725006104,0.9945918917655944,0.9951570630073548,1.0,accept,unanimous_agreement
316247280,2929,i have updated the patch and addressed all the comments. all tests have passed. i have reviewed the latest commit and it looks ok to me. i am reviewing the entire patch with all the commits.,0,1,1,0.8790882229804993,0.5933583974838257,0.6937696933746338,1.0,accept,majority_agreement
316276230,2929,thanks much for all the help! i have rebased the patch onto trunk head and finished reviewing the patch. the following changes were made in the latest commit. - catch ioexception before it is propagated to replicamanager - removed a few other ioexception handling now that the ioexception will be caught and thrown as kafkastorageexception in log's methods. - halt broker on log directory failure if inter.broker.protocol < 0.11.1 - removed unknownerrorcodeexception - updated upgrade.html,1,1,1,0.9885138869285583,0.9903899431228638,0.9936338663101196,1.0,accept,unanimous_agreement
316926503,2929,"thanks much for the quick help! i have rebased the patch onto trunk head and addressed all the comments. in particular, i have further moved ioexception from logsegment to those methods in log and updated the comments as suggested. i have reviewed the entire patch again end-to-end and fixed everything to my best knowledge. it should be ready for your review again. thanks!",1,1,1,0.990331768989563,0.9952422380447388,0.9954198598861694,1.0,accept,unanimous_agreement
317064344,2929,"thank you so much for taking so much time to review the patch. i definitely think the current patch is much more consistent in style and cleaner than it was before. initially i was focusing only on the functionality. i will focus more on the code style and consistency next time, e.g. in kip-113. i have addressed jun's comments and rebased patch onto trunk head. all tests have passed. i will also review the patch again myself. can you take a look at the patch? thanks!",1,1,1,0.9868191480636596,0.9922651052474976,0.9951692223548888,1.0,accept,unanimous_agreement
317103017,2929,i have finished reviewing the patch and made minor changes in the latest commit. i verified that the patch has passed all ducktape system tests.,0,0,0,0.9737339615821838,0.9642255306243896,0.9291926622390748,0.0,accept,unanimous_agreement
317157179,2929,thanks much for your help! i have updated the patch to address all comments except those that can be done in the followup patch. and the patch has been rebased onto trunk head.,1,1,1,0.991232931613922,0.977240264415741,0.99184650182724,1.0,accept,unanimous_agreement
656589433,9001,i just noticed that you haven't updated the code which creates the `apiversionsresponse` in `saslserverauthenticator`. is it intentional or something left to be done?,0,0,0,0.9719942808151244,0.98542582988739,0.9914728403091432,0.0,accept,unanimous_agreement
656902905,9001,"thank you for taking a look! iiuc you are referring to these lines: [a link] my requirement is that under the hood of the newly added api: `org.apache.kafka.clients.admin#describefeatures`, the `apiversionsresponse` returned to the `adminclient` needs to contain the features information. note that this new api issues an explicit `apiversionsrequest` under the hood. in such a case do you think i should populate the features information in the above lines in `saslserverauthenticator` too? i'm trying to understand where would this come into play (sorry i know little to nothing about `saslserverauthenticator`).",1,1,1,0.9843313097953796,0.972069263458252,0.98844575881958,1.0,accept,unanimous_agreement
659752993,9001,retest this,0,0,0,0.9849403500556946,0.956061065196991,0.9793913960456848,0.0,accept,unanimous_agreement
659793027,9001,retest this,0,0,0,0.9849403500556946,0.956061065196991,0.9793913960456848,0.0,accept,unanimous_agreement
700585584,9001,"thanks a lot for the review! i've addressed the comments in the recent commit: 06d8b47131f168db88e4f7d5bda3dd025ba9a2a2. i've provided a response to all of your comments. there are few i couldn't address, and 1-2 comments i'll address in the near future.",1,1,1,0.9908559322357178,0.9929937720298768,0.9936659932136536,1.0,accept,unanimous_agreement
702023940,9001,"thanks for the review! i've addressed the comments from your most recent pass in a7f4860f5f8bb87cfb01452e208ff8f4e45bcd8b. to answer your question, the deployment will fail if the feature was finalized at say `[minversionlevel=1, maxversionlevel=6]` previously, but the new broker only supports version range: `[minversion=4, maxversion=6]`. this is where `firstactiveversion` becomes useful. by bumping it up during a release (instead of the supported feature's `minversion`), we are able to get past this situation. when `firstactiveversion` is advanced in the code, and the cluster is deployed, the controller (and all brokers) know that the advancement acts a request to the controller to act upon the feature deprecation (by writing the advanced value to `featureznode`). so, in this case we would release the broker with the supported feature version range: `[minversion=1, firstactiveversion=4, maxversion=6]`, and the deployment wouldn't fail.",1,1,1,0.9767707586288452,0.9759522080421448,0.9873286485671996,1.0,accept,unanimous_agreement
702026788,9001,thanks for the review! i've addressed the comments in c31d6b5245c635e659ff0f203bd08bc015a15ffb.,1,1,1,0.9844849109649658,0.9860641956329346,0.9889233708381652,1.0,accept,unanimous_agreement
702621705,9001,thanks for the review comments! i have done the change proposed in [a link] in the most recent commit: 4218f95904989028a469930d0c266362bf173ece . please have a look.,1,1,1,0.9852358102798462,0.9801186323165894,0.9928688406944276,1.0,accept,unanimous_agreement
703048608,9001,"thanks for the review! i've addressed the comments, the pr is ready for another pass. i've also fixed the compilation errors.",1,1,1,0.9778745770454408,0.991933286190033,0.992224097251892,1.0,accept,unanimous_agreement
