id,pr_number,body,distilbert_sentiment_label,codebert_sentiment_label,deberta_sentiment_label,distilbert_confidence,codebert_confidence,deberta_confidence,majority_label,final_decision,decision_reason
312474682,119,that sounds better! i'll have to take a look on a hidpi display and a few different resolutions to make sure this works well.,1,1,1,0.952009916305542,0.9732266068458556,0.9518064260482788,1.0,accept,unanimous_agreement
312476513,119,"ok this branch is now ""ready for review"" , there's a known centering problem for multi display filed as a separate issue #121 which i'll try to work on shortly, if i can set up multi display for myself.",0,0,0,0.9857749938964844,0.967819094657898,0.9449030160903932,0.0,accept,unanimous_agreement
312478957,119,"i was able to get a multi monitor setup by connecting my tv and the latest commit [a link] should also address issue #121 so please test and let me know. it is working for me in my basic tests (opening first run, resizing and moving, then reopening) for hidpi, lodpi, single and dual monitor.",0,0,0,0.8391749858856201,0.7364173531532288,0.6214585304260254,0.0,accept,unanimous_agreement
313580614,119,"thank you . fyi i also tested on 3 computers with hidpi, multi monitor and 1080p and 1280x800 displays and all seem to look good to me :-) looking forward to the code review.",1,1,1,0.9924881458282472,0.9960994720458984,0.9967148303985596,1.0,accept,unanimous_agreement
359171559,196,"ok, fair enough.",0,1,0,0.9432280659675598,0.6251494288444519,0.9501385688781738,0.0,accept,majority_agreement
552118492,423,"while the pr fixes it if you don't change hidden settings, it still won't work if you select a custom font. though unlike code, terminal doesn't implement zooming via that preference. so, i wonder if this font should be special-cased to be applied even if a custom font is used.",0,0,0,0.929523468017578,0.8598264455795288,0.9411858916282654,0.0,accept,unanimous_agreement
554770222,423,"do we need to have a separate font setting for terminal, especially as it is not exposed in the ui? otherwise we would have to hard-code a check the specific name of the system monospace font against that used to conceal text.",0,0,0,0.9839977025985718,0.9847462177276612,0.9924991726875304,0.0,accept,unanimous_agreement
554776812,423,"rebased, also moved system gsettings creation into `application` to match the existing ones.",0,0,0,0.9887484312057496,0.9945656061172484,0.9950610995292664,0.0,accept,unanimous_agreement
554776896,423,"oh wait, actually pushed the correct one now.",0,0,0,0.8882486820220947,0.8859664797782898,0.9508475065231324,0.0,accept,unanimous_agreement
555219201,423,"i'm not sure i 100% understand the question, but the system monospace font is also used in code, for example, so i don't think a terminal-specific setting makes sense necessarily",0,0,-1,0.9279326796531676,0.7035809755325317,0.4985562562942505,0.0,accept,majority_agreement
555240211,423,"wel, code has a setting. and it's even exposed in the ui and is also used for zooming. terminal has a setting too, but it's only in gsettings. if you change that setting, conceal text won't work even with this fix, because, well, you explicitly requested a different font. so maybe that setting can just be removed? otherwise terminal will have to hardcode the redacted font to use it even if a custom font is selected.",0,0,0,0.9828708171844482,0.9805028438568116,0.9795429706573486,0.0,accept,unanimous_agreement
555442596,423,"ok, so the setting `io.elementary.terminal.settings.font` could be removed and the system monospace font always used? otherwise, for consistency we should expose the custom font setting in the ui, like code, and hack around the redacted font issue.",0,0,0,0.9891706109046936,0.9955081939697266,0.9914690852165222,0.0,accept,unanimous_agreement
567635162,423,added a line to appdata changelog.,0,0,0,0.9874261617660522,0.9916187524795532,0.9925644993782043,0.0,accept,unanimous_agreement
737847910,477,"on way of testing this is to create this script in a directory other than your home directory: [code block] navigate to this script in files and choose ""open in ... terminal"" from the context menu. with master the script runs with the home directory as the pwd. with this pr the script runs with the directory where the script is located as the pwd.",0,0,0,0.985262393951416,0.9917281866073608,0.994115114212036,0.0,accept,unanimous_agreement
738882651,477,i believe the message `[glib] setenv()/putenv() are not thread-safe and should not be used after threads are created` that is printed before and after any output from the command is due to an upstream bug.,0,0,0,0.9546294808387756,0.9824392795562744,0.9862124919891356,0.0,accept,unanimous_agreement
1044372427,477,closing due to age. a new pr may be submitted later.,0,0,0,0.9827070832252502,0.9823739528656006,0.9752410650253296,0.0,accept,unanimous_agreement
844163542,578,best to wait for the warning dialog to be merged before merging this as it is easier to accidentally trigger a shortcut.,0,0,0,0.9697754383087158,0.9873635172843932,0.9806021451950072,0.0,accept,unanimous_agreement
844271932,578,what do you feel about supporting `f5` as a shortcut for this (cf files and epiphany)?,0,0,0,0.9817424416542052,0.9919999837875366,0.9844571948051452,0.0,accept,unanimous_agreement
844303268,578,"sure, if the symmetry with files and epiphany is intended, adding f5 as alternative shortcut seams reasonable. i included it with the last commit. but this should probably not up to me to decide that :d i still find the symmetry somewhat misleading, because files and epiphany update/reload a given resource, while this action resets/restarts the shell. on concern is also that this action/shortcut could be misused to ""just clear"" the terminal screen.",0,0,1,0.8169980049133301,0.69614177942276,0.7209101319313049,0.0,accept,majority_agreement
844309513,578,"yes, i see what you are saying - that is why i was unsure about using ""reload"" for the menuitem :thinking:",0,0,0,0.9067350029945374,0.4687978029251098,0.5798706412315369,0.0,accept,unanimous_agreement
844312170,578,"the current shortcut ` r` is very similar to ` r` used in files for the ""refresh"" action so there could still be confusion.",0,0,0,0.9871371984481812,0.9851853847503662,0.9870920181274414,0.0,accept,unanimous_agreement
844318485,578,what about ` d` - this is used to exit the current shell anyway except it does not work natively when a process is running.,0,0,0,0.985451877117157,0.97584867477417,0.9922308325767516,0.0,accept,unanimous_agreement
844330658,578,"as far as i understand bash interprets ctrl d as the forth unicode character end of transmission (because **d** is the forth letter in the alphabet). i am not sure if this counts as a ""real"" shortcut. and in other command line programs like ""cat"" or ""netcat"" it can also be used to end the current input, but it does not exit the process. so i think ctrl d cannot be thought of as a universal exit shortcut. in my opinion the shift ctrl r and f5 shortcuts are fine, as it is conceptually somewhat similarity with reloading the browser or refreshing files. imo only the word ""reload"" is misleading here. but this is of course up to the /ux to decide that.",0,0,0,0.9282107353210448,0.97102552652359,0.9297665953636168,0.0,accept,unanimous_agreement
844358798,578,"ok, let's wait for their input.",0,0,0,0.9815137982368468,0.9677693247795104,0.9860324263572692,0.0,accept,unanimous_agreement
880911114,578,this looks like a 0 diff since we merged in the other branch with accel labels that included this,0,0,0,0.9855136275291444,0.9882574677467346,0.9916620254516602,0.0,accept,unanimous_agreement
953975801,633,i've added a check and made values hex based as to fall inline with other stylesheets.,0,0,0,0.9879735708236694,0.9914042949676514,0.9943195581436156,0.0,accept,unanimous_agreement
954908015,633,"thank you for the review. i need to familiarise myself a little bit better with the eos coding style, i've only just found the relevant documentation online for it.",1,1,1,0.8783270120620728,0.9366405606269836,0.9714728593826294,1.0,accept,unanimous_agreement
958897580,633,the logic here is still faulty and the opacity does not change until the settings are changed. would you like me to push a fix?,0,-1,0,0.9120708107948304,0.5043699741363525,0.7966435551643372,0.0,accept,majority_agreement
1095225332,633,looks like this pr would not be necessary if #552 were progressed.,0,0,0,0.9733768105506896,0.9917793869972228,0.9822977781295776,0.0,accept,unanimous_agreement
1178010462,633,hasn't had an update in a long time and now conflicts. superseded by [a link],0,0,0,0.856086790561676,0.9836705923080444,0.8982331156730652,0.0,accept,unanimous_agreement
1114184156,658,"terminal can already be closed with `alt + f4`, `ctrl + d` and `shift + ctrl + w`. see [a link] however, i can see that for consistency with `gnome-terminal` there is a case for adding another shortcut.",0,0,0,0.9890673756599426,0.99216228723526,0.993603765964508,0.0,accept,unanimous_agreement
1114185557,658,i think you need to check for ongoing child processes and also to save the app state before closing. see handler for the delete event.,0,0,0,0.9859547019004822,0.9895923137664796,0.9909845590591432,0.0,accept,unanimous_agreement
1114720334,658,"fixed your comments, thank you for remarks. ctrl + shift + w and ctrl + d close only one tab. this shortcut allows to close all tabs.",1,1,1,0.8518026471138,0.7361242175102234,0.9747788906097412,1.0,accept,unanimous_agreement
1115091052,658,"ah yes, sorry - i only had one tab open when i tried those shortcuts so the window closed as well.",-1,-1,-1,0.9858689308166504,0.989843487739563,0.9664629101753236,-1.0,accept,unanimous_agreement
1115227874,658,i have fixed a small lint error so that ci passes. you can check for lint locally by installing `vala-lint` from [a link],0,0,0,0.9870670437812804,0.9941447377204896,0.9781342148780824,0.0,accept,unanimous_agreement
1435734917,702,"i do not pretend to understand every aspect of this pr but it looks good and the test framework is impressive. however, when i install and run it from a different terminal app (i've tried xterm and blackbox) using no parameters, i get an immediate crash. the backtrace is : [code block]",1,1,1,0.914208173751831,0.532341718673706,0.938719928264618,1.0,accept,unanimous_agreement
1435735766,702,putting a null check in `\src\application.vala` line 120 stops the crash at least.,0,0,0,0.9791074395179749,0.9923235177993774,0.988879919052124,0.0,accept,unanimous_agreement
1435739827,702,"other observations so far when launching from `gnome-terminal` after compiling in the null check to stop crash: * using the `-h` works as expected and does not launch `io.elementary.terminal`. * using the `-v` option in a different terminal app opens `io.elementary.terminal` as well as returning the version . this does not happen with master branch. moreover, a new tab is opened at the current directory in addition to restoring saved tabs. * using `-n` and `-t` works as master. see issue `#498` which persists * using `-n` and `-t` (when an instance of `io.elementary.terminal` already running) works as master * using `-w` works as master. also restores saves tabs * using `-w` in combination with `-n` or `-t` works as master.",0,0,0,0.9851797819137572,0.9941826462745668,0.9800334572792052,0.0,accept,unanimous_agreement
1435743700,702,"* using`-e` flag works the same as in master, additional arguments ignored unless preceded by further flags * using `--execute=` flag works if there is no space after `=`. if there is a space then the app opens but no tab is created and no error message given. this differs from master, which gives a warning about spaces both in the launching terminal and in an additional tab in the launched terminal.",0,0,0,0.98563551902771,0.9915470480918884,0.9911311268806458,0.0,accept,unanimous_agreement
1435751745,702,as far as tested so far the `-x` flag works the same as master. further testing will be done later.,0,0,0,0.9880384206771852,0.9935922026634216,0.9915253520011902,0.0,accept,unanimous_agreement
1435758943,702,"the last commits should fix opening the terminal without arguments and the -v argument not returning. i would like to add test cases for them too, but i couldn't find a way to do that right now. about #498, it's out of scope for this pr. the issue is that the restoration code will create a tab in the home directory if no tab is to be restored. i'm working in cleanup this code and fix it in another branch. the new code ignores `-e` and `-x` if they are a empty line arguments. i don't really think crating a new tab with a warning is the best way to warn the user about it, we could either print a warning and return while in the local handling, or show a error dialog/notification if empty lines was sent to the primary instance.",0,0,0,0.5123093128204346,0.8972296118736267,0.9810550212860109,0.0,accept,unanimous_agreement
1436024814,702,"that's fine, i wasn't expecting it to be fixed in this pr. i agree that creating a new tab is not necessary. either a printed warning or a notification depending on means of calling would be good.",0,0,1,0.6746662259101868,0.8692566156387329,0.598038911819458,0.0,accept,majority_agreement
1436027587,702,"while `io.elementary.terminal -w ~/music` works, `io.elementary.terminal --working-directory=~/music` does not. however the same happens in master. `io.elementary.terminal --working-directory=/home/ /music` does work.",0,0,0,0.9846038222312928,0.9933264255523682,0.9936339855194092,0.0,accept,unanimous_agreement
1436031582,702,there is a slight difference between master and pr regarding the `-x` flag. running `io.elementary.terminal -x ls` from a directory other the home directory results in a new tab containing a listing of the current directory with this pr but with master it results in a listing of the home directory. i think the behaviour of this pr is more correct.,0,0,0,0.9837223887443542,0.9853591918945312,0.9855459928512572,0.0,accept,unanimous_agreement
2569160048,836,nice use of `git grep` - i was not familiar with that.,0,1,1,0.6511421203613281,0.8130312561988831,0.9495782852172852,1.0,accept,majority_agreement
395981547,263,does this still allow terminal applications that need the escape key (like vim) to function?,0,0,0,0.9863283038139344,0.9927453398704528,0.991450846195221,0.0,accept,unanimous_agreement
395981971,263,"apologies, that should have been something i could have tested myself. i can confirm that this pretty much breaks vim (making it even harder to exit :stuck_out_tongue: ) and presumably anything else that needs the escape key.",-1,0,-1,0.9547247886657716,0.9622660279273988,0.974944531917572,-1.0,accept,majority_agreement
395982226,263,"ok, thanks - i should have thought of that - i thought it was too easy!. i'll see if it can be fixed.",1,1,1,0.9827286601066588,0.9852091670036316,0.9893277287483216,1.0,accept,unanimous_agreement
395986722,263,i don't think audible feedback is necessary in this case,0,0,0,0.9615501761436462,0.8502568006515503,0.983234167098999,0.0,accept,unanimous_agreement
458481691,263,/ux what is the ruling on whether an audible feedback is needed when a key press is ignored?,0,0,0,0.9834923148155212,0.986234962940216,0.9881677031517028,0.0,accept,unanimous_agreement
458483408,263,"i guess that in any case it should honor the ""event sounds"" setting.",0,0,0,0.9854224920272828,0.983601987361908,0.9839091897010804,0.0,accept,unanimous_agreement
458630966,263,"we don't have strong conventions/written rules here as far as i know. i do think any time a keypress is ignored when it would normally perform some action it should `gdk.beep ()`, and that does respect the event sounds setting automatically.",0,0,0,0.956404745578766,0.9827125072479248,0.9837738275527954,0.0,accept,unanimous_agreement
498752124,263,withdrawing as no consensus as to whether this is correct approach after nearly a year.,0,0,0,0.582832396030426,0.9574247598648072,0.7993059754371643,0.0,accept,unanimous_agreement
428691669,262,"this seems to work as expected ux-wise, and is an awesome feature! i think it's fine that there's not a confirmation that it was copied, as copying doesn't usually show any sort of confirmation. same with scrolling to the top and not highlighting the selection: i think this behavior is fine. assuming the command was on one line should _probably_ be fixed before this is merged, though.",1,1,1,0.9857638478279114,0.9920862317085266,0.9964975714683532,1.0,accept,unanimous_agreement
439509645,262,"oops - i forgot the request to fix the multiline command limitation - feel free to revert if desired. i'll have a look at this asap. as i recall it was not straight forward. it may be simpler to restrict it to only copying the output, not the command.",0,-1,0,0.8022022247314453,0.8009256720542908,0.533467173576355,0.0,accept,majority_agreement
500078245,375,"i'm not sure whether this should be done in this pr, and this is a correct solution, but checking the window is fullscreen or not first will also fix #377. [code block]",0,0,0,0.91091126203537,0.9736287593841552,0.963143825531006,0.0,accept,unanimous_agreement
500080610,375,thanks for the tip! fixed,1,1,1,0.967714250087738,0.984475076198578,0.9877086877822876,1.0,accept,unanimous_agreement
573351078,461,"really need a complete review, overhaul of code related to opening new windows to see whether it can be simplified while still dealing with all different circumstances. or at least made clearer.",0,0,0,0.9433786869049072,0.969626247882843,0.8924976587295532,0.0,accept,unanimous_agreement
578178917,461,"unforunately not even this fix makes it good again. there are multiple issues. 1. the app tries to match an existing tab for the given workdir. if it finds it it simply switches to that tab instead of creating a new tab. suppose the already existing tab is running some command (top or whatever under /tmp). you start as `io.pantheon.terminal -e ls -w /tmp` the app will switch to the tab with the ""top"" command running and nothing happens. this is bad a needs to be fixed either, validate if the tab is running an ongoing command and if it is then create a new tab. if not, then switch to the tab and run the command. 2. suppose you want to open the same path in multiple tabs. currently this is not possible. one tab is running ""/tmp"" you start this `io.pantheon.terminal -w /tmp` the existing tab is used so i guess we need a new argument to force a new tab (-t) just like we have a new window. this would at least make it possible to preserve some old compatibility obviously, we want to work with the same window with multiple tabs. using multiple windows is not the issue here. it was all somewhat working in the previous version. what do you think?",-1,0,-1,0.8781536221504211,0.5084450244903564,0.9702463150024414,-1.0,accept,majority_agreement
578261851,461,"thanks for review! this pr is only meant to fix issues when using the `-e` and `-x` flags raised in #460 (and not cause any regressions). (1) i do agree that a tab that is running a process should be omitted from duplicate checking but i don't think terminal ever did that so perhaps should be put in a separate pr. (2) regarding forcing opening a duplicate tab from the commandline, again this might be useful to someone but is a bit of a corner case unless a process is running in which it would be addressed by fixing point (1). the behaviour of the master branch is also to not open duplicate tabs so this should be the subject of a separate issue/branch. when you say it ""was all somewhat working"" what version are you comparing this pr with?",1,1,1,0.959930181503296,0.9480097889900208,0.9873937368392944,1.0,accept,unanimous_agreement
578384610,461,"thank you for your response. yes, i kind of thought it would have to be new prs. i was not referring to any specific version, but the behavior. in some older version (1 month and more) i don't think any existing tabs were matched and always a new one was created. anyway, i am new to the code and made some changes and it works ok. i can push those prs. how hard and how long does it take to get those prs merged to the master? (i don't have much experience so i am asking). thank you again",1,1,1,0.9674407243728638,0.9771614074707032,0.9837191700935364,1.0,accept,unanimous_agreement
578528507,461,"good to hear you are starting to contribute code! the time it can take for prs to get reviewed, approved and merged varies enormously from hours to more than a year (if ever). it depends on how many changes are made, how critical they are and how easy to understand/test/review. that is why it is a good idea to make as few substantive changes as possible in each pr (something i do not always achieve!) and explain/comment them well. it also depends on how much of their time each of the relatively small number of reviewers can devote on any particular point in their lives and on which day(s). so patience is sometimes required.",1,1,1,0.9748101830482484,0.980969786643982,0.9916800856590272,1.0,accept,unanimous_agreement
578616734,461,"understood, thank you.",1,1,1,0.7723398208618164,0.9042266011238098,0.7960850596427917,1.0,accept,unanimous_agreement
578776154,461,made a small fix [a link],0,0,0,0.9882242679595948,0.9817511439323424,0.9948282837867736,0.0,accept,unanimous_agreement
774177454,461,timed out.,0,0,0,0.9829759001731871,0.7892991304397583,0.9814842939376832,0.0,accept,unanimous_agreement
1472358023,710,#709 is merged - a conflict needs to be resolved.,0,0,0,0.9670955538749696,0.9806442260742188,0.97957843542099,0.0,accept,unanimous_agreement
1498026786,710,"testing locally, the ci was falling because of the idle in `on_switch_page()` in the mainwindow class. #720 should fix it.",0,0,0,0.9861648082733154,0.9480860233306884,0.992176353931427,0.0,accept,unanimous_agreement
1498040134,710,"for me it was failing in the ""quit"" action test. i tried to fix it but failed. we could always leave that test out and fix it later if necesssary.",0,0,0,0.6822383403778076,0.8764861822128296,0.8375822901725769,0.0,accept,unanimous_agreement
1498889360,710,"#720 now merged ... but ci still failing :disappointed: however, ci passed locally :man_shrugging:",-1,-1,-1,0.9730749726295472,0.7097483277320862,0.9886596202850342,-1.0,accept,unanimous_agreement
1499587418,710,"hmm, contrary to my previous diagnosis the ci is (now) failing on the ""new-window"" action test. see #723",0,0,0,0.9128687977790833,0.9346497654914856,0.9721296429634094,0.0,accept,unanimous_agreement
1499647021,710,"the new-window test is fine, `glib.test.skip()` don't return by itself, so the assertion in the quit test got triggered.",0,0,0,0.951561152935028,0.9915372133255004,0.992938220500946,0.0,accept,unanimous_agreement
1570532508,730,is there a reason why the man page is in packaging instead of in the main source?,0,0,0,0.952398717403412,0.9901202917099,0.9927595853805542,0.0,accept,unanimous_agreement
1570602534,730,i am not sure of the technicalities but the source man page file seems to get compressed before getting put in `usr\share\man\man1` . there may be other requirements for `man` to work properly? it seems simpler for `deb` to handle it. is there an advantage in putting it in main source? the flatpaks i've tested do not seem to install man pages anyway.,0,0,0,0.9518585801124572,0.9532087445259094,0.9704957604408264,0.0,accept,unanimous_agreement
1570614752,730,"no idea, i was just curious if this was a legacy thing and if it might effect, for example, distribution on fedora for us to have this in packaging",0,0,0,0.9486964344978333,0.5986045002937317,0.93873929977417,0.0,accept,unanimous_agreement
1570619399,730,"it used to be more difficult (especially with cmake), but now meson [a link] so we can bring it back to the main repo",0,0,0,0.9791266918182372,0.9837415218353271,0.987527310848236,0.0,accept,unanimous_agreement
1570669126,730,"ah, i wasnt aware of the native meson support so using that makes sense to lessen deb specific stuff.",0,-1,0,0.8789833784103394,0.745557963848114,0.9791531562805176,0.0,accept,majority_agreement
1570721861,730,just tried out the meson install_man function and it works as expected (not compressing the file) but if there is a compressed file already installed by deb present then that is shown by preference. not sure what to do about that.,0,0,-1,0.5947635173797607,0.96078622341156,0.5445435643196106,0.0,accept,majority_agreement
1570801590,730,"if you used my patch i'm happy that i could contribute but i failed was half asleep. forgot to add the proper -- commands for the new options in the page. posting fix for my first patch if needed, unless you caught it. ```--- manpageupdate 2023-05-31 12:22:06.518553741 -0700 +++ new.io.elementary.terminal.1 2023-05-31 12:17:19.082819021 -0700 @@ -13,13 +13,13 @@ .br \-h "", "" \-\-help show help message and exit .tp -.br \-n "", "" \-\-help +.br \-n "", "" \-\-newwindow forces a new window .tp -.br \-t "", "" \-\-help +.br \-t "", "" \-\-newtab forces a new tab .tp -.br \-m "", "" \-\-minimized +.br \-m "", "" \-\-help starts terminal in a minimized state .tp .br \-v "", "" \-\-version",1,1,1,0.934934675693512,0.7899095416069031,0.9786133170127868,1.0,accept,unanimous_agreement
1571204527,730,"if you installed the software with a deb, you should update it with a deb and that will update the compressed file installed by the deb.",0,0,0,0.9892759323120116,0.9942400455474854,0.9944700002670288,0.0,accept,unanimous_agreement
2276754233,769,proposed [a link] to merge into this branch. fixes missing accels,0,0,0,0.9882442951202391,0.993763506412506,0.989591896533966,0.0,accept,unanimous_agreement
