id,pr_number,body,distilbert_sentiment_label,codebert_sentiment_label,deberta_sentiment_label,distilbert_confidence,codebert_confidence,deberta_confidence,majority_label,final_decision,decision_reason
638849947,584,"this is because when first terminal has already been disambiguated, the basename of the second terminal no longer matches it so the second term is never disambiguated.",0,0,0,0.980283796787262,0.9856956601142884,0.992408037185669,0,accept,unanimous_agreement
638860266,584,"yes, that seems to work ok - thanks.",1,1,1,0.8570077419281006,0.9438766241073608,0.8924553990364075,1,accept,unanimous_agreement
638864208,584,"yes, if foreground processes cannot change the cwd then this check is unnecessary. but i doubt whether the extra complexity of code is worth the (undetectable) performance gain.",0,0,0,0.8468751311302185,0.9263139963150024,0.9805678725242616,0,accept,unanimous_agreement
638864952,584,"if the script is run in a sub-process (which is in my understanding equivalent to foreground process) like this [code block] it shouldn't be able to change the cwd. but if somebody sources a script which changes the cwd script like this [code block] yes then it could the change the cwd. this is probably really rare so you have to decide if it is worth taking into acount.. also there is already some kind of precedent set with the `remember_position` which relies on the enter key being pressed. using the `contents_changed` signal introduces a second mechanism for similar issue: both want to check if a command was executed. imo, ideally both should rely on the same mechanism.",0,0,0,0.924450695514679,0.9681031703948976,0.9825960397720336,0,accept,unanimous_agreement
638866935,584,ok makes sense. i don't have an opinion what is better here.,0,0,0,0.5569225549697876,0.5885140299797058,0.9000808596611023,0,accept,unanimous_agreement
638869500,584,"hmm ok, still i think it should be possible to somehow to get away with doing half the work as the loop runs over all the permutations. anyway this is a different issue.",0,0,0,0.8087053894996643,0.8711051940917969,0.9629180431365968,0,accept,unanimous_agreement
638895225,584,codestyle [code block],0,0,0,0.9884973764419556,0.9879235625267028,0.9943273663520812,0,accept,unanimous_agreement
320552595,386,both variables are unused,0,0,0,0.9781273603439332,0.975143313407898,0.9918732047080994,0,accept,unanimous_agreement
325431997,386,could be simplified to: [code block],0,0,0,0.9873741269111632,0.9927398562431335,0.9946563243865968,0,accept,unanimous_agreement
325583649,386,"ok, done.",0,0,0,0.9750974178314208,0.8946365714073181,0.979367971420288,0,accept,unanimous_agreement
325609165,386,i think there is no reason to increment. you could simplify further: ‘‘‘ long delta_cells = clicked_col - current_col + (clicked_row - current_row) * get_column_count (); ‘‘‘,0,0,0,0.971873104572296,0.9790654182434082,0.9881076216697692,0,accept,unanimous_agreement
326214512,386,`clicked_symbol` is unused now,0,0,0,0.9873621463775636,0.993126392364502,0.994709014892578,0,accept,unanimous_agreement
326279041,386,i think it should be `gdk.event_propagate`,0,0,0,0.9873698353767396,0.989205241203308,0.9892661571502686,0,accept,unanimous_agreement
326279186,386,i think it should be `gdk.event_propagate`,0,0,0,0.9873698353767396,0.989205241203308,0.9892661571502686,0,accept,unanimous_agreement
326279351,386,i think it should be `gdk.event_stop`,0,0,0,0.9848805665969848,0.98712557554245,0.9879740476608276,0,accept,unanimous_agreement
329355759,386,"just a minor suggestion: as the functions of the `vte.terminal` also use ""absolute"" row-values, would it maybe better to return ""absolute"" values in the `get_cell_clicked_function`? [code block] or is there a reason to prefer ""relative"" values?",0,0,0,0.9886476397514344,0.9942862391471864,0.9882699251174928,0,accept,unanimous_agreement
334246315,386,"ok, i have now used absolute values consistently.",0,0,0,0.9858577251434326,0.9641349911689758,0.9903013706207277,0,accept,unanimous_agreement
341363922,386,just add [code block] here to fix the scrolling problem,0,0,0,0.9859229326248168,0.9920857548713684,0.994885504245758,0,accept,unanimous_agreement
341378759,386,wouldn't it be better to use the `cursor_moved` signal here? this should cover all cases. [code block],0,0,0,0.988060176372528,0.9941824078559875,0.9947662353515624,0,accept,unanimous_agreement
341808516,386,"i don't think so. we only want to remember the cursor position after the last key press, not when the cursor is moved for other reasons (e.g. due to output from a process).",0,0,0,0.967832624912262,0.954653263092041,0.9777717590332032,0,accept,unanimous_agreement
427508619,505,"i don't think we should add this to be honest. it's such a specific, finicky setting. we should just ensure the default behavior makes sense. :smile: [code block]",-1,1,1,0.3943740129470825,0.4230777621269226,0.9775431752204896,1,accept,majority_agreement
427508808,505,see previous comment. [code block],0,0,0,0.9862107634544371,0.9890000224113464,0.995126724243164,0,accept,unanimous_agreement
517599793,505,i think something like this would more closely follow our whitespace conventions and is much easier to read: [code block],0,0,0,0.9544038772583008,0.9643498063087464,0.9650609493255616,0,accept,unanimous_agreement
517600500,505,"similar to above, i think this more closely follows our modern conventions: [code block]",0,0,0,0.9793236255645752,0.9705992937088012,0.986796736717224,0,accept,unanimous_agreement
518866831,505,"hmm, that is not the intended behaviour - there is already a separate ""zoom"" setting for the fallback zoom for new tabs. i expected that to be used where a tab did not have a corresponding ""tab-zoom"" value (which cannot guaranteed as the settings could be manually sent to an empty or invalid array regardless of the default value). i'll look at this part of the code more closely.",0,0,0,0.9812326431274414,0.916085720062256,0.9718409180641174,0,accept,unanimous_agreement
518922507,505,"ok, recent commits should fix the problem.",0,0,0,0.9822599291801452,0.9759677648544312,0.9924861192703248,0,accept,unanimous_agreement
520840450,505,"what effect do these values have? i tested in terminal with 3 tabs: 25% (min), 100% (default) and 400% (max) these were the values in the settings: `['0,2', '1,0', '4,0']`",0,0,0,0.9868337512016296,0.9929310083389282,0.9935150146484376,0,accept,unanimous_agreement
521446702,505,"these values prevent manual entering of out of range default zoom values into the settings using dconf-editor or otherwise. they are not essential as the code clamps the values it reads in from the settings anyway, but they inform the user.",0,0,0,0.9869521856307985,0.9934653639793396,0.993909239768982,0,accept,unanimous_agreement
522243076,505,"yes, but do the values make sense if i can bypass them via the ui? `['0,2', '1,0', '4,0']` from my point of view it would then have to be changed as follows: [code block]",0,0,0,0.9864872097969056,0.9924099445343018,0.9927452206611632,0,accept,unanimous_agreement
1376581376,742,this function appears redundant? it just calls another function with the same signature.,0,0,0,0.9618889093399048,0.94406920671463,0.9729076027870178,0,accept,unanimous_agreement
1376583412,742,i don't think this call is necessary - the function is called by the `window_title_changed` signal handler anyway.,0,0,0,0.9846912026405334,0.9837831854820251,0.9821001887321472,0,accept,unanimous_agreement
1376587598,742,i think you need to save the zoom array as well - it will also be reordered.,0,0,0,0.9882158041000366,0.9796493649482728,0.991032063961029,0,accept,unanimous_agreement
1376598884,742,"i am sorry, i do not know. eventually, i would suggest removing call `check_for_tabs_with_same_name` in master branch as this should be focused only on continuous saving and this line was in master in case this branch would be reverted for example in the future or as unwanted off topic change.",-1,-1,-1,0.9863404035568236,0.9893856048583984,0.9741417169570924,-1,accept,unanimous_agreement
1377636209,742,"ok, it can be left for now.",0,0,0,0.9856634140014648,0.989950954914093,0.9925068020820618,0,accept,unanimous_agreement
1377641050,742,what is the reason for saving the tabs on `focus-in` event?,0,0,0,0.9812300205230712,0.9918785095214844,0.9938256740570068,0,accept,unanimous_agreement
1377657791,742,"handle the situation when is opened first terminal, then second one, second one is closed and then is laptop rebooted. without this code would be saved tabs and tab-zooms from second already closed terminal but should be saved from first one.",0,0,0,0.9879937171936036,0.9638170003890992,0.9947932362556458,0,accept,unanimous_agreement
1377684703,742,"but it works only when is focus passed back to previously opened terminal, do you know what i mean, it works only when the previously opened terminal is in the layer immediately under the closed one or is focused before is laptop turned off.",0,0,0,0.9870060682296752,0.9858142733573914,0.994059443473816,0,accept,unanimous_agreement
1377793096,742,"yes, the issue of what to do about saving settings in second and subsequent windows is not really decided. one point of view (including me) is that settings only refer to the first opened window (that is what files implements). others think that the last *closed* window is the one that should save the settings (which is what terminal implements). i think the issue you are trying to fix is also present in master because rebooting forcibly kills the process and the save on close code never runs. i would not add this line in this pr since master does not save on focus in and there is no agreed ""right"" answer.",0,0,0,0.8659566044807434,0.9359299540519714,0.9775261878967284,0,accept,unanimous_agreement
1377852489,742,"i am afraid that i discovered weird behavior without added resaving `tabs` and `tab-zooms` during focus in event. because when i close secondly opened terminal, then i return to previously opened terminal and i for example change cwd in any tab so then is saved broken state, because on cwd are saved only `tabs` and no `tab-zooms`, in other words saving glib.settings calls returns back attack like boomerang :d my added saving to focus in event would solve this problem, and in best way i think or this would be solved by not saving calls and call `tabs` or `tab-zooms` all time so when i return back to previously opened terminal and i start somehow interact with it broken state can not occurs. what do you think?",-1,-1,1,0.9812201261520386,0.9712826609611512,0.8768703937530518,-1,accept,majority_agreement
1377915546,742,"i have also an idea about adding a new bool option `continuous saving` to settings or add variant to existing one `remember tabs` option in settings, change it from bool to select with variants `continuous saving`, `only on close` and `do not save` and could be even by default `only on close` variant or disabled bool settings `remember tabs`.",0,0,0,0.983053982257843,0.9910528063774108,0.9918823838233948,0,accept,unanimous_agreement
1378712495,742,"yes, on reconsideration i think we have to save on focus-in because the settings must always reflect the state of the current window. i think the issue of whether continuous saving should be optional should be raised separately as it needs signing off by the design team to add another setting. in general elementary tries to avoid too many settings. there would need to be two frequently used situations where different settings are required. why would users not want to continuous save?",0,0,0,0.9173457622528076,0.9578369855880736,0.9789851903915404,0,accept,unanimous_agreement
1378723903,742,"i can imagine disable continous saving in my script which run when is laptop charging changed to battery. from point of view of elementary apps developers i do not know whether is possible or planned change configuration of each app depending on charging mode so this argument will be probably invalid. and i do not have another argument and it might be even confusing, i mean terminal works differently on battery mode and ac mode.",0,0,0,0.6750873923301697,0.8105367422103882,0.8988664150238037,0,accept,unanimous_agreement
1378746352,742,"yes, i think you would struggle to convince the design team that was a good idea unless the app was really draining the battery with continuous saving - in which case it would be better to throttle it (code autosaving is throttled so that it only happens after one second of inactivity).",0,0,0,0.9675054550170898,0.88966304063797,0.9709394574165344,0,accept,unanimous_agreement
488078016,542,"hm, it's probably better to stick with the default button look here than hardcoding white",0,0,0,0.9634712338447572,0.925370752811432,0.9580615758895874,0,accept,unanimous_agreement
488080898,542,we should only have one class per file so we can do [code block],0,0,0,0.9855576157569884,0.9915127158164978,0.9926704168319702,0,accept,unanimous_agreement
488082024,542,is there a reason it's better to call these `01` etc instead of `color_button_black` etc?,0,0,0,0.983112633228302,0.9941744208335876,0.9919014573097228,0,accept,unanimous_agreement
488082926,542,"since this is only ever called once, we probably don't need a separate function",0,0,0,0.9829015731811525,0.9849085807800292,0.9844300746917723,0,accept,unanimous_agreement
488084499,542,this can be simplified to: [code block],0,0,0,0.9856936931610109,0.9922056794166564,0.995418906211853,0,accept,unanimous_agreement
488089840,542,"we have prior art for using the word ""style"" instead of ""theme"" when referring to the dark and light styles. i'm not sure if we have anything for referring to the app chrome specifically. maybe has suggestions here. these labels should be sentence case as suffixed with "":"" [code block]",0,0,0,0.9530400633811952,0.9739058017730712,0.9879692792892456,0,accept,unanimous_agreement
488090813,542,this should be 6 to align it with the action area and bottom margin of 18 so that we have a total of 24px (double space) between the content and action areas: [code block],0,0,0,0.9836851358413696,0.9942861199378968,0.9952309727668762,0,accept,unanimous_agreement
488093049,542,"these should all be suffixed with "":"" and the more common en_us spelling is ""gray"" [code block]",0,0,0,0.9813320636749268,0.9908221960067748,0.9933931231498718,0,accept,unanimous_agreement
488095569,542,it seems like it would be easier to do: [code block],0,0,0,0.9739752411842346,0.9837844371795654,0.9881500005722046,0,accept,unanimous_agreement
488096506,542,tooltips shouldn't have punctuation [code block],0,0,0,0.9782928824424744,0.9860047698020936,0.9317252039909364,0,accept,unanimous_agreement
488099440,542,is there a reason for changing these from clicked to button press event?,0,0,0,0.9796772599220276,0.9919703006744384,0.994756817817688,0,accept,unanimous_agreement
488107799,542,we should make sure to use the -symbolic variant here [code block],0,0,0,0.9865962862968444,0.9931227564811708,0.9951876401901244,0,accept,unanimous_agreement
492375698,542,"yeah, i used it since there does not seem to be a dark style for the ""list-add"" icon. but since we are switching to ""list-add-symbolic"" anyways this is not an issue anymore.",0,0,0,0.935215711593628,0.985704779624939,0.9831274747848512,0,accept,unanimous_agreement
492377099,542,"this is matching the naming in gogh. i think it makes sense since it is generally shorter and there are a number of themes where for example ""blue"" does not actually correspond to a blue color.",0,-1,0,0.9682696461677552,0.6206954717636108,0.9741448760032654,0,accept,majority_agreement
492377220,542,the more you know!,0,0,0,0.7393513321876526,0.6306365132331848,0.9314708113670348,0,accept,unanimous_agreement
492379076,542,when deciding on grey/grey i used the same as tilix. but i changed it now to american spelling :),1,1,1,0.9347160458564758,0.9585519433021544,0.9463293552398682,1,accept,unanimous_agreement
492379242,542,definitely.,0,0,0,0.9069509506225586,0.931037425994873,0.9467660188674928,0,accept,unanimous_agreement
492380961,542,actually yes :) i noticed that the `clicked` event for radio buttons is triggered once when the button is activated and (more surprising) once when the button is deactivated. this prevented the updating of the radio buttons from the color preferences dialog. this wasn't an issue until now since the order of the activating/deactivating of the different buttons was just right for this to work.,1,1,1,0.9837835431098938,0.989000916481018,0.9930985569953918,1,accept,unanimous_agreement
492381467,542,could you elaborate on when to use which variant? is there some documentation on this somewhere?,0,0,0,0.9862176775932312,0.9901025295257568,0.9931649565696716,0,accept,unanimous_agreement
496248357,542,"basically the `-symbolic` variant will follow the text color whereas the normal variants are full color icons. it's only kind of a historical coincidence that the normal variant for `list-add` happens to be close to the text color in the light style. this will change in a future revision of the icon set. so in this context where we want a simple shape icon that follows the ui text color, `symbolic` is the way to go",0,0,0,0.9770298004150392,0.9919233918190002,0.9792750477790833,0,accept,unanimous_agreement
496248508,542,that makes sense to me!,1,1,0,0.8082242012023926,0.7342833280563354,0.9790166020393372,1,accept,majority_agreement
148354989,160,"this needs to be a property and the setter clause needs to contain code that will change the size of the font when the factor changes (with proper checks). the increment, decrement and set_default zoom functions need to be modified accordingly (they only need change the zoom_factor).",0,0,0,0.9875504374504088,0.9942545294761658,0.994550883769989,0,accept,unanimous_agreement
148355334,160,this function is not needed - it is better that it inside the zoom_factor setter to ensure the two remain in sync (zoom_factor should be clamped to sensible levels).,0,0,0,0.9855034351348876,0.9943698048591614,0.9932814836502076,0,accept,unanimous_agreement
148359975,160,some sanity checking of zoom_factor would be a good idea.,1,0,0,0.5191511511802673,0.8673648238182068,0.9712475538253784,0,accept,majority_agreement
148360296,160,maybe better to connect to the realize signal to set the font size at the correct time.,0,0,0,0.982858657836914,0.993334412574768,0.9797576069831848,0,accept,unanimous_agreement
148361632,160,"that sounds more like another issue, as that problem would have existed before these changes.",0,0,0,0.8347930908203125,0.9795723557472228,0.9433252811431884,0,accept,unanimous_agreement
148518206,160,"at the moment you are duplicating some code in the increment, decrement and restore_default zoom functions and these also contain some range checking. if you simplify these functions to just change the zoom factor then the range checking can be consolidated in the zoom factor setter. also, by binding this property to a setting, you are exposing it directly to the user so sanitizing is more important.",0,0,0,0.985573947429657,0.992820918560028,0.9905239939689636,0,accept,unanimous_agreement
148669546,160,"i have simplified the increment, decrement and default zoom functions, i think it makes sense to only test the zoom_factor for the range when increment or decrementing as the functions exist and there is no reason to test it otherwise. what do you think a sane range would be? currently the limits are a maximum of 590% and a minimum of 10%; i think from my testing 40% and 250% seem better limits for what a user is likely to want although i am not sure about the behaviour on hidpi screens.",0,0,0,0.9291145205497742,0.9532389044761658,0.9664122462272644,0,accept,unanimous_agreement
148959881,160,backing variables for properties should be private,0,0,0,0.9884212017059326,0.99274080991745,0.9927957653999328,0,accept,unanimous_agreement
148960074,160,conventionally a blank line between get and set clauses (after closing brace).,0,0,0,0.9796215295791626,0.9900215268135072,0.9902222156524658,0,accept,unanimous_agreement
148960085,160,"because ""zoom_factor"" property is bound to a setting, it feels better to test value and assign _zoom_factor accordingly rather than assign _zoom_factor and then maybe immediately reassign it - i.e. [code block] (although no adverse effects were noticed your way)",0,0,0,0.9786444902420044,0.9923431277275084,0.9879429936408995,0,accept,unanimous_agreement
129398830,125,wouldn't `term.destroy ()` work here?,0,0,0,0.9445037245750428,0.994301438331604,0.9907808899879456,0,accept,unanimous_agreement
129440395,125,"sorry, i don't know what you meant. if after this line add `term.destroy ()`, then all term signals will be disconnected",-1,-1,-1,0.9851137399673462,0.9908073544502258,0.9905741810798644,-1,accept,unanimous_agreement
129440814,125,"ah yes, you're right here.",0,0,0,0.969560444355011,0.7950453758239746,0.9514034390449524,0,accept,unanimous_agreement
133510906,125,make this `else if` on the same line as the above `}`: [code block],0,0,0,0.987554371356964,0.991873562335968,0.9954665899276732,0,accept,unanimous_agreement
133511010,125,add a space between the `handle_paste_event` and `()`.,0,0,0,0.9873952865600586,0.9927569031715392,0.9950997233390808,0,accept,unanimous_agreement
133511286,125,could this be called also here? [a link] this is the same code as in this method.,0,0,0,0.9897218346595764,0.993523120880127,0.9953095316886902,0,accept,unanimous_agreement
141103412,125,unnecessary use of ****this****. there is no ambiguity and rest of this class does not use this form for `searchbar`.,0,0,0,0.7073288559913635,0.984329104423523,0.860054075717926,0,accept,unanimous_agreement
1650609903,760,i think this will cause a memory leak since the lambda keeps a reference on us and the terminal widget so neither of them will be freed :( see [a link] and [a link],-1,-1,-1,0.7756238579750061,0.9806545376777648,0.9945555925369264,-1,accept,unanimous_agreement
1664868591,760,duplicated line.,0,0,0,0.9844058156013488,0.9605778455734252,0.89598149061203,0,accept,unanimous_agreement
1664868758,760,wrong indentation.,-1,-1,-1,0.9131431579589844,0.8190920352935791,0.5286551713943481,-1,accept,unanimous_agreement
979413803,687,what is this change?,0,0,0,0.9281107187271118,0.974288821220398,0.9881572127342224,0,accept,unanimous_agreement
979415135,687,a blank line before return,0,0,0,0.9797698259353638,0.974047839641571,0.9923130869865416,0,accept,unanimous_agreement
979433181,687,as `initial_found` is only used once we can omit it: [code block],0,0,0,0.9843410849571228,0.9943112134933472,0.995133936405182,0,accept,unanimous_agreement
254505662,265,it seems that we should stop using `glib.list` which forces us to use `` which doesn't support `return` or `break`. i would change `terminals` to use `gee.arraylist` or `gee.linkedlist` and then immedietely return here if we found an identical tab.,0,0,0,0.9850786924362184,0.9855932593345642,0.9882544279098512,0,accept,unanimous_agreement
254677099,265,"if the `foreach (terminalwidget t in terminals {}` construction is used it is possible breakout of the loop without changing from glist and saving a local variable. this is what i have done in the latest commit. changing to a gee collection requires more extensive and unrelated changes and should be a separate pr, i think. it would also be possible to use a vala.arraylist at the expense of adding another dependency. at some point it should be possible to replace the gee dependency with a libvala dependency?",0,0,0,0.9850607514381408,0.9924089908599854,0.987810492515564,0,accept,unanimous_agreement
307932704,265,why do we need this `allow_duplicate` here? i do not see any calls to this function overriding this argument with `true`.,0,0,0,0.972331702709198,0.9898586869239808,0.9891246557235718,0,accept,unanimous_agreement
307958997,265,i cannot remember tbh. maybe i was just unsure whether there might be a future need to add a duplicate tab from the commandline e.g. with a new flag. i guess we can remove this parameter for now.,0,0,0,0.9390738606452942,0.8849784135818481,0.97096449136734,0,accept,unanimous_agreement
363710366,265,duh! how did i miss that?,-1,-1,-1,0.9755190014839172,0.976040542125702,0.9649246335029602,-1,accept,unanimous_agreement
914062603,662,does this need to be public?,0,0,0,0.9822430610656738,0.989211916923523,0.989806830883026,0,accept,unanimous_agreement
914063787,662,"since we have `get_string_palette` now, should this not be a constant and have `get_rgba_palette` use `get_string_palette (prefer_dark ? dark : light)` for its fallback?",0,0,0,0.9873865246772766,0.995184361934662,0.9927957653999328,0,accept,unanimous_agreement
914108491,662,"this is possible only if we replace the *whole* of the palette if *any* of the custom colors is invalid. is that ok? at the moment, we only replace individual colors.",0,0,0,0.9853111505508424,0.9857839941978456,0.9935653805732728,0,accept,unanimous_agreement
914174227,662,couldn't we do this? [code block],0,0,0,0.9829743504524232,0.9910681843757628,0.9933005571365356,0,accept,unanimous_agreement
914176338,662,i don't think this was meant to be removed. this overwrites the setting with the sanitized palette if we detect that any of the values are invalid,0,0,0,0.9718871712684632,0.9645525217056274,0.9824157953262328,0,accept,unanimous_agreement
915097228,662,reinstated,0,0,0,0.9678234457969666,0.9855746030807496,0.9742533564567566,0,accept,unanimous_agreement
388236504,486,"missing words: should be e.g. ""are you sure you want to kill this process?""",0,0,0,0.5505329370498657,0.9769784808158876,0.9481569528579712,0,accept,unanimous_agreement
388236970,486,superfluous blank line,0,-1,-1,0.8920981884002686,0.8551979660987854,0.9682365655899048,-1,accept,majority_agreement
