id,pr_number,body,distilbert_sentiment_label,codebert_sentiment_label,deberta_sentiment_label,distilbert_confidence,codebert_confidence,deberta_confidence,majority_label,final_decision,decision_reason
388237820,486,no need to repeat `d.destroy ()` - move after the if clause and remove else clause.,0,0,0,0.9870396256446838,0.9930058121681212,0.9941093921661376,0,accept,unanimous_agreement
390407602,486,"i feel like we should avoid the word ""kill"". ""terminate"" is probably better language",0,0,0,0.8163586258888245,0.8956124186515808,0.9515092372894288,0,accept,unanimous_agreement
390410427,486,the settings menu probably isn't the right place for this. all of the other menu items here effect all of your tabs. a more appropriate location is probably either the tab menu or the context menu,0,0,0,0.9773555994033812,0.9841375946998596,0.9708462953567504,0,accept,unanimous_agreement
390503780,486,"even ""terminate"" seems a little... excessive. couldn't it just be “end”?",-1,-1,-1,0.9290151000022888,0.7834749221801758,0.6113908886909485,-1,accept,unanimous_agreement
390508550,486,"there are technical differences between ""kill"" and ""end / terminate"" although we may not need trouble the user with them. i presume the intended use of the option would be to forcibly end (kill) a process that could not be ended normally.",0,0,0,0.9715194702148438,0.9742287993431092,0.9891470670700072,0,accept,unanimous_agreement
115126836,87,"can we not use variable names like `t`? i feel like this makes the code more difficult to read, especially if it ever gets more complex. `terminal_widget` would be more clear",0,0,-1,0.5556793808937073,0.97371643781662,0.5737701654434204,0,accept,majority_agreement
115126866,87,i don't feel like these are good variable names and it makes the code very unclear.,-1,-1,-1,0.9315747618675232,0.9037331938743592,0.9080304503440856,-1,accept,unanimous_agreement
115126894,87,why are you creating a new string `pth` instead of just using the existing string `path`?,0,0,0,0.9792622327804564,0.9946458339691162,0.99029541015625,0,accept,unanimous_agreement
115126902,87,same question here. it seems like `conflict_path` is a better variable name than `pth2`,0,0,0,0.981619119644165,0.9899256229400636,0.9913808703422546,0,accept,unanimous_agreement
115126909,87,let's use `string_builder` instead of `sb`,0,0,0,0.9884929060935974,0.9940528273582458,0.9946721196174622,0,accept,unanimous_agreement
115126960,87,seems like it would be more in keeping with gtk to call this `tab_label`,0,0,0,0.9826085567474364,0.9925324320793152,0.9869297742843628,0,accept,unanimous_agreement
115150547,87,"personally, i find it easier to read (& write) complex code with short variable names otherwise i cannot see the wood for the trees. however, i can easily replace the short variables with longer names in keeping with the preferred style.",0,0,0,0.951628804206848,0.9651266932487488,0.9782527089118958,0,accept,unanimous_agreement
115150573,87,i meant the above to refer to short functions and local variables only.,0,0,0,0.9825097322463988,0.9894418716430664,0.9843133687973022,0,accept,unanimous_agreement
115150608,87,"to quote ric*tz on slack: ""using a function parameter as local-variable is not a good idea and leads to such problems parameters are unowned"".",-1,0,0,0.5550958514213562,0.7897962927818298,0.9361281394958496,0,accept,majority_agreement
115150987,87,"when duplicates were being distinguished by numbers, the tab label was different from the tab name; but now i agree there is no need to distinguish.",0,0,0,0.9828893542289734,0.9826322793960572,0.9892966151237488,0,accept,unanimous_agreement
1827036435,798,"maybe something like this? i don’t think we need to say “dialog”. since there’s multiple ways to enter text from somewhere else, maybe we focus on the copying instead of the pasting/dragging. and the kind of person who needs this probably doesn’t understand what “sudo” or “doas” means so try to use language they would understand. not sure if “administrative” or “advanced” or something else is better here. might need to look at language from like polkit agent or something else to see what we usually use here [code block]",0,0,0,0.8474938869476318,0.8835921287536621,0.9660616517066956,0,accept,unanimous_agreement
1827037295,798,"agree about ""dialog"". ""copied text"" is a bit ambiguous as you can also copy *from* the terminal. again not sure what ""advanced"" means in this context (and what it might be translated to). it is difficult to be precise, unambiguous and succinct all at the same time!",-1,-1,-1,0.6222728490829468,0.8637275099754333,0.5361620187759399,-1,accept,unanimous_agreement
1827037828,798,"okay updated my suggestion to use ""administrative commands"" and stick to ""paste"" here",0,0,0,0.9845119714736938,0.9795294404029846,0.9938095211982728,0,accept,unanimous_agreement
1827037854,798,"""warn when pasted text contains multiple or administrative commands"" short. may be of the vague.",0,0,0,0.9872385263442992,0.7894436717033386,0.9853574633598328,0,accept,unanimous_agreement
1827038419,798,i think that is good - short and clear!,1,1,1,0.9743192195892334,0.9922946691513062,0.9873381853103638,1,accept,unanimous_agreement
1827038829,798,i think that's pretty good. in combination with seeing/interacting with the actual warning dialog i think folks should be able to work out what this setting refers to,1,1,1,0.9137235283851624,0.6779966950416565,0.9598402380943298,1,accept,unanimous_agreement
1827042523,798,"yes. by default it is ""on"". so if they disable it, theyll likely have already interacted with it in the past and connected the dots with the dialog and pasting ""doas"" (unrelated but does it also react to wget outputted to bash ? ive seen too ""oh heres a one liner to download and run this script that fixes your problem"")",0,0,0,0.9290046095848083,0.9356226325035096,0.9727948904037476,0,accept,unanimous_agreement
1827466681,798,"at present it just looks for the words ""sudo"" or ""doas"" so it is pretty dumb. maybe raise an issue if you feel there is a further security threat not covered.",-1,-1,-1,0.9519550800323486,0.9613041281700134,0.9627715349197388,-1,accept,unanimous_agreement
1451531913,743,"instead of keeping ""working-directory"", add ""new-tab"" to the options, the working directory is sent via platform data.",0,0,0,0.9883679747581482,0.99307382106781,0.9942402839660645,0,accept,unanimous_agreement
1451532455,743,"i believe we still want to restore tabs if a working directory is set. also, this change is invalidating the commentary above, it should be removed if this change is to stay.",0,0,0,0.9822497367858888,0.9897525310516356,0.9914600849151612,0,accept,unanimous_agreement
1451534641,743,"you can lookup for ""new-tab"" earlier and then do: [code block]",0,0,0,0.987169623374939,0.9926866292953492,0.9955999851226808,0,accept,unanimous_agreement
1451534732,743,"keep using `command_line.get_cwd()` it's already set to be the directory passed in ""working-directory"" or the directory of the current invocation.",0,0,0,0.985798478126526,0.9947669506072998,0.994041383266449,0,accept,unanimous_agreement
1451535078,743,"you won't need this block if you change ""woking-directory"" to be ""new-tab"" in `handle_local_options()`.",0,0,0,0.9891461133956908,0.9941351413726808,0.9954866766929626,0,accept,unanimous_agreement
1451535126,743,"`environment.get_current_dir()` here (and amost everywhere in the code) is wrong. the only places we can be sure it's correct is in `main()`, `new application()`, `construct`, `local_command_line()`, and `handle_local_options()`.",0,0,0,0.9733566045761108,0.991249680519104,0.9715771675109864,0,accept,unanimous_agreement
1451535343,743,"this is wrong, `environment.get_current_dir()` is the directory of the first invocation (in most of cases, $home), not of the current invocation. for example, assuming terminal was already opened via dock or wingpanel, if the user is in `/home/user/projects/terminal/build` and run `io.elementary.terminal -t --working-directory=../src`, this will try to open `/home/src` not `/home/user/projects/terminal/src`. ps: `-tw ../src` and `--working-directory ../src` will work as expected because they are handled by the shell, so i don't think there's much value on this change.",0,0,0,0.8406276106834412,0.9921833872795104,0.9836320877075196,0,accept,unanimous_agreement
1451535372,743,"this is wrong too, this test is ensuring that we respect the working directory of the remote invocation, `environment.get_current_dir()` isn't it.",0,0,0,0.7328174710273743,0.9603636860847472,0.7598694562911987,0,accept,unanimous_agreement
1451767785,743,i have simplified and clarified this - tabs are always restored for first created window (subject to privacy settings);,0,0,0,0.9845321774482728,0.9682612419128418,0.9926901459693908,0,accept,unanimous_agreement
1451767901,743,i have removed the third parameter for window construction now,0,0,0,0.9881122708320618,0.9923187494277954,0.9948509335517884,0,accept,unanimous_agreement
1451773820,743,ok i'll revert this for now - it can be addressed later if needed.,0,0,0,0.9781752824783324,0.9898825287818908,0.9909274578094482,0,accept,unanimous_agreement
1451778291,743,"i now add ""new-tab"" to the options if ""-w"" option is present.",0,0,0,0.988614559173584,0.9921510219573976,0.9945988655090332,0,accept,unanimous_agreement
649735728,595,this 2 blocks of code (the if...else) are duplicated. i think we could refactor them since the only bit that changes is the string literal.,0,0,0,0.9882986545562744,0.9603828191757202,0.9912264943122864,0,accept,unanimous_agreement
649818071,595,extraneous white space,0,0,0,0.9645521640777588,0.9496827125549316,0.9875553250312804,0,accept,unanimous_agreement
649820028,595,"strictly speaking, the word ""sudo"" might be inside quotes in the pasted text (which may not be a command). maybe rethink this text?",0,0,0,0.985388457775116,0.9360365867614746,0.9879044890403748,0,accept,unanimous_agreement
649820650,595,blank line after if clause recommended.,0,0,0,0.9848506450653076,0.991505205631256,0.992087185382843,0,accept,unanimous_agreement
650576150,595,"what's extraneous here? i removed this comment because it was self-evident from the line below, and there's no extra line here.",0,0,0,0.9359995722770692,0.9722115993499756,0.9895679354667664,0,accept,unanimous_agreement
650576279,595,"this copy is exactly as-is from master, but i can rephrase to `may` to match the multi-line paste text.",0,0,0,0.9896028637886048,0.992328941822052,0.995790958404541,0,accept,unanimous_agreement
650577375,595,"thanks! i suspected it could be cleaned up but hadn't thought about how. i refactored it now, let me know if that makes more sense.",1,1,1,0.9696042537689208,0.9776244163513184,0.9924967288970948,1,accept,unanimous_agreement
650578146,595,isn't the space on the end of the if clasule?,0,0,0,0.9820802211761476,0.9938874840736388,0.9929587841033936,0,accept,unanimous_agreement
650654627,595,"looking much better, thanks!!",1,1,1,0.990053117275238,0.991747260093689,0.9966087341308594,1,accept,unanimous_agreement
651146210,595,am i missing something here? it looks like we destroy no matter what and the `return` would only stop us from calling the destroy that we call anyways before returning?,0,0,0,0.6586443781852722,0.9784017205238342,0.8802791833877563,0,accept,unanimous_agreement
651146798,595,"nvm, i was indeed missing the rest of the function :sweat_smile:",1,0,1,0.599442183971405,0.9613053202629088,0.9889072179794312,1,accept,majority_agreement
651147876,595,"if we're changing these anyways, we should probably remove the forced space and make this a single translatable string [code block]",0,0,0,0.986983060836792,0.992334246635437,0.9908682107925416,0,accept,unanimous_agreement
651342705,595,"these strings were separated in master and i have no idea why, so i left them as-is. but i can combine them.",0,0,0,0.9784358739852904,0.8520084619522095,0.9880962371826172,0,accept,unanimous_agreement
317366039,397,"you should check here that `build_cmdline` is also false, as it currently is a second -x here would not get parsed as a new tab/shell arg :)",0,1,1,0.6296670436859131,0.8975631594657898,0.9182630777359008,1,accept,majority_agreement
317366058,397,"you should add a description of `-x, --` here as well, right? :)",1,1,1,0.8488159775733948,0.9905937910079956,0.970616102218628,1,accept,unanimous_agreement
317392472,397,well spotted - thanks! now fixed.,1,1,1,0.9730200171470642,0.995380997657776,0.994948148727417,1,accept,unanimous_agreement
317392477,397,done,0,0,0,0.976450741291046,0.8974218964576721,0.8682363629341125,0,accept,unanimous_agreement
317455492,397,"i actually meant to add another entry for -x, that way the new argument will show up when you type `--help` :)",1,1,1,0.7940215468406677,0.9401863813400269,0.8922144174575806,1,accept,unanimous_agreement
317556886,397,"oh, i see. this causes some complications as you then have to support a long form option (i note that gnome-terminal does not document the -x or -- flag in the --help output). however, i have implemented this now.",0,0,0,0.9740263223648072,0.7679973840713501,0.9828059077262878,0,accept,unanimous_agreement
658888583,602,"we need to show the path in as the window title, if not overridden. [code block]",0,0,0,0.988576114177704,0.9948563575744628,0.9952811598777772,0,accept,unanimous_agreement
658889683,602,"we need to show the path in as the window title, if not overridden. [code block]",0,0,0,0.988576114177704,0.9948563575744628,0.9952811598777772,0,accept,unanimous_agreement
658906741,602,this causes a regression when there *isn't* a custom prompt set in `.bashrc`. in that case the terminal label is the same as the terminal prompt (and window title) which is not what is wanted. the label should always show the terminal path (disambiguated).,0,0,0,0.9850163459777832,0.9803552627563475,0.9789920449256896,0,accept,unanimous_agreement
658907090,602,see above comment re tab label regression.,0,0,0,0.9876404404640198,0.991741418838501,0.990500271320343,0,accept,unanimous_agreement
658963919,602,"that's because `.bashrc` set a title by default: [code block] elementary use a patch to set the title as `dir: last_cmd` or `actual_cmd`, see: [a link]",0,0,0,0.987916886806488,0.9939809441566468,0.9949353337287904,0,accept,unanimous_agreement
409004740,504,this is not elementary code style - should be: [code block],0,0,0,0.9853705167770386,0.9892317652702332,0.9903562068939208,0,accept,unanimous_agreement
409005930,504,i think you can use a single sequence to move the cursor ` ` places. either `\033[ c` or `\033[ d`,0,0,0,0.9876197576522828,0.9891446232795716,0.9887153506278992,0,accept,unanimous_agreement
409210406,504,"i also thought so, but i did not have the desired effect. instead it moves only one position and deletes the last character. maybe i am doing something wrong... there is also a sequence to move the cursor to a fixed position `esc[line;columnh`. but i was also not able to make it work ...",-1,-1,0,0.888028621673584,0.6137253642082214,0.5376428365707397,-1,accept,majority_agreement
409443714,504,"do you understand why on [a link] the `feed_child` has a diffenerent signature (in comparison to `feed_child (string, int)`)",0,0,0,0.9877213835716248,0.992886245250702,0.994012176990509,0,accept,unanimous_agreement
550649894,556,"rather than just say it was blocked, we should offer a _why_ here. this is also more consistent with the unsafepastedialog. [code block]",0,0,0,0.9849107265472412,0.9945099353790284,0.9918602108955384,0,accept,unanimous_agreement
646022309,556,needs updating,0,0,0,0.9725332856178284,0.9728720784187316,0.9924386143684388,0,accept,unanimous_agreement
646023186,556,"shouldn't construct translatable text like this, if possible. suggest using `printf`. also there is a grammar error. [code block]",0,0,0,0.9080905318260192,0.9435927271842957,0.9201337099075316,0,accept,unanimous_agreement
646023577,556,"distinguish from unsafe paste alert setting. `""show multi-line paste warning""`",0,0,0,0.9795700907707214,0.986115574836731,0.9827783703804016,0,accept,unanimous_agreement
646023976,556,the two if statements can be merged. [code block],0,0,0,0.988459050655365,0.9888235926628112,0.9956194758415222,0,accept,unanimous_agreement
1421499251,753,"you can make this query the window state, that matches the behaviour of gtk.window.fullscreened in gtk4. [code block] then you can do `bind_property (""is-fullscreen"", header, ""decoration-layout-set"", invert_boolean)`.",0,0,0,0.9886730313301086,0.9945129156112672,0.9952566027641296,0,accept,unanimous_agreement
1421499285,753,"this could be set at construction, no?",0,0,0,0.9860512018203736,0.9918640851974488,0.9929788708686828,0,accept,unanimous_agreement
1421561055,753,"yes, that's better - thanks. i was aware that fullscreen () cannot be guaranteed to actually fullscreen the window. that is a nice solution if it works. i am not sure that `bind_property` works with a property that is not backed by a private variable though - `notify` doesn't.",1,1,1,0.9077754616737366,0.9681835174560548,0.9890109896659852,1,accept,unanimous_agreement
1421561147,753,sure.,0,0,0,0.9536533951759338,0.9664214849472046,0.9824982285499572,0,accept,unanimous_agreement
1421571871,753,"glib.binding uses notify underneath, so yeah, i believe you will need to call `notify_property()` in a window_state_event handler for that.",0,0,0,0.5564413070678711,0.9816761016845704,0.9929308891296388,0,accept,unanimous_agreement
1421737035,753,i tried getting this to work but there seems to be some weird timing issues where changing `decoration_layout_set` in `configure-event` has no effect. as this is all going to have to be rewritten for gtk4 anyway i do not want to spend more time on it. is it ok to go with the current solution?,-1,0,-1,0.9326414465904236,0.6997599005699158,0.8745908141136169,-1,accept,majority_agreement
1421770935,753,fine for me.,0,0,0,0.9298515915870668,0.9039547443389891,0.9543207287788392,0,accept,unanimous_agreement
1446503631,753,make sure to style this the same as other title buttons [code block],0,0,0,0.9811970591545104,0.9932531714439392,0.994806945323944,0,accept,unanimous_agreement
1446504225,753,title buttons don't receive keyboard focus [code block],0,0,0,0.9822940826416016,0.984472930431366,0.9891732931137084,0,accept,unanimous_agreement
642856325,590,might as well follow current style and use `var keymap = ...` here.,0,0,0,0.9882912039756776,0.993913233280182,0.9927473664283752,0,accept,unanimous_agreement
642856723,590,might as well use `var geometry = .....` here.,0,0,0,0.9875046610832214,0.9935163259506226,0.9902452230453492,0,accept,unanimous_agreement
642950079,590,done,0,0,0,0.976450741291046,0.8974218964576721,0.8682363629341125,0,accept,unanimous_agreement
642950181,590,done,0,0,0,0.976450741291046,0.8974218964576721,0.8682363629341125,0,accept,unanimous_agreement
1829480600,794,i think we should call `var stripped_text = text.strip ();` here instead of l529 for lesser scope.,0,0,0,0.9875342845916748,0.9908174276351928,0.984861135482788,0,accept,unanimous_agreement
1829485791,794,this return should be no longer necessary due to changes in this pr.,0,0,0,0.9710955619812012,0.9903691411018372,0.9948397278785706,0,accept,unanimous_agreement
1831379144,794,removed var altogether,0,0,0,0.9731595516204834,0.9893445372581482,0.9779136776924132,0,accept,unanimous_agreement
1831379404,794,removed,0,0,0,0.9654131531715392,0.9801433682441713,0.9591778516769408,0,accept,unanimous_agreement
331449841,390,"this color is still being referenced in `io.elementary.terminal.gschema.xml`, as part of ""palette"", and in the method `terminalwidget.restore_settings`. should these be replaced as well, or should the palette be left untouched by this pr? (not sure why there is both a palette, and default fg/bg colors.)",0,0,0,0.9862434267997742,0.9949527978897096,0.9814505577087402,0,accept,unanimous_agreement
331450102,390,"the `.color-dark radio` in application.css still uses this color (with 100% opacity), should probably be changed to the gray color as well?",0,0,0,0.988381326198578,0.9945132732391356,0.9922446608543396,0,accept,unanimous_agreement
331566190,390,"good catch, addressed.",1,1,1,0.9666532278060912,0.9646140336990356,0.9825171828269958,1,accept,unanimous_agreement
331566311,390,"hm, i'm not sure. i believe the palette is used by the vte itself for things like curses. i'm not sure if it should be updated.",-1,-1,0,0.8932096362113953,0.8375791311264038,0.7059921026229858,-1,accept,majority_agreement
331691909,390,"fair enough. if it looks odd in real-world use cases, we can open another pr to fix things.",0,0,0,0.9428054690361024,0.4808534681797027,0.9531382918357848,0,accept,unanimous_agreement
250015115,349,why did you move the namespace out of the class name? i think we are using the previous method in the rest of the apps :),1,1,0,0.9006252288818359,0.9162876605987548,0.9918054342269896,1,accept,majority_agreement
250015891,349,this will crash if the setting schema is not installed (maybe in a different os). see main review comment :),0,1,0,0.909434139728546,0.9693901538848876,0.9293511509895324,0,accept,majority_agreement
250149183,349,not sure - i guess there was a reason at the time ...,0,0,0,0.5416698455810547,0.671036958694458,0.7926973104476929,0,accept,unanimous_agreement
250149238,349,good point,1,1,1,0.9578153491020204,0.9655349254608154,0.9818260669708252,1,accept,unanimous_agreement
307023385,349,left a comment in here? [code block],0,0,0,0.9884976148605348,0.9916313290596008,0.9944830536842346,0,accept,unanimous_agreement
223489504,299,"if this is bound to the setting, does it need to be explicitly marked as active?",0,0,0,0.984512448310852,0.9949725866317748,0.9915012121200562,0,accept,unanimous_agreement
223490830,299,"i tested locally and it appears to still properly check itself when bound to the setting, so i believe this should be removed.",0,0,0,0.976102352142334,0.9865256547927856,0.9925974607467652,0,accept,unanimous_agreement
223497439,299,"i added it so the dialog still has the same default behaviour: showing the dialog if the checkbutton is untouched by the user. the old phrasing requires the user to act to mute the dialog. the new phrasing should still require the user to act. i think this is required to fulfill the requirement ""and have it checked by default."" that your made in the issues description. sorry in advance if maybe i don't get what your mean.",-1,-1,-1,0.9849311113357544,0.9685031771659852,0.9876906871795654,-1,accept,unanimous_agreement
223498149,299,"no worries, it's kind of confusing! but by using a binding to the setting, the check will automatically check itself if that underlying setting is active. the setting is already active by default (controlled by the default gschema), and it must be active to show the dialog in the first place, so this line is just unnecessary.",-1,1,1,0.8748682737350464,0.7832034826278687,0.7669318914413452,1,accept,majority_agreement
223499794,299,alright! very interesting. i remove the line and it's still working.,1,1,1,0.9839858412742616,0.9951332211494446,0.9518482089042664,1,accept,unanimous_agreement
355028020,431,[code block] that way no copy of the input string (which can potentially be huge :man_shrugging:),-1,0,0,0.7176851034164429,0.6728364825248718,0.6218427419662476,0,accept,majority_agreement
364343953,431,why not just remove any trailing new line(s)?,0,0,0,0.974307119846344,0.9767012000083924,0.9917677640914916,0,accept,unanimous_agreement
410965287,431,"leading newlines could also unintentionally execute commands, but if it feels safer to only trim newlines and only trailing ones, then this could be adapted to do that as well.",0,0,0,0.980066418647766,0.9884461164474488,0.9852044582366944,0,accept,unanimous_agreement
415041174,431,we really need to know if we are pasting into the commandline or not. if we are pasting into e.g. vim or an interactive interpreter (?) then we do not want to strip.,0,0,0,0.9739306569099426,0.9435133337974548,0.9867780208587646,0,accept,unanimous_agreement
415234663,431,"that makes sense to me, but i'm unsure if/how we can do that.",-1,0,0,0.5051454305648804,0.8249921798706055,0.9177120923995972,0,accept,majority_agreement
416022102,431,"i have pushed a commit that only processes the pasted text if there is no foreground process. this fixes pasting into terminal editors like nano or vim. also, i noticed that just stripping the string is insufficient to prevent command execution when pasting into the shell as it does not remove embedded newlines. if you really want to prevent this, you have to make sure you only paste one line (without the newline). my commit also does this. the unsafepastedialog (and setting) then becomes redundant as it is only triggered if there is a newline.",0,0,0,0.9612455368041992,0.9778578281402588,0.9574199318885804,0,accept,unanimous_agreement
416033338,431,"yeah i was wondering about embedded newlines as well... but i wonder if this would be too aggressive/different from what people expect. i wonder if we could combine the checking with `sudo` and checking for newlines under the unsafe paste protection? i'll have to think about this a bit. but my initial thought is maybe: - treat newlines similar to how we treat `sudo` for paste protection, i.e. - warn with an unsafe paste dialog (with modified copy) if a pasted command contains a newline - turning unsafe paste protection off also turns off any special handling with newlines - maybe offer a way to paste one line without newlines in the dialog, i.e. as an alternate action? if that seems useful, we could also maybe strip `sudo` out from the sudo version, but idk if that's getting too complicated now.",-1,0,0,0.7635719776153564,0.635016143321991,0.9071134924888612,0,accept,majority_agreement
